Video_Presentation,Abstracts
http://videolectures.net/eccv2016_wilson_rotations_averaging/,"Rotations averaging has become a key subproblem in global Structure from Motion methods. Several solvers exist, but they do not have guarantees of correctness. They can produce high-quality results, but also sometimes fail. Our understanding of what makes rotations averaging problems easy or hard is still very limited. To investigate the difficulty of rotations averaging, we perform a local convexity analysis under an L2 cost function. Although a previous result has shown that in general, this problem is locally convex almost nowhere, we show how this negative conclusion can be reversed by considering the gauge ambiguity. Our theoretical analysis reveals the factors that determine local convexity - noise and graph structure - as well as how they interact, which we describe by a particular Laplacian matrix. Our results are useful for predicting the difficulty of problems, and we demonstrate this on practical datasets. Our work forms the basis of a deeper understanding of the key properties of rotations averaging problems, and we discuss how it can inform the design of future solvers for this important problem."
http://videolectures.net/eccv2016_li_moving_targets/,"We present an end-to-end system for reconstructing complete watertight and textured models of moving subjects such as clothed humans and animals, using only three or four handheld sensors. The heart of our framework is a new pairwise registration algorithm that minimizes, using a particle swarm strategy, an alignment error metric based on mutual visibility and occlusion. We show that this algorithm reliably registers partial scans with as little as 15% overlap without requiring any initial correspondences, and outperforms alternative global registration algorithms. This registration algorithm allows us to reconstruct moving subjects from free-viewpoint video produced by consumer-grade sensors, without extensive sensor calibration, constrained capture volume, expensive arrays of cameras, or templates of the subject geometry."
http://videolectures.net/eccv2016_hand_scalable_structure/,"We introduce a new method for location recovery from pairwise directions that leverages an efficient convex program that comes with exact recovery guarantees, even in the presence of adversarial outliers. When pairwise directions represent scaled relative positions between pairs of views (estimated for instance with epipolar geometry) our method can be used for location recovery, that is the determination of relative pose up to a single unknown scale. For this task, our method yields performance comparable to the state-of-the-art with an order of magnitude speed-up. Our proposed numerical framework is flexible in that it accommodates other approaches to location recovery and can be used to speed up other methods. These properties are demonstrated by extensively testing against state-of-the-art methods for location recovery on 13 large, irregular collections of images of real scenes in addition to simulated data with ground truth."
http://videolectures.net/eccv2016_zhu_shape_analysis/,"The heat kernel is a fundamental solution in mathematical physics to distribution measurement of heat energy within a fixed region over time, and due to its unique property of being invariant to isometric transformations, the heat kernel has been an effective feature descriptor for spectral shape analysis. The majority of prior heat kernel-based strategies of building 3D shape representations fail to investigate the temporal dynamics of heat flows on 3D shape surfaces over time. In this work, we address the temporal dynamics of heat flows on 3D shapes using the long-short term memory (LSTM). We guide 3D shape descriptors toward discriminative representations by feeding heat distributions throughout time as inputs to units of heat diffusion LSTM (HD-LSTM) blocks with a supervised learning structure. We further extend HD-LSTM to a cross-domain structure (CDHD-LSTM) for learning domain-invariant representations of multi-view data. We evaluate the effectiveness of both HD-LSTM and CDHD-LSTM on 3D shape retrieval and sketch-based 3D shape retrieval tasks respectively. Experimental results on McGill dataset and SHREC 2014 dataset suggest that both methods can achieve state-of-the-art performance."
http://videolectures.net/eccv2016_tatarchenko_convolutional_networks/,"We present a convolutional network capable of inferring a 3D representation of a previously unseen object given a single image of this object. Concretely, the network can predict an RGB image and a depth map of the object as seen from an arbitrary view. Several of these depth maps fused together give a full point cloud of the object. The point cloud can in turn be transformed into a surface mesh. The network is trained on renderings of synthetic 3D models of cars and chairs. It successfully deals with objects on cluttered background and generates reasonable predictions for real images of cars."
http://videolectures.net/eccv2016_smith_linear_depth/,"We present a method for estimating surface height directly from a single polarisation image simply by solving a large, sparse system of linear equations. To do so, we show how to express polarisation constraints as equations that are linear in the unknown depth. The ambiguity in the surface normal azimuth angle is resolved globally when the optimal surface height is reconstructed. Our method is applicable to objects with uniform albedo exhibiting di↵use and specular reflectance. We extend it to an uncalibrated scenario by demonstrating that the illumination (point source or first/second order spherical harmonics) can be estimated from the polarisation image, up to a binary convex/concave ambiguity. We believe that our method is the first monocular, passive shape-from-x technique that enables well-posed depth estimation with only a single, uncalibrated illumination condition. We present results on glossy objects, including in uncontrolled, outdoor illumination."
http://videolectures.net/eccv2016_bourmaud_bayesian_motion/,"In this paper, we propose a novel algorithm dedicated to online motion averaging for large scale problems. To this end, we design a filter that continuously approximates the posterior distribution of the estimated transformations. In order to deal with large scale problems, we associate a variational Bayesian approachwith a relative parametrization of the absolute transformations. Such an association allows our algorithm to simultaneously possess two features that are essential for an algorithm dedicated to large scale online motion averaging: (1) a low computational time, (2) the ability to detect wrong loop closure measurements. We extensively demonstrate on several applications (binocular SLAM, monocular SLAM and video mosaicking) that our approach not only exhibits a low computational time and detects wrong loop closures but also significantly outperforms the state of the art algorithm in terms of RMSE."
http://videolectures.net/eccv2016_kim_depth_prediction/,"We present a method for jointly predicting a depth map and intrinsic images from single-image input. The two tasks are formulated in a synergistic manner through a joint conditional random field (CRF) that is solved using a novel convolutional neural network (CNN) architecture, called the joint convolutional neural field (JCNF) model. Tailored to our joint estimation problem, JCNF differs from previous CNNs in its sharing of convolutional activations and layers between networks for each task, its inference in the gradient domain where there exists greater correlation between depth and intrinsic images, and the incorporation of a gradient scale network that learns the confidence of estimated gradients in order to effectively balance them in the solution. This approach is shown to surpass state-of-the-art methods both on single-image depth estimation and on intrinsic image decomposition."
http://videolectures.net/eccv2016_choy_object_recognition/,"We contribute a large scale database for 3D object recognition, named ObjectNet3D, that consists of 100 categories, 90,127 images, 201,888 objects in these images and 44,147 3D shapes. Objects in the 2D images in our database are aligned with the 3D shapes, and the alignment provides both accurate 3D pose annotation and the closest 3D shape annotation for each 2D object. Consequently, our database is useful for recognizing the 3D pose and 3D shape of objects from 2D images. We also provide baseline experiments on four tasks: region proposal generation, 2D object detection, joint 2D detection and 3D object pose estimation, and image-based 3D shape retrieval, which can serve as baselines for future research using our database. Our database is available online at http://​cvgl.​stanford.​edu/​projects/​objectnet3d."
http://videolectures.net/eccv2016_simek_gaussian_processes/,"We propose a robust method for estimating dynamic 3D curvilinear branching structure from monocular images. While 3D reconstruction from images has been widely studied, estimating thin structure has received less attention. This problem becomes more challenging in the presence of camera error, scene motion, and a constraint that curves are attached in a branching structure. We propose a new general-purpose prior, a branching Gaussian processes (BGP), that models spatial smoothness and temporal dynamics of curves while enforcing attachment between them. We apply this prior to fit 3D trees directly to image data, using an efficient scheme for approximate inference based on expectation propagation. The BGP prior’s Gaussian form allows us to approximately marginalize over 3D trees with a given model structure, enabling principled comparison between tree models with varying complexity. We test our approach on a novel multi-view dataset depicting plants with known 3D structures and topologies undergoing small nonrigid motion. Our method outperforms a state-of-the-art 3D reconstruction method designed for non-moving thin structure. We evaluate under several common measures, and we propose a new measure for reconstructions of branching multi-part 3D scenes under motion."
http://videolectures.net/eccv2016_kim_event_camera/,"We propose a method which can perform real-time 3D reconstruction from a single hand-held event camera with no additional sensing, and works in unstructured scenes of which it has no prior knowledge. It is based on three decoupled probabilistic filters, each estimating 6-DoF camera motion, scene logarithmic (log) intensity gradient and scene inverse depth relative to a keyframe, and we build a real-time graph of these to track and model over an extended local workspace. We also upgrade the gradient estimate for each keyframe into an intensity image, allowing us to recover a real-time video-like intensity sequence with spatial and temporal super-resolution from the low bit-rate input event stream. To the best of our knowledge, this is the first algorithm provably able to track a general 6D motion along with reconstruction of arbitrary structure including its intensity and the reconstruction of grayscale video that exclusively relies on event camera data."
http://videolectures.net/eccv2016_wu_single_image/,"Understanding 3D object structure from a single image is an important but difficult task in computer vision, mostly due to the lack of 3D object annotations in real images. Previous work tackles this problem by either solving an optimization task given 2D keypoint positions, or training on synthetic data with ground truth 3D information. In this work, we propose 3D INterpreter Network (3D-INN), an end-to-end framework which sequentially estimates 2D keypoint heatmaps and 3D object structure, trained on both real 2D-annotated images and synthetic 3D data. This is made possible mainly by two technical innovations. First, we propose a Projection Layer, which projects estimated 3D structure to 2D space, so that 3D-INN can be trained to predict 3D structural parameters supervised by 2D annotations on real images. Second, heatmaps of keypoints serve as an intermediate representation connecting real and synthetic data, enabling 3D-INN to benefit from the variation and abundance of synthetic 3D objects, without suffering from the difference between the statistics of real and synthesized images due to imperfect rendering. The network achieves state-of-the-art performance on both 2D keypoint estimation and 3D structure recovery. We also show that the recovered 3D information can be used in other vision applications, such as 3D rendering and image retrieval."
http://videolectures.net/eccv2016_gupta_1d_sensor/,"Structured light-based 3D reconstruction methods often illuminate a scene using patterns with 1D translational symmetry such as stripes, Gray codes or sinusoidal phase shifting patterns. These patterns are decoded using images captured by a traditional 2D sensor. In this work, we present a novel structured light approach that uses a 1D sensor with simple optics and no moving parts to reconstruct scenes with the same acquisition speed as a traditional 2D sensor. While traditional methods compute correspondences between columns of the projector and 2D camera pixels, our ‘dual’ approach computes correspondences between columns of the 1D camera and 2D projector pixels. The use of a 1D sensor provides significant advantages in many applications that operate in short-wave infrared range (0.9–2.5 microns) or require dynamic vision sensors (DVS), where a 2D sensor is prohibitively expensive and difficult to manufacture. We analyze the proposed design, explore hardware alternatives and discuss the performance in the presence of ambient light and global illumination."
http://videolectures.net/eccv2016_kawasaki_grid_pattern/,"For effective endoscopic diagnosis and treatment, size measurement and shape characterization of lesions, such as tumors, is important. For this purpose, 3D endoscopic systems based on active stereo to measure the shape and size of living tissue have recently been proposed. In those works, a large problem is the degree of reconstruction instability due to image blurring caused by the strong subsurface scattering common to internal tissue. To reduce this instability problem, using a coarse pattern for structured light is an option, however it reduces the resolution of the acquired shape information. In this paper, we tackle these shortcomings by developing a new micro pattern laser projector to be inserted in the scope tool channel. There are hardware and software contributions in the paper. First, the new projector uses a Diffractive Optical Element (DOE) instead of a single lens which we proposed to solve the off-focus blur. Second, we propose a new line-based grid pattern with gap coding to counter the subsurface scattering effect. The proposed pattern is a coarse grid pattern so that the grid features are not blurred out by the subsurface scattering. Third, to increase shape resolution of line-based grid pattern, we propose to use a multiple shape data registration technique for the grid-structured shapes, which are acquired sequentially by small motions, is proposed. Quantitative experiments are conducted to show the effectiveness of the method followed by a demonstration using real endoscopic system."
http://videolectures.net/eccv2016_bibi_target_response/,"Most correlation filter (CF) based trackers utilize the circulant structure of the training data to learn a linear filter that best regresses this data to a hand-crafted target response. These circularly shifted patches are only approximations to actual translations in the image, which become unreliable in many realistic tracking scenarios including fast motion, occlusion, etc. In these cases, the traditional use of a single centered Gaussian as the target response impedes tracker performance and can lead to unrecoverable drift. To circumvent this major drawback, we propose a generic framework that can adaptively change the target response from frame to frame, so that the tracker is less sensitive to the cases where circular shifts do not reliably approximate translations. To do that, we reformulate the underlying optimization to solve for both the filter and target response jointly, where the latter is regularized by measurements made using actual translations. This joint problem has a closed form solution and thus allows for multiple templates, kernels, and multi-dimensional features. Extensive experiments on the popular OTB100 benchmark show that our target adaptive framework can be combined with many CF trackers to realize significant overall performance improvement (ranging from 3 %–13.5 % in precision and 3.2 %–13 % in accuracy), especially in categories where this adaptation is necessary (e.g. fast motion, motion blur, etc.)."
http://videolectures.net/eccv2016_kneip_image_matching/,"This work presents an unsupervised learning based approach to the ubiquitous computer vision problem of image matching. We start from the insight that the problem of frame-interpolation implicitly solves for inter-frame correspondences. This permits the application of analysis-by-synthesis: we firstly train and apply a Convolutional Neural Network for frame-interpolation, then obtain correspondences by inverting the learned CNN. The key benefit behind this strategy is that the CNN for frame-interpolation can be trained in an unsupervised manner by exploiting the temporal coherency that is naturally contained in real-world video sequences. The present model therefore learns image matching by simply watching videos. Besides a promise to be more generally applicable, the presented approach achieves surprising performance comparable to traditional empirically designed methods."
http://videolectures.net/eccv2016_chen_state_registration/,"We propose a framework, named Aggregated Wasserstein, for computing a dissimilarity measure or distance between two Hidden Markov Models with state conditional distributions being Gaussian. For such HMMs, the marginal distribution at any time spot follows a Gaussian mixture distribution, a fact exploited to softly match, aka register, the states in two HMMs. We refer to such HMMs as Gaussian mixture model-HMM (GMM-HMM). The registration of states is inspired by the intrinsic relationship of optimal transport and the Wasserstein metric between distributions. Specifically, the components of the marginal GMMs are matched by solving an optimal transport problem where the cost between components is the Wasserstein metric for Gaussian distributions. The solution of the optimization problem is a fast approximation to the Wasserstein metric between two GMMs. The new Aggregated Wasserstein distance is a semi-metric and can be computed without generating Monte Carlo samples. It is invariant to relabeling or permutation of the states. This distance quantifies the dissimilarity of GMM-HMMs by measuring both the difference between the two marginal GMMs and the difference between the two transition matrices. Our new distance is tested on the tasks of retrieval and classification of time series. Experiments on both synthetic data and real data have demonstrated its advantages in terms of accuracy as well as efficiency in comparison with existing distances based on the Kullback-Leibler divergence."
http://videolectures.net/eccv2016_yi_feature_transform/,"We introduce a novel Deep Network architecture that implements the full feature point handling pipeline, that is, detection, orientation estimation, and feature description. While previous works have successfully tackled each one of these problems individually, we show how to learn to do all three in a unified manner while preserving end-to-end differentiability. We then demonstrate that our Deep pipeline outperforms state-of-the-art methods on a number of benchmark datasets, without the need of retraining."
http://videolectures.net/eccv2016_girdhar_vector_representation/,"What is a good vector representation of an object? We believe that it should be generative in 3D, in the sense that it can produce new 3D objects; as well as be predictable from 2D, in the sense that it can be perceived from 2D images. We propose a novel architecture, called the TL-embedding network, to learn an embedding space with these properties. The network consists of two components: (a) an autoencoder that ensures the representation is generative; and (b) a convolutional network that ensures the representation is predictable. This enables tackling a number of tasks including voxel prediction from 2D images and 3D model retrieval. Extensive experimental analysis demonstrates the usefulness and versatility of this embedding."
http://videolectures.net/eccv2016_mettes_action_localization/,"We strive for spatio-temporal localization of actions in videos. The state-of-the-art relies on action proposals at test time and selects the best one with a classifier trained on carefully annotated box annotations. Annotating action boxes in video is cumbersome, tedious, and error prone. Rather than annotating boxes, we propose to annotate actions in video with points on a sparse subset of frames only. We introduce an overlap measure between action proposals and points and incorporate them all into the objective of a non-convex Multiple Instance Learning optimization. Experimental evaluation on the UCF Sports and UCF 101 datasets shows that (i) spatio-temporal proposals can be used to train classifiers while retaining the localization performance, (ii) point annotations yield results comparable to box annotations while being significantly faster to annotate, (iii) with a minimum amount of supervision our approach is competitive to the state-of-the-art. Finally, we introduce spatio-temporal action annotations on the train and test videos of Hollywood2, resulting in Hollywood2Tubes, available at https://staff.fnwi.uva.nl/p.s.m.mettes/index.html#data."
http://videolectures.net/eccv2016_su_egocentric_video/,"In a wearable camera video, we see what the camera wearer sees. While this makes it easy to know roughly what he chose to look at, it does not immediately reveal when he was engaged with the environment. Specifically, at what moments did his focus linger, as he paused to gather more information about something he saw? Knowing this answer would benefit various applications in video summarization and augmented reality, yet prior work focuses solely on the ""what"" question (estimating saliency, gaze) without considering the ""when"" (engagement). We propose a learning-based approach that uses long-term egomotion cues to detect engagement, specifically in browsing scenarios where one frequently takes in new visual information (e.g., shopping, touring). We introduce a large, richly annotated dataset for ego-engagement that is the first of its kind. Our approach outperforms a wide array of existing methods. We show engagement can be detected well independent of both scene appearance and the camera wearer's identity."
http://videolectures.net/eccv2016_danelljan_visual_tracking/,"Discriminative Correlation Filters (DCF) have demonstrated excellent performance for visual object tracking. The key to their success is the ability to efficiently exploit available negative data by including all shifted versions of a training sample. However, the underlying DCF formulation is restricted to single-resolution feature maps, significantly limiting its potential. In this paper, we go beyond the conventional DCF framework and introduce a novel formulation for training continuous convolution filters. We employ an implicit interpolation model to pose the learning problem in the continuous spatial domain. Our proposed formulation enables efficient integration of multi-resolution deep feature maps, leading to superior results on three object tracking benchmarks: OTB-2015 (+5.1% in mean OP), Temple-Color (+4.6% in mean OP), and VOT2015 (20% relative reduction in failure rate). Additionally, our approach is capable of sub-pixel localization, crucial for the task of accurate feature point tracking. We also demonstrate the effectiveness of our learning formulation in extensive feature point tracking experiments."
http://videolectures.net/eccv2016_jayaraman_active_recognition/,"Visual recognition systems mounted on autonomous moving agents face the challenge of unconstrained data, but simultaneously have the opportunity to improve their performance by moving to acquire new views of test data. In this work, we first show how a recurrent neural network-based system may be trained to perform end-to-end learning of motion policies suited for this “active recognition” setting. Further, we hypothesize that active vision requires an agent to have the capacity to reason about the effects of its motions on its view of the world. To verify this hypothesis, we attempt to induce this capacity in our active recognition pipeline, by simultaneously learning to forecast the effects of the agent’s motions on its internal representation of the environment conditional on all past views. Results across two challenging datasets confirm both that our end-to-end system successfully learns meaningful policies for active category recognition, and that “learning to look ahead” further boosts recognition performance."
