Video_Presentation,Abstracts
http://videolectures.net/icaps2011_machado_polytime/,"We present a software tool that is able to automatically translate an NP problem into a STRIPS problem such that the former problem has a solution if the latter has one, a solution for the latter can be transformed into a solution for the former, and all this can be done efficiently. Moreover, the tool is built such that it only produces problems that belong to a fragment of STRIPS that is solvable in non-deterministic polynomial time, a fact that guarantees that the whole approach is not an overkill. This tool has interesting applications. For example, with the advancement of planning technology, it can be used as an off-the-shelf method to solve general NP problems with the help of planners and to automatically generate benchmark problems of known complexity in a systematic and controlled manner. Another interesting contribution is related to the area of Knowledge Engineering in which one of the goals is to devise automatic methods for using the available planning technology to solve real-life problems."
http://videolectures.net/icaps2011_bonet_landmarks/,A collection of landmarks is complete if the cost of a minimum-cost hitting set equals h+ and there is a minimum-cost hitting set that is an optimal relaxed plan. We present an algorithm for generating a complete collection of landmarks and we show that this algorithm can be extended into effective polytime heuristics for optimal and satisficing planning. The new admissible heuristics are compared with current state-of-the-art heuristics for optimal planning on benchmark problems from the IPC.
http://videolectures.net/icaps2011_keller_polynomial/,"Most predominant approaches in probabilistic planning utilize techniques from the more thoroughly investigated field of classical planning by determinizing the problem at hand. In this paper, we present a method to map probabilistic operators to an equivalent set of probabilistic operators in a novel normal form, requiring polynomial time and space. From this, we directly derive a determinization which can be used for, e.g., replanning strategies incorporating a classical planning system. Unlike previously described all outcome determinizations, the number of deterministic operators is not exponentially but polynomially bounded in the number of parallel probabilistic effects, enabling the use of more sophisticated determinization-based techniques in the future."
http://videolectures.net/icaps2011_mansley_markov/,"In this paper, we present a new algorithm that integrates recent advances in solving continuous bandit problems with sample-based rollout methods for planning in Markov Decision Processes (MDPs). Our algorithm, Hierarchical Optimistic Optimization applied to Trees (HOOT) addresses planning in continuous-action MDPs. Empirical results are given that show that the performance of our algorithm meets or exceeds that of a similar discrete action planner by eliminating the problem of manual discretization of the action space."
http://videolectures.net/icaps2011_bryce_domains/,"Engineering complete planning domain descriptions is often very costly because of human error or lack of domain knowledge. Learning complete domain descriptions is also very challenging because many features are irrelevant to achieving the goals and data may be scarce. We present a planner and agent that respectively plan and act in incomplete domains by i) synthesizing plans to avoid execution failure due to ignorance of the domain model, and ii) passively learning about the domain model during execution to improve later re-planning attempts. Our planner DeFault is the first to reason about a domain’s incompleteness to avoid potential plan failure. DeFault computes failure explanations for each action and state in the plan and counts the number of interpretations of the incomplete domain where failure will occur. We show that DeFault performs best by counting prime implicants (failure diagnoses) rather than propositional models. Our agent Goalie learns about the preconditions and effects of incompletely-specified actions while monitoring its state and, in conjunction with DeFault plan failure explanations, can diagnose past and future action failures. We show that by reasoning about incompleteness (as opposed to ignoring it) Goalie fails and re-plans less and executes fewer actions."
http://videolectures.net/icaps2011_to_contingent/,"This paper introduces a highly competitive contingent planner, that uses the novel idea of encoding belief states as disjunctive normal form formulae (To et al. 2009), for the search for solutions in the belief state space. In (To et al. 2009), a complete transition function for computing successor belief states in the presence of incomplete information has been defined. This work extends the function to handle non-deterministic and sensing actions in the AND/OR forward search paradigm for contingent planning solutions. The function allows one, under reasonable assumptions, to compute successor belief states efficiently, i.e., in polynomial time. The paper also presents a novel variant of an AND/OR search algorithm, called PrAO (Pruning AND/OR search), which allows the planner to significantly prune the search space; furthermore, by the time a solution is found, the remaining search graph is also the solution tree for the contingent planing problem. The strength of these techniques is confirmed by the empirical results obtained from a large set of benchmarks available in the literature."
http://videolectures.net/icaps2011_gefen_seed/,"This paper defines and studies a new, interesting, and challenging benchmark problem that originates in systems biology. The minimal seed-set problem is defined as follows: given a description of the metabolic reactions of an organism, characterize the minimal set of nutrients with which it could synthesize all nutrients it is capable of synthesizing. Current methods used in systems biology yield only approximate solutions. And although it is natural to cast it as a planning problem, current optimal planners are unable to solve it, while non-optimal planners return plans that are very far from optimal. As a planning problem, it is inherently delete-free, has many zero-cost actions, all propositions are landmarks, and many legal permutations of the plan exist. We show how a simple uninformed search algorithm that exploits inherent independence between sub-goals can solve it optimally by reducing the branching factor drastically."
http://videolectures.net/icaps2011_tipaldi_robots/,"As robots enter environments that they share with people, human-aware planning and interaction become key tasks to be addressed. For doing so, robots need to reason about the places and times when and where humans are engaged into which activity and plan their actions accordingly. In this paper, we first address this issue by learning a non homogenous spatial Poisson process whose rate function encodes the occurrence probability of human activities in space and time. We then present two planning problems for human robot interaction in social environments. The first one is the maximum encounter probability planning problem, where a robot aims to find the path along which the probability of encountering a person is maximized. We are interested in two versions of this problem, with deadlines or with a certainty quota. The second one is the minimum interference coverage problem, where a robot performs a coverage task in a socially compatible way by reducing the hindrance or annoyance caused to people. An example is a noisy vacuum robot that has to cover the whole apartment having learned that at lunch time the kitchen is a bad place to clean. Formally, the problems are time dependent variants of known planning problems: MDPs and price collecting TSP for the first problem and the asymmetric TSP for the second. The challenge is that the cost functions of the arcs and nodes vary with time, and that execution time is more important that optimality, given the real-time constraints in robotic systems. We present experimental results using variants of known planners and formulate the problems as benchmarks to the community."
http://videolectures.net/icaps2011_koehler_applications/,"Disclaimer: VideoLectures.NET emphasizes that this talk was not recorded in its full duration but due to its content value was published with the permission of the author. In this talk, I will review some of my personal experiences made when applying AI planning to industrial problems and review one of the most successful planning applications in the area of elevator control.  I also take a quick look at current planners and briefly discuss how they could be made more ready for practical applications, however, this requires efforts in areas that are appreciated by real users, but not so much rewarded by the academic value system."
