Video_Presentation,Abstracts
http://videolectures.net/bmvc2012_alexiou_categorical_opponency/,"Recent progress has been made on sparse dictionaries for the Bag-of-Visual-Words (BOVW) approach to object recognition and scene categorization. In particular, jointly encoded words have been shown to greatly enhance retrieval and categorization performance by both improving dictionary sparsity, which impacts efficiency of retrieval, and improving the selectivity of categorization. In this paper, we suggest and evaluate different functions for the “soft-pairing” of words, whereby the likelihood of pairing is influenced by proximity and scale of putative word pairs. The methods are evaluated in both the Caltech-101 database and the Pascal VOC 2007 and 2011 databases. The results are compared against spatial pyramids using BOVW descriptions, standard BOVW approaches, and across different parameter values of pairing functions. We also compare dense and keypoint-based approaches in this context. One conclusion is that word pairing provides a means towards attaining the performance of much larger dictionary sizes without the computational effort of clustering. This lends it to situations where the dictionaries must be frequently relearned, or where image statistics frequently change."
http://videolectures.net/bmvc2012_sapienza_labelled_videos/,"Current state-of-the-art action classification methods extract feature representations from the entire video clip in which the action unfolds, however this representation may include irrelevant scene context and movements which are shared amongst multiple action classes. For example, a waving action may be performed whilst walking, however if the walking movement and scene context appear in other action classes, then they should not be included in a waving movement classifier. In this work, we propose an action classification framework in which more discriminative action subvolumes are learned in a weakly supervised setting, owing to the difficulty of manually labelling massive video datasets. The learned models are used to simultaneously classify video clips and to localise actions to a given space-time subvolume. Each subvolume is cast as a bag-offeatures (BoF) instance in a multiple-instance-learning framework, which in turn is used to learn its class membership. We demonstrate quantitatively that even with single fixedsized subvolumes, the classification performance of our proposed algorithm is superior to the state-of-the-art BoF baseline on the majority of performance measures, and shows promise for space-time action localisation on the most challenging video datasets."
http://videolectures.net/bmvc2012_zheng_transferable_dictionary/,"Discriminative appearance features are effective for recognizing actions in a fixed view, but generalize poorly to changes in viewpoint. We present a method for viewinvariant action recognition based on sparse representations using a transferable dictionary pair. A transferable dictionary pair consists of two dictionaries that correspond to the source and target views respectively. The two dictionaries are learned simultaneously from pairs of videos taken at different views and aim to encourage each video in the pair to have the same sparse representation. Thus, the transferable dictionary pair links features between the two views that are useful for action recognition. Both unsupervised and supervised algorithms are presented for learning transferable dictionary pairs. Using the sparse representation as features, a classifier built in the source view can be directly transferred to the target view. We extend our approach to transferring an action model learned from multiple source views to one target view. We demonstrate the effectiveness of our approach on the multi-view IXMAS data set. Our results compare favorably to the the state of the art."
http://videolectures.net/bmvc2012_fu_video_retrieval/,"In this work, we focus on developing features and approaches to represent and analyze videography styles in unconstrained videos. By unconstrained videos, we mean typical consumer videos with significant content complexity and diverse editing artifacts, mostly with long duration. Our approach constructs a videography dictionary, which is used to represent each video clip as a series of varying videography words. In addition to conventional features such as camera motion and foreground object motion, two novel features including motion correlation and scale information are introduced to characterize videography. Then, we show that unique videography signatures from different events can be automatically identified, using statistical analysis methods. For practical applications, we explore the use of videography analysis for content-based video retrieval and video summarization. We compare our approaches with other methods on a large unconstrained video dataset, and demonstrate that our approach benefits video analysis."
http://videolectures.net/bmvc2012_satkin_scene_understanding/,"In this paper, we propose a data-driven approach to leverage repositories of 3D models for scene understanding. Our ability to relate what we see in an image to a large collection of 3D models allows us to transfer information from these models, creating a rich understanding of the scene. We develop a framework for auto-calibrating a camera, rendering 3D models from the viewpoint an image was taken, and computing a similarity measure between each 3D model and an input image. We demonstrate this data-driven approach in the context of geometry estimation and show the ability to find the identities and poses of object in a scene. Additionally, we present a new dataset with annotated scene geometry. This data allows us to measure the performance of our algorithm in 3D, rather than in the image plane."
http://videolectures.net/bmvc2012_berg_face_verification/,"We propose a method of face verification that takes advantage of a reference set of faces, disjoint by identity from the test faces, labeled with identity and face part locations. The reference set is used in two ways. First, we use it to perform an “identity-preserving” alignment, warping the faces in a way that reduces differences due to pose and expression but preserves differences that indicate identity. Second, using the aligned faces, we learn a large set of identity classifiers, each trained on images of just two people. We call these “Tom-vs-Pete” classifiers to stress their binary nature. We assemble a collection of these classifiers able to discriminate among a wide variety of subjects and use their outputs as features in a same-or-different classifier on face pairs. We evaluate our method on the Labeled Faces in the Wild benchmark, achieving an accuracy of 93.10%, significantly improving on the published state of the art."
http://videolectures.net/bmvc2012_martins_conjugate_priors/,"This work presents a novel Bayesian formulation for aligning faces in unseen images. Our approach is closely related to Constrained Local Models (CLM) and Active Shape Models (ASM), where an ensemble of local feature detectors are constrained to lie within the subspace spanned by a Point Distribution Model (PDM). Fitting a model to an image typically involves two steps: a local search using a detector, obtaining response maps for each landmark (likelihood term) and a global optimization that finds the PDM parameters that jointly maximize all the detection responses. The global optimization can be seen as a Bayesian inference problem, where the posterior distribution of the PDM parameters (including pose) can be inferred in a maximum a posteriori (MAP) sense. Faces are nonrigid structures described by continuous dynamic transitions, so it is crucial to account for the underlying dynamics of the shape. We present a novel Bayesian global optimization strategy, where the prior is used to encode the dynamic transitions of the PDM parameters. Using recursive Bayesian estimation we model the prior distribution of the data as being Gaussian. The mean and covariance were assumed to be unknown and treated as random variables. This means that we estimate not only the mean and the covariance but also the probability distribution of the mean and the covariance (using conjugate priors). Extensive evaluations were performed on several standard datasets (IMM, BioID, XM2VTS and FGNET Talking Face) against state-ofthe- art methods while using the same local detectors. Finally, qualitative results taken from the challenging Labeled Faces in the Wild (LFW) dataset are also shown."
http://videolectures.net/bmvc2012_anderson_spanning_tree/,"We present a method for producing dense Active Appearance Models (AAMs), suitable for video-realistic synthesis. To this end we estimate a joint alignment of all training images using a set of pairwise registrations and ensure that these pairwise registrations are only calculated between similar images. This is achieved by defining a graph on the image set whose edge weights correspond to registration errors and computing a bounded diameter minimum spanning tree (BDMST). Dense optical flow is used to compute pairwise registration and we introduce a flow refinement method to align small scale texture. Once registration between training images has been established we propose a method to add vertices to the AAM in a way that minimises error between the observed flow fields and a flow field interpolated between the AAM mesh points. We demonstrate a significant improvement in model compactness using the proposed method and show it dealing with cases that are problematic for current state-of-the-art approaches."
http://videolectures.net/bmvc2012_besse_belief_propagation/,"PatchMatch is a simple, yet very powerful and successful method for optimizing continuous labelling problems. The algorithm has two main ingredients: the update of the solution space by sampling and the use of the spatial neighbourhood to propagate samples. We show how these ingredients are related to steps in a specific form of belief propagation in the continuous space, called Particle Belief Propagation (PBP). However, PBP has thus far been too slow to allow complex state spaces. We show that unifying the two approaches yields a new algorithm, PMBP, which is more accurate than PatchMatch and orders of magnitude faster than PBP. To illustrate the benefits of our PMBP method we have built a new stereo matching algorithm with unary terms which are borrowed from the recent PatchMatch Stereo work and novel realistic pairwise terms that provide smoothness. We have experimentally verified that our method is an improvement over state-of-the-art techniques at sub-pixel accuracy level."
http://videolectures.net/bmvc2012_alcantarilla_deformable_deconstruction/,"Deformable 3D reconstruction from 2D images requires prior knowledge on the scene structure. Template-free methods use generic prior knowledge such as piecewise smoothness but require multiple images with significant baseline. Template-based methods require only one image but handle only one object for which they need specific prior knowledge, namely a 3D template. We here propose a novel method that alleviates the strong assumptions of both the template-free and template-based methods: our method uses multiple templates to achieve deformable 3D reconstruction from only one image and for multiple objects. It uses object recognition to automatically discover what objects are visible in the input image and to select the appropriate templates for deformable 3D reconstruction. The object database is built offline. Crucially, this database does not only contain appearance descriptors as in existing object recognition frameworks, but also material properties to facilitate deformable 3D reconstruction. We show successful experimental results with objects made of various materials such as paper, cloth and plastic."
http://videolectures.net/bmvc2012_indelman_bundle_adjustment/,"Fast and reliable bundle adjustment is essential in many applications such as mobile vision, augmented reality, and robotics. Two recent ideas to reduce the associated computational cost are structure-less SFM (structure from motion) and incremental smoothing. The former formulates the cost function in terms of multi-view constraints instead of re-projection error, thereby eliminating the 3D structure from the optimization. The latter was developed in the SLAM (simultaneous localization and mapping) community and allows one to perform efficient incremental optimization, adaptively identifying the variables that need to be recomputed at each step. In this paper we combine these two key ideas into a computationally efficient bundle adjustment method, and additionally introduce the use of three-view constraints to remedy commonly encountered degenerate camera motions. We formulate the problem in terms of a factor graph, and incrementally update a directed junction tree which keeps track of the current best solution. Typically, only a small fraction of the camera poses are recalculated in each optimization step, leading to a significant computational gain. If desired, all or some of the observed 3D points can be reconstructed based on the optimized camera poses. To deal with degenerate motions, we use both two and three-view constraints between camera poses, which allows us to maintain a consistent scale during straight-line trajectories. We validate our approach using synthetic and real-imagery datasets and compare it to standard bundle adjustment, in terms of performance, robustness and computational cost."
http://videolectures.net/bmvc2012_bevilacqua_neighbor_embedding/,"This paper describes a single-image super-resolution (SR) algorithm based on nonnegative neighbor embedding. It belongs to the family of single-image example-based SR algorithms, since it uses a dictionary of low resolution (LR) and high resolution (HR) trained patch pairs to infer the unknown HR details. Each LR feature vector in the input image is expressed as the weighted combination of its K nearest neighbors in the dictionary; the corresponding HR feature vector is reconstructed under the assumption that the local LR embedding is preserved. Three key aspects are introduced in order to build a low-complexity competitive algorithm: (i) a compact but efficient representation of the patches (feature representation) (ii) an accurate estimation of the patches by their nearest neighbors (weight computation) (iii) a compact and already built (therefore external) dictionary, which allows a one-step upscaling. The neighbor embedding SR algorithm so designed is shown to give good visual results, comparable to other state-of-the-art methods, while presenting an appreciable reduction of the computational time."
http://videolectures.net/bmvc2012_hu_pose_subspace/,"Camera shake during exposure time often results in non-uniform blur across the entire image. Recent algorithms model the non-uniform blurry image as a linear combination of images observed by the camera at discretized poses, and focus on estimating the time fraction positioned at each pose. While these algorithms show promising results, they nevertheless entail heavy computational loads. In this work, we propose a novel single image deblurring algorithm to remove non-uniform blur. We estimate the local blur kernels at different image regions and obtain an initial guess of possible camera poses using backprojection. By restraining the possible camera poses in a low-dimensional subspace, we iteratively estimate the weight for each pose in the camera pose space. Experimental validations with the state-of-the-art methods demonstrate the efficiency and effectiveness of our algorithm for non-uniform deblurring."
