0,1
http://videolectures.net/eswc2015_wohlgenannt_ontology_learning/,"Ontology learning (OL) aims at the (semi-)automatic acquisition of ontologies from sources of evidence, typically domain text. Recently, there has been a trend towards the application of multiple and heterogeneous evidence sources in OL. Heterogeneous sources provide benefits, such as higher accuracy by exploiting redundancy across evidence sources, and including complementary information. When using evidence sources which are heterogeneous in quality, amount of data provided and type, then a number of questions arise, for example: How many sources are needed to see significant benefits from heterogeneity, what is an appropriate number of evidences per source, is balancing the number of evidences per source important, and to what degree can the integration of multiple sources overcome low quality input of individual sources? This research presents an extensive evaluation based on an existing OL system. It gives answers and insights on the research questions posed for the OL task of concept detection, and provides further hints from experience made. Among other things, our results suggest that a moderate number of evidences per source as well as a moderate number of sources resulting in a few thousand data instances are sufficient to exploit the benefits of heterogeneous evidence integration."
http://videolectures.net/eswc2015_pinkel_data_integration/,"A major challenge in information management today is the integration of huge amounts of data distributed across multiple data sources. A suggested approach to this problem is ontology-based data integration where legacy data systems are integrated via a common ontology that represents a unified global view over all data sources. However, data is often not natively born using these ontologies. Instead, much data resides in legacy relational databases. Therefore, mappings that relate the legacy relational data sources to the ontology need to be constructed. Recent techniques and systems that automatically construct such mappings have been developed. The quality metrics of these systems are, however, often only based on self-designed benchmarks. This paper introduces a new publicly available benchmarking suite called RODI, which is designed to cover a wide range of mapping challenges in Relationalto- Ontology Data I ntegration scenarios. RODI provides a set of different relational data sources and ontologies (representing a wide range of mapping challenges) as well as a scoring function with which the performance of relational-to-ontology mapping construction systems may be evaluated."
http://videolectures.net/eswc2015_stellato_web_application/,"We introduce VocBench, an open source web application for editing thesauri complying with the SKOS and SKOS-XL standards. VocBench has a strong focus on collaboration, supported by workflow management for content validation and publication. Dedicated user roles provide a clean separation of competences, addressing different specificities ranging from management aspects to vertical competences on content editing, such as conceptualization versus terminology editing. Extensive support for scheme management allows editors to fully exploit the possibilities of the SKOS model, as well as to fulfill its integrity constraints. We discuss thoroughly the main features of VocBench, detail its architecture, and evaluate it under both a functional and user-appreciation ground, through a comparison with state-of-the-art and user questionnaires analysis, respectively. Finally, we provide insights on future developments."
http://videolectures.net/eswc2015_alexopoulos_resolution_systems/,"Named Entity Resolution (NER) is an information extraction task that involves detecting mentions of named entities within texts and mapping them to their corresponding entities in a given knowledge resource. Systems and frameworks for performing NER have been developed both by the academia and the industry with different features and capabilities. Nevertheless, what all approaches have in common is that their satisfactory performance in a given scenario does not constitute a trustworthy predictor of their performance in a different one, the reason being the scenario’s different characteristics (target entities, input texts, domain knowledge etc.). With that in mind, in this paper we describe a metric-based Diagnostic Framework that can be used to identify the causes behind the low performance of NER systems in industrial settings and take appropriate actions to increase it."
http://videolectures.net/eswc2015_dragoni_reality_scenarios/,"Serious games with 3D interfaces are Virtual Reality (VR) systems that are becoming common for the training of military and emergency teams. A platform for the development of serious games should allow the addition of semantics to the virtual environment and the modularization of the artificial intelligence controlling the behaviors of non-playing characters in order to support a productive end-user development environment. In this paper, we report the ontology design activity performed in the context of the PRESTO project aiming to realize a conceptual model able to abstract the developers from the graphical and geometrical properties of the entities in the virtual reality, as well as the behavioral models associated to the non-playing characters. The feasibility of the proposed solution has been validated through real-world examples and discussed with the actors using the modeled ontologies in every day practical activities."
http://videolectures.net/eswc2015_osenberg_architecture_analysis/,"Enterprise Architecture (EA) models are established means for decision makers in organizations. They describe the business processes, the application landscape and IT infrastructure as well as the relationships between those layers. Current research focuses merely on frameworks, modeling and documentation approaches for EA. But once these models are established, methods for their analysis are rare. In this paper we propose the use of semantic web technologies in order to represent the EA and perform analyses. We present an approach how to transform an existing EA model into an ontology. Using this knowledge base, simple questions can be answered with the query language SPARQL. The major benefits of semantic web technologies can be found, when defining and applying more complex analyses. Change impact analysis is important to estimate the effects and costs of a change to an EA model element. To show the benefits of semantic web technologies for EA, we implemented an approach to change impact analysis and executed it within a case study."
http://videolectures.net/eswc2015_dimitrova_tunnel_diagnosis/,"A Decision Support System (DSS) in tunnelling domain deals with identifying pathologies based on disorders present in various tunnel portions and contextual factors affecting a tunnel. Another key area in diagnosing pathologies is to identify regions of interest (ROI). In practice, tunnel experts intuitively abstract regions of interest by selecting tunnel portions that are susceptible to the same types of pathologies with some distance approximation. This complex diagnosis process is often subjective and poorly scales across cases and transport structures. In this paper, we introduce PADTUN system, a working prototype of a DSS in tunnelling domain using semantic technologies. Ontologies are developed and used to capture tacit knowledge from tunnel experts. Tunnel inspection data are annotated with ontologies to take advantage of inferring capabilities offered by semantic technologies. In addition, an intelligent mechanism is developed to exploit abstraction and inference capabilities to identify ROI. PADTUN is developed in real-world settings offered by the NeTTUN EU Project and is applied in a tunnel diagnosis use case with Société Nationale des Chemins de Fer Français (SNCF), France. We show how the use of semantic technologies allows addressing the complex issues of pathology and ROI inferencing and matching experts’ expectations of decision support."
http://videolectures.net/eswc2015_cherny_russian_heritage/,"In this paper we present an architecture and approach to publishing open linked data in the cultural heritage domain. We demonstrate our approach for building a system both for data publishing and consumption and show how user benefits can be achieved with semantic technologies. For domain knowledge representation the CIDOC-CRM ontology is used. As a main source of trusted data, we use the data of the web portal of the Russian Museum. For data enrichment we selected DBpedia and the published Linked Data of the British Museum. The evaluation shows the potential of semantic applications for data publishing in contextual environment, semantic search, visualization and automated enrichment according to needs and expectations of art experts and regular museum visitors."
http://videolectures.net/eswc2015_lu_linked_data/,"Various studies have reported on inefficiencies of existing travel search engines, and user frustration generated through hours of searching and browsing, often with no satisfactory results. Not only do the users fail to find the right offer in the myriad of websites, but they end up browsing through many offers that do not correspond to their criteria. The Semantic Web framework is a reasonable candidate to improve this. In this paper, we present a semantic travel offer search system named “RE-ONE (Relevance Engine-One)”. We especially highlight its ability to help users formulate better search queries. An example of a permitted query is in Croatia at the seaside where there is Vegetarian Restaurant. We conducted two experiments to evaluate the Query Auto-completion mechanism. The results showed that our system outperforms the Google Custom Search baseline. Queries freely conducted in RE-ONE are shown to be 63.4 % longer in terms of number of words and 27 % richer in terms of number of search criteria. RE-ONE supports better users’ query formulation process by giving suggestions in greater accordance with users’ idea flow."
http://videolectures.net/eswc2015_meusel_schema_org/,"Being promoted by major search engines such as Google, Yahoo!, Bing, and Yandex, Microdata embedded in web pages, especially using schema.org, has become one of the most important markup languages for the Web. However, deployed Microdata is most often not free from errors, which limits its practical use. In this paper, we use the WebDataCommons corpus of Microdata extracted from more than 250 million web pages for a quantitative analysis of common mistakes in Microdata provision. Since it is unrealistic that data providers will provide clean and correct data, we discuss a set of heuristics that can be applied on the data consumer side to fix many of those mistakes in a post-processing step. We apply those heuristics to provide an improved knowledge base constructed from the raw Microdata extraction."
http://videolectures.net/eswc2015_mavlyutov_web_data/,"Uniform Resource Identifiers (URIs) are one of the corner stones of the Web; They are also exceedingly important on the Web of data, since RDF graphs and Linked Data both heavily rely on URIs to uniquely identify and connect entities. Due to their hierarchical structure and their string serialization, sets of related URIs typically contain a high degree of redundant information and are systematically dictionarycompressed or encoded at the back-end (e.g., in the triple store). The paper represents, to the best of our knowledge, the first systematic comparison of the most common data structures used to encode URI data. We evaluate a series of data structures in term of their read/write performance and memory consumption."
http://videolectures.net/eswc2015_debattista_linked_datasets/,"With the increasing application of Linked Open Data, assessing the quality of datasets by computing quality metrics becomes an issue of crucial importance. For large and evolving datasets, an exact, deterministic computation of the quality metrics is too time consuming or expensive. We employ probabilistic techniques such as Reservoir Sampling, Bloom Filters and Clustering Coefficient estimation for implementing a broad set of data quality metrics in an approximate but sufficiently accurate way. Our implementation is integrated in the comprehensive data quality assessment framework Luzzu. We evaluated its performance and accuracy on Linked Open Datasets of broad relevance."
http://videolectures.net/eswc2014_staab_semantic_web/,"The Semantic Web changes the way we deal with data, because assumptions about the nature of the data that we deal with differ substantially from the ones in established database approaches. Semantic Web data is (i) provided by different people in an ad-hoc manner, (ii) distributed, (iii) semi-structured, (iv) (more or less) typed, (v) supposed to be used serendipitously. In fact, these are highly relevant assumptions and challenges, because they are frequently encountered in all kind of data-centric challenges – also in cases where Semantic Web standards are not in use. However, they are only partially accounted for in existing programming approaches for Semantic Web data including (i) semantic search, (ii) graph programming, and (iii) traditional database programming approaches.  The main hypothesis of this talk is that we have not yet developed the right kind of programming paradigms to deal with the proper nature of Semantic Web data, because none of the mentioned approaches fully considers its characteristics. Thus, I want to outline empirical investigations of Semantic Web data and recent developments towards Semantic Web programming that target the reduction of the impedance mismatch between data engineering and programming approaches."
http://videolectures.net/eswc2014_floridi_semantics_autonomy/,"The lecture is divided into four parts. In the first part, I offer a brief and simple introduction to four well-known senses in which different scientific fields speak of complexity, namely state complexity, Kolmogorov complexity, computational complexity, and programming complexity. I then suggest an intuitive way in which they can all be linked in a conceptual, unified view. Against this background, in the second part, I outline a new concept of complexity, which I shall call coordination complexity. This completes the unified view. I then argue, in the third part, that the semantic web helps us dealing with problems with increasingly high degree of coordination complexity, which require the mobilisation of whole systems to be tackled. In the last and concluding part, I highlight one of the consequences of the resolution of problems with high degree of coordination complexity: the predictability and manipulability of autonomous choices."
http://videolectures.net/eswc2014_tresp_machine_learning/,"Most successful applications of statistical machine learning focus on response learning or signal-reaction learning where an output is produced as a direct response to an input. An important feature is a quick response time, the basis for, e.g., real-time ad-placement on the Web, real-time address reading in postal automation, or a fast reaction to threats for a biological being. One might argue that knowledge about specific world entities and their relationships is necessary if the complexity of an agent's world increases, for example if an agent needs to function in a complex social community. As one is quite aware in the Semantic Web community, a natural representation of knowledge about entities and their relationships is a directed labeled graph where nodes represent entities and where a labeled link stands for a true fact. A number of successful graph-based knowledge representations, such as DBpedia, YAGO, or the Google Knowledge Graph, have recently been developed and are the basis of applications ranging from the support of search to the realization of question answering systems. Statistical machine learning can play an important role in knowledge graphs as well. By exploiting statistical relational patterns one can predict the likelihood of new facts, find entity clusters and determine if two entities refer to the same real world object. Furthermore, one can analyze new entities and map them to existing entities (recognition) and predict likely relations for the new entity. These learning tasks can elegantly be approached by first transforming the knowledge graph into a 3-way tensor where two of the modes represent the entities in the domain and the third mode represents the relation type. Generalization is achieved by tensor factorization using, e.g., the RESCAL approach. A particular feature of RESCAL is that it exhibits collective learning where information can propagate in the knowledge graph to support a learning task. In the presentation the RESCAL approach will be introduced and applications of RESCAL to different learning and decision tasks will be presented."
http://videolectures.net/eswc2014_presutti_panel/,"On March 12th, in occasion of the 25th birthday of the World Wide Web, Sir Tim Berners-Lee made an open call for a “Magna Carta” to protect Web users. He said: ""It's time for us to make a big communal decision. In front of us are two roads — which way are we going to go? Are we going to continue on the road and just allow the governments to do more and more and more control — more and more surveillance? Or are we going to set up a bunch of values? Are we going to set up something like a Magna Carta for the World Wide Web and say, actually, now it's so important, so much part of our lives, that it becomes on a level with human rights?"" We all know that guaranteeing privacy and security at the same time in a world without the WWW is a challenge, and that each country addresses it in a different way by means of local regulations as well as international agreements. Identifying the right tradeoff on the Web is probably even more complicated, as we deal with a virtual world, where geographical borders loose their importance and role.  The aim of this panel is to identify and discuss the most important issues that should be addressed in order to guarantee web users privacy, on one hand, without putting their security in danger, and web users security, on the other hand, without limiting their freedom by invading their private lives. Can semantics play any role in this trade-off?  We ask our panelists to summarize in three main statements their view on, and possibly their solution to, this problem, hence giving their advice to the definition of a Web users “Magna Carta”."
http://videolectures.net/eswc2014_alani_panel/,"Many projects, papers, and businesses, are centred around social media data, but how many comply fully with EU data protection directives and regulations?"" ""Do we even know how to translate and embed such laws into our tools and research practices?"" ""Can we take this challenge, and opportunity, to design and build semantic tools for lawful gathering and analysis of social data?"""
http://videolectures.net/eswc2014_gangemi_panel/,"""A little semantics goes a long way to both granting and harming a trade-off between privacy and security."" ""The trade-off between privacy and security is a suq-like issue, where the attempts to cleanly control it may create more harm than good."" ""As with the majority of human-accessible worlds, semantics is broken, but most humans know what is appropriate to do, given a certain context: probably the only reason why we haven't collapsed yet."""
http://videolectures.net/eswc2014_casanovas_panel/,"""Security and privacy (data protection) are two faces of the same coin."" ""Principles of fair information practices (FIPs) and ""privacy by design"" (PbD) deal also with metadata and the so-called ""identity meta-system"" layer of the Internet."" ""Implementation of security by design implies a democratic political turn towards a global digital neighborhood."""
http://videolectures.net/eswc2014_floridi_panel/,"""The EU’s current ethical focus on personal data protection is unbalanced."" ""It favours too much the protection of an individual’s privacy and right to be forgotten."" ""It entirely ignores the need to protect personal data when whole groups are in question."""
http://videolectures.net/eswc2014_gandon_panel/,"""Semantics are a double-edged weapon for security."" ""Deployment requires security on every floor."" ""Security is much more than a technical problem."""
http://videolectures.net/eswc2014_staab_panel/,"""Data protection and security is not an issue to be solved once and for all, but an enduring issue like traffic safety."" ""Data protection and security is and will remain inconvenient, even if the kind of inconvenience should (and will) shift."" ""Technology helps to encrypt, explain and suggest."""
http://videolectures.net/eswc2014_esther_vidal_panel/,"""The EU’s current ethical focus on personal data protection is unbalanced."" ""It favours too much the protection of an individual’s privacy and right to be forgotten."" ""It entirely ignores the need to protect personal data when whole groups are in question."""
http://videolectures.net/eswc2014_panel_data_protection/,"On March 12th, in occasion of the 25th birthday of the World Wide Web, Sir Tim Berners-Lee made an open call for a “Magna Carta” to protect Web users. He said: ""It's time for us to make a big communal decision. In front of us are two roads — which way are we going to go? Are we going to continue on the road and just allow the governments to do more and more and more control — more and more surveillance? Or are we going to set up a bunch of values? Are we going to set up something like a Magna Carta for the World Wide Web and say, actually, now it's so important, so much part of our lives, that it becomes on a level with human rights?"" We all know that guaranteeing privacy and security at the same time in a world without the WWW is a challenge, and that each country addresses it in a different way by means of local regulations as well as international agreements. Identifying the right tradeoff on the Web is probably even more complicated, as we deal with a virtual world, where geographical borders loose their importance and role. The aim of this panel is to identify and discuss the most important issues that should be addressed in order to guarantee web users privacy, on one hand, without putting their security in danger, and web users security, on the other hand, without limiting their freedom by invading their private lives. Can semantics play any role in this trade-off?  We ask our panelists to summarize in three main statements their view on, and possibly their solution to, this problem, hence giving their advice to the definition of a Web users “Magna Carta”."
http://videolectures.net/eswc2014_kuhn_linked_data/,"To make digital resources on the web verifiable, immutable, and permanent, we propose a technique to include cryptographic hash values in URIs. We call them trusty URIs and we show how they can be used for approaches like nanopublications to make not only specific resources but their entire reference trees verifiable. Digital artifacts can be identied not only on the byte level but on more abstract levels such as RDF graphs, which means that resources keep their hash values even when presented in a different format. Our approach sticks to the core principles of the web, namely openness and decentralized architecture, is fully compatible with existing standards and protocols, and can therefore be used right away. Evaluation of our reference implementations shows that these desired properties are indeed accomplished by our approach, and that it remains practical even for very large files."
http://videolectures.net/eswc2014_gong_entity_coreference/,"Entity coreference is important to Linked Data integration. User involvement is considered as a valuable source of human knowledge that helps identify coreferent entities. However, the quality of user involvement is not always satisfying, which significantly diminishes the coreference accuracy. In this paper, we propose a new approach called coCoref, which leverages distributed human computation and consensus partition for entity coreference. Consensus partition is used to aggregate all distributed user-judged coreference results and resolve their disagreements. To alleviate user involvement, ensemble learning is performed on the consensus partition to automatically identify coreferent entities that users have not judged. We integrate coCoref into an online Linked Data browsing system, so that users can participate in entity coreference with their daily Web activities. Our empirical evaluation shows that coCoref largely improves the accuracy of user-judged coreference results, and reduces user involvement by automatically identifying a large number of coreferent entities"
http://videolectures.net/eswc2014_ell_search_engine/,"In this paper we introduce Spartiqulation, a system that translates SPARQL queries into English text. Our aim is to allow casual end users of semantic applications with limited to no expertise in the SPARQL query language to interact with these applications in a more intuitive way. The verbalization approach exploits domain-independent template-based natural language generation techniques, as well as linguistic cues in labels and URIs"
