Video_Presentation,Abstracts
http://videolectures.net/eccv2014_hong_graphical_models/,"Probabilistic tracking algorithms typically rely on graphical models based on the first-order Markov assumption. Although such linear structure models are simple and reasonable, it is not appropriate for persistent tracking since temporal failures by short-term occlusion, shot changes, and appearance changes may impair the remaining frames significantly. More general graphical models may be useful to exploit the intrinsic structure of input video and improve tracking performance. Hence, we propose a novel offline tracking algorithm by identifying a tree-structured graphical model, where we formulate a unified framework to optimize tree structure and track a target in a principled way, based on MCMC sampling. To reduce computational cost, we also introduce a technique to find the optimal tree for a small number of key frames first and employ a semi-supervised manifold alignment technique of tree construction for all frames. We evaluated our algorithm in many challenging videos and obtained outstanding results compared to the state-of-the-art techniques quantitatively and qualitatively."
http://videolectures.net/eccv2014_wang_interacting_objects/,"In this paper, we show that tracking different kinds of interacting objects can be formulated as a network-flow Mixed Integer Program. This is made possible by tracking all objects simultaneously and expressing the fact that one object can appear or disappear at locations where another is in terms of linear flow constraints. We demonstrate the power of our approach on scenes involving cars and pedestrians, bags being carried and dropped by people, and balls being passed from one player to the next in a basketball game. In particular, we show that by estimating jointly and globally the trajectories of different types of objects, the presence of the ones which were not initially detected based solely on image evidence can be inferred from the detections of the others."
http://videolectures.net/eccv2014_antic_group_activities/,"The collective activity of a group of persons is more than a mere sum of individual person actions, since interactions and the context of the overall group behavior have crucial influence. Consequently, the current standard paradigm for group activity recognition is to model the spatiotemporal pattern of individual person bounding boxes and their interactions. Despite this trend towards increasingly global representations, activities are often defined by semi-local characteristics and their interrelation between different persons. For capturing the large visual variability with small semi-local parts, a large number of them are required, thus rendering manual annotation infeasible. To automatically learn activity constituents that are meaningful for the collective activity, we sample local parts and group related ones not merely based on visual similarity but based on the function they fulfill on a set of validation images. Then max-margin multiple instance learning is employed to jointly i) remove clutter from these groups and focus on only the relevant samples, ii) learn the activity constituents, and iii) train the multi-class activity classifier. Experiments on standard activity benchmark sets show the advantage of this joint procedure and demonstrate the benefit of functionally grouped latent activity constituents for group activity recognition."
http://videolectures.net/eccv2014_deng_relation_graphs/,"In this paper we study how to perform object classification in a principled way that exploits the rich structure of real world labels. We develop a new model that allows encoding of flexible relations between labels. We introduce Hierarchy and Exclusion (HEX) graphs, a new formalism that captures semantic relations between any two labels applied to the same object: mutual exclusion, overlap and subsumption. We then provide rigorous theoretical analysis that illustrates properties of HEX graphs such as consistency, equivalence, and computational implications of the graph structure. Next, we propose a probabilistic classification model based on HEX graphs and show that it enjoys a number of desirable properties. Finally, we evaluate our method using a large-scale benchmark. Empirical results demonstrate that our model can significantly improve object classification by exploiting the label relations."
http://videolectures.net/eccv2014_forsyth_object_detection/,"We describe an implementation of the Deformable Parts Model [1] that operates in a user-defined time-frame. Our implementation uses a variety of mechanism to trade-off speed against accuracy. Our implementation can detect all 20 PASCAL 2007 objects simultaneously at 30Hz with an mAP of 0.26. At 15Hz, its mAP is 0.30; and at 100Hz, its mAP is 0.16. By comparison the reference implementation of [1] runs at 0.07Hz and mAP of 0.33 and a fast GPU implementation runs at 1Hz. Our technique is over an order of magnitude faster than the previous fastest DPM implementation. Our implementation exploits a series of important speedup mechanisms. We use the cascade framework of [3] and the vector quantization technique of [2]. To speed up feature computation, we compute HOG features at few scales, and apply many interpolated templates. A hierarchical vector quantization method is used to compress HOG features for fast template evaluation. An object proposal step uses hash-table methods to identify locations where evaluating templates would be most useful; these locations are inserted into a priority queue, and processed in a detection phase. Both proposal and detection phases have an any-time property. Our method applies to legacy templates, and no retraining is required."
http://videolectures.net/eccv2014_ahmed_efficient_selection/,"Collections of filters based on histograms of oriented gradients (HOG) are common for several detection methods, notably, poselets and exemplar SVMs. The main bottleneck in training such systems is the selection of a subset of good filters from a large number of possible choices. We show that one can learn a universal model of part “goodness” based on properties that can be computed from the filter itself. The intuition is that good filters across categories exhibit common traits such as, low clutter and gradients that are spatially correlated. This allows us to quickly discard filters that are not promising thereby speeding up the training procedure. Applied to training the poselet model, our automated selection procedure allows us to improve its detection performance on the PASCAL VOC data sets, while speeding up training by an order of magnitude. Similar results are reported for exemplar SVMs."
http://videolectures.net/eccv2014_ramanathan_linking_people/,"Natural language descriptions of videos provide a potentially rich and vast source of supervision. However, the highly-varied nature of language presents a major barrier to its effective use. What is needed are models that can reason over uncertainty over both videos and text. In this paper, we tackle the core task of person naming: assigning names of people in the cast to human tracks in TV videos. Screenplay scripts accompanying the video provide some crude supervision about who’s in the video. However, even the basic problem of knowing who is mentioned in the script is often difficult, since language often refers to people using pronouns (e.g., “he”) and nominals (e.g., “man”) rather than actual names (e.g., “Susan”). Resolving the identity of these mentions is the task of coreference resolution, which is an active area of research in natural language processing. We develop a joint model for person naming and coreference resolution, and in the process, infer a latent alignment between tracks and mentions. We evaluate our model on both vision and NLP tasks on a new dataset of 19 TV episodes. On both tasks, we significantly outperform the independent baselines."
http://videolectures.net/eccv2014_zeiler_convolutional_networks/,"Large Convolutional Network models have recently demonstrated impressive classification performance on the ImageNet benchmark Krizhevsky et al. [18]. However there is no clear understanding of why they perform so well, or how they might be improved. In this paper we explore both issues. We introduce a novel visualization technique that gives insight into the function of intermediate feature layers and the operation of the classifier. Used in a diagnostic role, these visualizations allow us to find model architectures that outperform Krizhevsky et al on the ImageNet classification benchmark. We also perform an ablation study to discover the performance contribution from different model layers. We show our ImageNet model generalizes well to other datasets: when the softmax classifier is retrained, it convincingly beats the current state-of-the-art results on Caltech-101 and Caltech-256 datasets."
http://videolectures.net/eccv2014_zhang_category_detection/,"Semantic part localization can facilitate fine-grained categorization by explicitly isolating subtle appearance differences associated with specific object parts. Methods for pose-normalized representations have been proposed, but generally presume bounding box annotations at test time due to the difficulty of object detection. We propose a model for fine-grained categorization that overcomes these limitations by leveraging deep convolutional features computed on bottom-up region proposals. Our method learns whole-object and part detectors, enforces learned geometric constraints between them, and predicts a fine-grained category from a pose-normalized representation. Experiments on the Caltech-UCSD bird dataset confirm that our method outperforms state-of-the-art fine-grained categorization methods in an end-to-end evaluation without requiring a bounding box at test time."
http://videolectures.net/eccv2014_zhang_face_alignment/,"Accurate face alignment is a vital prerequisite step for most face perception tasks such as face recognition, facial expression analysis and non-realistic face re-rendering. It can be formulated as the nonlinear inference of the facial landmarks from the detected face region. Deep network seems a good choice to model the nonlinearity, but it is nontrivial to apply it directly. In this paper, instead of a straightforward application of deep network, we propose a Coarse-to-Fine Auto-encoder Networks (CFAN) approach, which cascades a few successive Stacked Auto-encoder Networks (SANs). Specifically, the first SAN predicts the landmarks quickly but accurately enough as a preliminary, by taking as input a low-resolution version of the detected face holistically. The following SANs then progressively refine the landmark by taking as input the local features extracted around the current landmarks (output of the previous SAN) with higher and higher resolution. Extensive experiments conducted on three challenging datasets demonstrate that our CFAN outperforms the state-of-the-art methods and performs in real-time(40+fps excluding face detection on a desktop)."
http://videolectures.net/eccv2014_salzmann_dimensionality_reduction/,"Representing images and videos with Symmetric Positive Definite (SPD) matrices and considering the Riemannian geometry of the resulting space has proven beneficial for many recognition tasks. Unfortunately, computation on the Riemannian manifold of SPD matrices –especially of high-dimensional ones– comes at a high cost that limits the applicability of existing techniques. In this paper we introduce an approach that lets us handle high-dimensional SPD matrices by constructing a lower-dimensional, more discriminative SPD manifold. To this end, we model the mapping from the high-dimensional SPD manifold to the low-dimensional one with an orthonormal projection. In particular, we search for a projection that yields a low-dimensional manifold with maximum discriminative power encoded via an affinity-weighted similarity measure based on metrics on the manifold. Learning can then be expressed as an optimization problem on a Grassmann manifold. Our evaluation on several classification tasks shows that our approach leads to a significant accuracy gain over state-of-the-art methods."
http://videolectures.net/eccv2014_ramakrishna_pose_machines/,"State-of-the-art approaches for articulated human pose estimation are rooted in parts-based graphical models. These models are often restricted to tree-structured representations and simple parametric potentials in order to enable tractable inference. However, these simple dependencies fail to capture all the interactions between body parts. While models with more complex interactions can be defined, learning the parameters of these models remains challenging with intractable or approximate inference. In this paper, instead of performing inference on a learned graphical model, we build upon the inference machine framework and present a method for articulated human pose estimation. Our approach incorporates rich spatial interactions among multiple parts and information across parts of different scales. Additionally, the modular framework of our approach enables both ease of implementation without specialized optimization solvers, and efficient inference. We analyze our approach on two challenging datasets with large pose variation and outperform the state-of-the-art on these benchmarks."
http://videolectures.net/eccv2014_liu_feature_matching/,"Sparse feature matching poses three challenges to graph-based methods: (1) the combinatorial nature makes the number of possible matches huge; (2) most possible matches might be outliers; (3) high computational complexity is often incurred. In this paper, to resolve these issues, we propose a simple, yet surprisingly effective approach to explore the huge matching space in order to significantly boost true matches while avoiding outliers. The key idea is to perform mode-seeking on graphs progressively based on our proposed guided graph density. We further design a density-aware sampling technique to considerably accelerate mode-seeking. Experimental study on various benchmark data sets demonstrates that our method is several orders faster than the state-of-the-art methods while achieving much higher precision and recall."
http://videolectures.net/eccv2014_bazin_focal_lenght/,"Identifying inliers and outliers among data is a fundamental problem for model estimation. This paper considers models composed of rotation and focal length, which typically occurs in the context of panoramic imaging. An efficient approach consists in computing the underlying model such that the number of inliers is maximized. The most popular tool for inlier set maximization must be RANSAC and its numerous variants. While they can provide interesting results, they are not guaranteed to return the globally optimal solution, i.e. the model leading to the highest number of inliers. We propose a novel globally optimal approach based on branch-and-bound. It computes the rotation and the focal length maximizing the number of inlier correspondences and considers the reprojection error in the image space. Our approach has been successfully applied on synthesized data and real images."
http://videolectures.net/eccv2014_liu_match_selection/,"We present an approach to enhance the accuracy of structure from motion (SfM) in the two-view case. We first answer the question: “fewer data with higher accuracy, or more data with less accuracy?” For this, we establish a relation between SfM errors and a function of the number of matches and their epipolar errors. Using an accuracy estimator of individual matches, we then propose a method to select a subset of matches that has a good quality vs. quantity compromise. We also propose a variant of least squares matching to refine match locations based on a focused grid and a multi-scale exploration. Experiments show that both selection and refinement contribute independently to a better accuracy. Their combination reduces errors by a factor of 1.1 to 2.0 for rotation, and 1.6 to 3.8 for translation."
http://videolectures.net/eccv2014_engel_monocular_slam/,"We propose a direct (feature-less) monocular SLAM algorithm which, in contrast to current state-of-the-art regarding direct methods, allows to build large-scale, consistent maps of the environment. Along with highly accurate pose estimation based on direct image alignment, the 3D environment is reconstructed in real-time as pose-graph of keyframes with associated semi-dense depth maps. These are obtained by filtering over a large number of pixelwise small-baseline stereo comparisons. The explicitly scale-drift aware formulation allows the approach to operate on challenging sequences including large variations in scene scale. Major enablers are two key novelties: (1) a novel direct tracking method which operates on TeX, thereby explicitly detecting scale-drift, and (2) an elegant probabilistic solution to include the effect of noisy depth values into tracking. The resulting direct monocular SLAM system runs in real-time on a CPU."
http://videolectures.net/eccv2014_yu_coded_aperture/,"Recent coded aperture imaging systems have shown great success in scene reconstruction, extended depth-of-field and light field imaging. By far nearly all solutions are built on top of commodity cameras equipped with a single spherical lens. In this paper, we explore coded aperture solutions on a special non-centric lens called the crossed-slit (XSlit) lens. An XSlit lens uses a relay of two orthogonal cylindrical lenses, each coupled with a slit-shaped aperture. Through ray geometry analysis, we first show that the XSlit lens produces a different and potentially advantageous depth-of-field than the regular spherical lens. We then present a coded aperture strategy that individually encodes each slit aperture, one with broadband code and the other with high depth discrepancy code, for scene recovery. Synthetic and real experiments validate our theory and demonstrate the advantages of XSlit coded aperture solutions over the spherical lens ones."
http://videolectures.net/eccv2014_xue_fluid_depth/,"We present principled algorithms for measuring the velocity and 3D location of refractive fluids, such as hot air or gas, from natural videos with textured backgrounds. Our main observation is that intensity variations related to movements of refractive fluid elements, as observed by one or more video cameras, are consistent over small space-time volumes. We call these intensity variations “refraction wiggles”, and use them as features for tracking and stereo fusion to recover the fluid motion and depth from video sequences. We give algorithms for 1) measuring the (2D, projected) motion of refractive fluids in monocular videos, and 2) recovering the 3D position of points on the fluid from stereo cameras. Unlike pixel intensities, wiggles can be extremely subtle and cannot be known with the same level of confidence for all pixels, depending on factors such as background texture and physical properties of the fluid. We thus carefully model uncertainty in our algorithms for robust estimation of fluid motion and depth. We show results on controlled sequences, synthetic simulations, and natural videos. Different from previous approaches for measuring refractive flow, our methods operate directly on videos captured with ordinary cameras, do not require auxiliary sensors, light sources or designed backgrounds, and can correctly detect the motion and location of refractive fluids even when they are invisible to the naked eye."
http://videolectures.net/eccv2014_michaeli_blind_deblurring/,"Recurrence of small image patches across different scales of a natural image has been previously used for solving ill-posed problems (e.g. super- resolution from a single image). In this paper we show how this multi-scale property can also be used for “blind-deblurring”, namely, removal of an unknown blur from a blurry image. While patches repeat ‘as is’ across scales in a sharp natural image, this cross-scale recurrence significantly diminishes in blurry images. We exploit these deviations from ideal patch recurrence as a cue for recovering the underlying (unknown) blur kernel. More specifically, we look for the blur kernel k, such that if its effect is “undone” (if the blurry image is deconvolved with k), the patch similarity across scales of the image will be maximized. We report extensive experimental evaluations, which indicate that our approach compares favorably to state-of-the-art blind deblurring methods, and in particular, is more robust than them."
http://videolectures.net/eccv2014_isola_mutual_information/,"Detecting boundaries between semantically meaningful objects in visual scenes is an important component of many vision algorithms. In this paper, we propose a novel method for detecting such boundaries based on a simple underlying principle: pixels belonging to the same object exhibit higher statistical dependencies than pixels belonging to different objects. We show how to derive an affinity measure based on this principle using pointwise mutual information, and we show that this measure is indeed a good predictor of whether or not two pixels reside on the same object. Using this affinity with spectral clustering, we can find object boundaries in the image – achieving state-of-the-art results on the BSDS500 dataset. Our method produces pixel-level accurate boundaries while requiring minimal feature engineering."
http://videolectures.net/eccv2014_jia_guidance_filter/,"Images contain many levels of important structures and edges. Compared to masses of research to make filters edge preserving, finding scale-aware local operations was seldom addressed in a practical way, albeit similarly vital in image processing and computer vision. We propose a new framework to filter images with the complete control of detail smoothing under a scale measure. It is based on a rolling guidance implemented in an iterative manner that converges quickly. Our method is simple in implementation, easy to understand, fully extensible to accommodate various data operations, and fast to produce results. Our implementation achieves realtime performance and produces artifact-free results in separating different scale structures. This filter also introduces several inspiring properties different from previous edge-preserving ones."
http://videolectures.net/eccv2014_chang_image_decomposition/,"We present a generative, probabilistic model that decomposes an image into reflectance and shading components. The proposed approach uses a Dirichlet process Gaussian mixture model where the mean parameters evolve jointly according to a Gaussian process. In contrast to prior methods, we eliminate the Retinex term and adopt more general smoothness assumptions for the shading image. Markov chain Monte Carlo sampling techniques are used for inference, yielding state-of-the-art results on the MIT Intrinsic Image Dataset."
http://videolectures.net/eccv2014_mathias_face_detection/,"Face detection is a mature problem in computer vision. While diverse high performing face detectors have been proposed in the past, we present two surprising new top performance results. First, we show that a properly trained vanilla DPM reaches top performance, improving over commercial and research systems. Second, we show that a detector based on rigid templates - similar in structure to the Viola&Jones detector - can reach similar top performance on this task. Importantly, we discuss issues with existing evaluation benchmark and propose an improved procedure."
http://videolectures.net/eccv2014_ponce_image_contours/,"This paper revisits classical properties of the outlines of solid shapes bounded by smooth surfaces, and shows that they can be established in a purely projective setting, without appealing to Euclidean measurements such as normals or curvatures. In particular, we give new synthetic proofs of Koenderink’s famous theorem on convexities and concavities of the image contour, and of the fact that the rim turns in the same direction as the viewpoint in the tangent plane at a convex point, and in the opposite direction at a hyperbolic point. This suggests that projective geometry should not be viewed merely as an analytical device for linearizing calculations (its main role in structure from motion), but as the proper framework for studying the relation between solid shape and its perspective projections. Unlike previous work in this area, the proposed approach does not require an oriented setting, nor does it rely on any choice of coordinate system or analytical considerations."
http://videolectures.net/eccv2014_tamburo_automotive_headlights/,"The primary goal of an automotive headlight is to improve safety in low light and poor weather conditions. But, despite decades of innovation on light sources, more than half of accidents occur at night even with less traffic on the road. Recent developments in adaptive lighting have addressed some limitations of standard headlights, however, they have limited flexibility - switching between high and low beams, turning off beams toward the opposing lane, or rotating the beam as the vehicle turns - and are not designed for all driving environments. This paper introduces an ultra-low latency reactive visual system that can sense, react, and adapt quickly to any environment while moving at highway speeds. Our single hardware design can be programmed to perform a variety of tasks. Anti-glare high beams, improved driver visibility during snowstorms, increased contrast of lanes, markings, and sidewalks, and early visual warning of obstacles are demonstrated."
