Video_Presentation,Abstracts
http://videolectures.net/iswc07_fu_mmw/,"Wikipedia, a killer application in Web 2.0, has embraced the power of collaborative editing to harness collective intelligence. It can also serve as an ideal Semantic Web data source due to its abundance, influence, high quality and well-structuring. However, the heavy burden of up-building and maintain-ing such an enormous and ever-growing online encyclopedic knowledge base still rests on a very small group of people. Many casual users may still feel dif-ficulties in writing high quality Wikipedia articles. In this paper, we use RDF graphs to model the key elements in Wikipedia authoring, and propose an inte-grated solution to make Wikipedia authoring easier based on RDF graph match-ing, expecting making more Wikipedians. Our solution facilitates semantics reuse and provides users with: 1) a link suggestion module that suggests and au-to-completes internal links between Wikipedia articles for the user; 2) a catego-ry suggestion module that helps the user place her articles in correct categories. A prototype system is implemented and experimental results show significant improvements over existing solutions to link and category suggestion tasks. The proposed enhancements can be applied to attract more contributors and relieve the burden of professional editors, thus enhancing the current Wikipedia to make it an even better Semantic Web data source."
http://videolectures.net/iswc07_tran_obi/,"Current information retrieval (IR) approaches do not formally capture the explicit meaning of a keyword query but provide a comfortable way for the user to specify information needs on the basis of keywords. Ontology-based approaches allow for sophisticated semantic search but impose a query syntax more difficult to handle. In this paper, we present an approach for translating keyword queries to DL conjunctive queries using background knowledge available in ontologies. We present an implementation which shows that this interpretation of keywords can then be used for both exploration of asserted knowledge and for a semantics-based declarative query answering process.We also present an evaluation of our system and a discussion of the limitations of the approach with respect to our underlying assumptions which directly points to issues for future work."
http://videolectures.net/iswc07_cumc_mpr/,"This talk describes a large case study that explores the applicability of ontology reasoning to problems in the medical domain. We investigate whether it is possible to use such reasoning to automate com- mon clinical tasks that are currently labor intensive and error prone, and focus our case study on improving cohort selection for clinical trials. An obstacle to automating such clinical tasks is the need to bridge the semantic gulf between raw patient data, such as laboratory tests or specific medications, and the way a clinician interprets this data. Our key insight is that matching patients to clinical trials can be formulated as a problem of semantic retrieval. We describe the technical challenges to building a realistic case study, which include problems related to scalability, the integration of large ontologies, and dealing with noisy, inconsistent data. Our solution is based on the SNOMED CT R&#160; ontology, and scales to one year of patient records (approx. 240,000 patients)."
http://videolectures.net/iswc07_falconer_csf/,"Ontology mapping is the key to data interoperability in the semantic  web. This problem has received a lot of research attention, however, the research  emphasis has been mostly devoted to automating the mapping process,  even though the creation of mappings often involve the user. As industry interest  in semantic web technologies grows and the number of widely adopted semantic  web applications increases, we must begin to support the user. In this paper, we  combine data gathered from background literature, theories of cognitive support  and decision making, and an observational case study to propose a theoretical  framework for cognitive support in ontology mapping tools. We also describe a  tool called COGZ that is based on this framework."
http://videolectures.net/iswc07_noll_wsp/,"In this talk, we present a new approach to web search personalization based on user collaboration and sharing of information about web documents. The proposed personalization technique separates data collection and user profiling from the information system whose contents and indexed documents are being searched for, i.e. the search engines, and uses social bookmarking and tagging to re-rank web search results. It is independent of the search engine being used, so users are free to choose the one they prefer, even if their favorite search engine does not natively support personalization. We show how to design and implement such a system in practice and investigate its feasibility and usefulness with large sets of real-word data and a user study."
http://videolectures.net/iswc07_martin_parai/,"We describe a novel approach by which software can assess  the ability of a confederation of heterogeneous systems to interoperate  to achieve a given purpose. The approach uses ontologies and knowledge  bases (KBs) to capture the salient characteristics of systems, on  the one hand, and of tasks for which these systems will be employed,  on the other. Rules are used to represent the conditions under which  the capabilities provided by systems can fulfill the capabilities needed to  support the roles and interactions that make up each task. An Analyzer  component employs these KBs and rules to determine if a given confederation  will be adequate, to generate suitable confederations from a  collection of available systems, to pre-diagnose potential interoperability  problems that might arise, and to suggest system configuration options  that will help to make interoperability possible. We have demonstrated  the feasibility of this approach using a prototype Analyzer and KBs."
http://videolectures.net/iswc07_funk_obie/,Business Intelligence (BI) requires the acquisition and aggregation  of key pieces of knowledge from multiple sources in order to  provide valuable information to customers or feed statistical BI models  and tools. The massive amount of information available to business  analysts makes information extraction and other natural language processing  tools key enablers for the acquisition and use of that semantic  information. We describe the application of ontology-based extraction  and merging in the context of a practical e-business application for the  EU MUSING Project where the goal is to gather international company  intelligence and country/region information. The results of our experiments  so far are very promising and we are now in the process of building  a complete end-to-end solution.
http://videolectures.net/iswc07_abel_eacd/,"Semantic Web databases allow efficient storage and access to  RDF statements. Applications are able to use expressive query languages  in order to retrieve relevant metadata to perform different tasks. However,  access to metadata may not be public to just any application or  service. Instead, powerful and flexible mechanisms for protecting sets of  RDF statements are required for many Semantic Web applications. Unfortunately,  current RDF stores do not provide fine-grained protection.  This paper fills this gap and presents a mechanism by which complex and  expressive policies can be specified in order to protect access to metadata  in multi-service environments."
http://videolectures.net/iswc07_namgoong_obcnl/,"In recent years, CNL (Controlled Natural Language) has received much attention with regard to ontology-based knowledge acquisition systems. CNLs, as subsets of natural languages, can be useful for both humans and computers by eliminating ambiguity of natural languages. Our previous work, OntoPath [10], proposed to edit natural language-like narratives that are structured in RDF (Resource Description Framework) triples, using a domain-specific ontology as their language constituents. However, our previous work and other systems employing CFG for grammar definition have difficulties in enlarging the expression capacity. A newly developed editor, which we propose in this paper, permits grammar definitions through CFG-LD (Context-Free Grammar with Lexical Dependency) that includes sequential and semantic structures of the grammars. With CFG describing the sequential structure of grammar, lexical dependencies between sentence elements can be designated in the definition system. Through the defined grammars, the implemented editor guides users’ narratives in more familiar expressions with a domain-specific ontology and translates the content into RDF triples."
http://videolectures.net/iswc07_kaufman_hunl/,"Natural language interfaces offer end-users a familiar and  convenient option for querying ontology-based knowledge bases. Several  studies have shown that they can achieve high retrieval performance as  well as domain independence. This paper focuses on usability and investigates  if NLIs are useful from an end-user’s point of view. To that end,  we introduce four interfaces each allowing a different query language and  present a usability study benchmarking these interfaces. The results of  the study reveal a clear preference for full sentences as query language  and confirm that NLIs are useful for querying Semantic Web data."
http://videolectures.net/iswc07_tran_lsa/,"Ontology-based applications play an increasingly important role in the public and corporate Semantic Web. While today there exist a range of tools and technologies to support specific ontology engineering and management activities, architectural design guidelines for building ontology-based applications are missing. In this paper, we present an architecture for ontology-based applications—covering the complete ontology-lifecycle—that is intended to support software engineers in designing and developing ontology-based applications. We illustrate the use of the architecture in a concrete case study using the NeOn toolkit as one implementation of the architecture."
http://videolectures.net/iswc07_troncy_dwfm/,"Semantic descriptions of non-textual media available on the web can be used to facilitate retrieval and presentation of media assets and documents containing them. While technologies for multimedia semantic descriptions already exist, there is as yet no formal description of a high quality multimedia ontology that is compatible with existing (semantic) web technologies. We explain the complexity of the problem using an annotation scenario. We then derive a number of requirements for specifying a formal multimedia ontology before we present the developed ontology, COMM, and evaluate it with respect to our requirements. We provide an API for generating multimedia annotations that conform to COMM."
http://videolectures.net/iswc07_yuzhong_dsmb/,"Ontologies proliferate with the growth of the Semantic Web. However, most of data on theWeb are still stored in relational databases. Therefore, it is important to establish interoperability between relational databases and ontologies for creating a Web of data. An e®ective way to achieve interoperability is ¯nding mappings between relational database schemas and ontologies. In this paper, we propose a new approach to discovering simple mappings between a relational database schema and an ontology. It exploits simple mappings based on virtual documents, and eliminates incorrect mappings via validating mapping consistency. Additionally, it also constructs a special type of semantic mappings, called contextual mappings, which is useful for practical applications. Experimental results demonstrate that our approach performs well on several data sets from real world domains."
http://videolectures.net/iswc07_ungrangsi_aca/,"Automatic knowledge reuse for Semantic Web applications imposes several challenges on ontology search. Existing ontology retrieval systems merely return a lengthy list of relevant single ontologies, which may not completely cover the specified user requirements. Therefore, there arises an increasing demand for a tool or algorithm with a mechanism to check concept adequacy of existing ontologies with respect to a user query, and then recommend a single or combination of ontologies which can entirely fulfill the requirements. Thus, this paper develops an algorithm, namely combiSQORE to determine whether the available collection of ontologies is able to completely satisfy a submitted query and return a single or combinative ontology that guarantees query coverage. In addition, it ranks the returned answers based on their conceptual closeness and query coverage. The experimental results show that the proposed algorithm is simple, efficient and effective."
http://videolectures.net/iswc07_liarou_crdf/,"We study the continuous evaluation of conjunctive triple pattern queries over RDF data stored in distributed hash tables. In a continuous query scenario network nodes subscribe with long-standing queries and receive answers whenever RDF triples satisfying their queries are published. We present two novel query processing algorithms for this scenario and analyze their properties formally. Our performance goal is to have algorithms that scale to large amounts of RDF data, distribute the storage and query processing load evenly and incur as little network traffic as possible. We discuss the various performance tradeoffs that occur through a detailed experimental evaluation of the proposed algorithms."
http://videolectures.net/iswc07_grobelnik_wsw/,"The tutorial will cover basic topics from the field of Machine Learning  explained in an intuitive way relevant for Semantic Web researchers and  practitioners. In the first part the topics will cover brief top level  overview of the Machine Learning field, its algorithms, and data types  being analyzed. In the second part we will cover relation to Semantic  Web and Web2.0. In the last part we will perform hands-on exercise with  some of the tools for modeling text semantics and social networks in  analytical way."
http://videolectures.net/iswc07_mladenic_wsw/,"The tutorial will cover basic topics from the field of Machine Learning  explained in an intuitive way relevant for Semantic Web researchers and  practitioners. In the first part the topics will cover brief top level  overview of the Machine Learning field, its algorithms, and data types  being analyzed. In the second part we will cover relation to Semantic  Web and Web2.0. In the last part we will perform hands-on exercise with  some of the tools for modeling text semantics and social networks in  analytical way."
http://videolectures.net/iswc07_fortuna_wsw/,"The tutorial will cover basic topics from the field of Machine Learning  explained in an intuitive way relevant for Semantic Web researchers and  practitioners. In the first part the topics will cover brief top level  overview of the Machine Learning field, its algorithms, and data types  being analyzed. In the second part we will cover relation to Semantic  Web and Web2.0. In the last part we will perform hands-on exercise with  some of the tools for modeling text semantics and social networks in  analytical way."
