Video_Presentation,Abstracts
http://videolectures.net/eswc2016_hendler_wither_OWL/,"The need for ontologies in the real world is manifest and increasing.  On the Web, ontologies are increasingly needed — but OWL isn’t being used in many of these applications.  This talk explores some of the use and needs for ontologies on the Web in data integration, emerging technologies, and linked data applications.  It focuses on deficiencies in OWL's design that have hindered its application, and suggests some directions for making OWL more relevant to the modern Web, rather than the Web of the early 2000's. The talk ends with some challenges to the OWL, and greater ontology, community needed to be addressed if we are to see more use of ontologies on the Web."
http://videolectures.net/eswc2016_damiani_data_pipelines/,"In many Big Data environments, information is made available as huge data streams, collected and analyzed at different locations, asynchronously and under the responsibility of different authorities. It has become common for data analysts to have a mandate for computing Big Data  analytics without holding the rights to access the individual data points in the input, as they may contain sensitive information or personal data protected by privacy regulations. This talk discusses the idea that techniques used for semantic enrichment of Big Data (such as semantic lifting to harmonize metadata representation across data collection points and pre-joins at data ingestion time to avoid computing semantic joins on Big Data storage) can be seen as non-linear leakage and privacy risk boosters.   Intuition suggests that semantic techniques applied to  Big Data representation may have a double impact on security risks: (1) increase leakage risk by increasing the value for the attacker per unit of information leaked (2) increase intrusion risk, making injection attacks (i.e. attacks aimed at poisoning data for subverting the outcome of analytics) more effective per unit of poisoned information injected .    However, no clear methodology is currently available for quantifying the impact of these boosters. This talk will discuss a (semi-)quantitative technique for computing Big Data leakage risk estimates, in order to meaningfully compare them with the quantifiable benefits of semantic enrichment. Also, it will discuss  a model  and a toolkit for protecting semantically enriched data streams based on the idea of dynamic filters, incrementally built based on the applicable Access Control policy and on the analytics to be performed."
http://videolectures.net/eswc2016_pratsini_semanting_technologies/,"Developing intelligent solutions requires a comprehensive understanding and management of the data. Intelligent semantic systems provide the smart technologies to harvest large amounts of data and insight in order to find solutions to the problems in various application areas. Typical challenges are: data acquisition from different types of sources; establishing links among different data types using both structure and content; dynamic, real-time processing of data; scalability for analytics and query processing, just to name a few. These challenges often prevent a business from even starting to look at the information and make sense out of it. At the same time, advances in cognitive computing offer new possibilities in analyzing unstructured information for richer insights. In this talk, we will use applications to discuss the use of semantic technologies, point out the research challenges, and highlight the business benefit from these technologies. We will conclude with a view on future research directions."
http://videolectures.net/eswc2016_fokou_failure_causes/,"Recent advances in Web-information extraction have led to the creation of several large Knowledge Bases (KBs). Querying these KBs often results in empty answers that do not serve the users’ needs. Relaxation of the failing queries is one of the cooperative techniques used to retrieve alternative results. Most of the previous work on RDF query relaxation compute a set of relaxed queries and execute them in a similarity-based ranking order. Thus, these approaches relax an RDF query without knowing its failure causes (FCs). In this paper, we study the idea of identifying these FCs to speed up the query relaxation process. We propose three relaxation strategies based on various information levels about the FCs of the user query and of its relaxed queries as well. A set of experiments conducted on the LUBM benchmark show the impact of our proposal in comparison with a state-of-the-art algorithm."
http://videolectures.net/eswc2016_ngonga_ngomo_link_discovery/,"Links between knowledge bases build the backbone of the Linked Data Web. In previous works, several time-efficient algorithms have been developed for computing links between knowledge bases. Most of these approaches rely on comparing resource properties based on similarity or distance functions as well as combinations thereof. However, these approaches pay little attention to the fact that very large datasets cannot be held in the main memory of most computing devices. In this paper, we present a generic memory management for Link Discovery. We show that the problem at hand is a variation of the traveling salesman problem and is thus NP-complete. We thus provide efficient graph-based algorithms that allow scheduling link discovery tasks efficiently. Our evaluation on real data shows that our approach allows computing links between large amounts of resources efficiently."
http://videolectures.net/eswc2016_folz_pattern_fragments/,"The Linked Data Fragment (LDF) approach promotes a new trade-off between performance and data availability for querying Linked Data. If data providers’ HTTP caches plays a crucial role in LDF performances, LDF clients are also caching data during SPARQL query processing. Unfortunately, as these clients do not collaborate, they cannot take advantage of this large decentralized cache hosted by clients. In this paper, we propose CyCLaDEs an overlay network based on LDF fragments similarity. For each LDF client, CyCLaDEs builds a neighborhood of LDF clients hosting related fragments in their cache. During query processing, neighborhood cache is checked before requesting LDF server. Experimental results show that CyCLaDEs is able to handle a significant amount of LDF query processing and provide a more specialized cache on client-side."
http://videolectures.net/eswc2016_ilievski_linked_data/,"Finding relevant resources on the Semantic Web today is a dirty job: no centralized query service exists and the support for natural language access is limited. We present LOTUS: Linked Open Text UnleaShed, a text-based entry point to a massive subset of today’s Linked Open Data Cloud. Recognizing the use case dependency of resource retrieval, LOTUS provides an adaptive framework in which a set of matching and ranking algorithms are made available. Researchers and developers are able to tune their own LOTUS index by choosing and combining the matching and ranking algorithms that suit their use case best. In this paper, we explain the LOTUS approach, its implementation and the functionality it provides. We demonstrate the ease with which LOTUS enables text-based resource retrieval at an unprecedented scale in concrete and domain-specific scenarios. Finally, we provide evidence for the scalability of LOTUS with respect to the LOD Laundromat, the largest collection of easily accessible Linked Open Data currently available."
http://videolectures.net/eswc2016_de_nies_web_distance/,"In this paper, we investigate the Normalized Semantic Web Distance (NSWD), a semantics-aware distance measure between two concepts in a knowledge graph. Our measure advances the Normalized Web Distance, a recently established distance between two textual terms, to be more semantically aware. In addition to the theoretic fundamentals of the NSWD, we investigate its properties and qualities with respect to computation and implementation. We investigate three variants of the NSWD that make use of all semantic properties of nodes in a knowledge graph. Our performance evaluation based on the Miller-Charles benchmark shows that the NSWD is able to correlate with human similarity assessments on both Freebase and DBpedia knowledge graphs with values up to 0.69. Moreover, we verified the semantic awareness of the NSWD on a set of 20 unambiguous concept-pairs. We conclude that the NSWD is a promising measure with (1) a reusable implementation across knowledge graphs, (2) sufficient correlation with human assessments, and (3) awareness of semantic differences between ambiguous concepts."
http://videolectures.net/eswc2016_perera_entity_linking/,"Over the years, Twitter has become one of the largest communication platforms providing key data to various applications such as brand monitoring, trend detection, among others. Entity linking is one of the major tasks in natural language understanding from tweets and it associates entity mentions in text to corresponding entries in knowledge bases in order to provide unambiguous interpretation and additional context. State-of-the-art techniques have focused on linking explicitly mentioned entities in tweets with reasonable success. However, we argue that in addition to explicit mentions – i.e. 'The movie Gravity was more expensive than the mars orbiter mission' – entities (movie Gravity) can also be mentioned implicitly – i.e. 'This new space movie is crazy. you must watch it!.' This paper introduces the problem of implicit entity linking in tweets. We propose an approach that models the entities by exploiting their factual and contextual knowledge. We demonstrate how to use these models to perform implicit entity linking on a ground truth dataset with 397 tweets from two domains, namely, Movie and Book. Specifically, we show: 1) the importance of linking implicit entities and its value addition to the standard entity linking task, and 2) the importance of exploiting contextual knowledge associated with an entity for linking their implicit mentions. We also make the ground truth dataset publicly available to foster the research in this new research area."
http://videolectures.net/eswc2016_ruan_queriability_to_informativity/,"In recent years, an increasing number of semantic data sources have been published on the web. These sources are further interlinked to form the Linking Open Data (LOD) cloud. To make full use of these data sets, it is necessary to learn their data qualities. Researchers have proposed several metrics and have developed numerous tools to measure the qualities of the data sets in LOD from different dimensions. However, there exist few studies on evaluating data set quality from the users’ usability perspective and usability has great impacts on the spread and reuse of LOD data sets. On the other hand, usability is well studied in the area of software quality. In the newly published standard ISO/IEC 25010, usability is further broadened to include the notion of “quality in use” besides the other two factors, namely, internal and external. In this paper, we first adapt the notions and the methods used in software quality to assess the data set quality. Second, we formally define two quality dimensions, namely, Queriability and Informativity from the perspective of quality in use. The two proposed dimensions correspond to querying and answering, respectively, which are the most frequent usage scenarios for accessing LOD data sets. Then we provide a series of metrics to measure the two dimensions. Last, we apply the metrics to two representative data sets in LOD (i.e., YAGO and DBpedia). In the evaluating process, we select dozens of questions from both QALD and WebQuestions and ask a group of users to construct queries as well as to check the answers with the help of our usability testing tool. The findings during the assessment not only illustrate the capability of our method and metrics but also give new insights on data quality of the two knowledge bases."
http://videolectures.net/eswc2016_roeder_topic_modelling/,"The Web of data is growing continuously with respect to both the size and number of the datasets published. Porting a dataset to five-star Linked Data however requires the publisher of this dataset to link it with the already available linked datasets. Given the size and growth of the Linked Data Cloud, the current mostly manual approach used for detecting relevant datasets for linking is obsolete. We study the use of topic modelling for dataset search experimentally and present Tapioca, a linked dataset search engine that provides data publishers with similar existing datasets automatically. Our search engine uses a novel approach for determining the topical similarity of datasets. This approach relies on probabilistic topic modelling to determine related datasets by relying solely on the metadata of datasets. We evaluate our approach on a manually created gold standard and with a user study. Our evaluation shows that our algorithm outperforms a set of comparable baseline algorithms including standard search engines significantly by 6 % F1-score. Moreover, we show that it can be used on a large real world dataset with a comparable performance."
http://videolectures.net/eswc2016_gunaratna_gleaning_types/,"Associating meaning with data in a machine-readable format is at the core of the Semantic Web vision, and typing is one such process. Typing (assigning a class selected from schema) information can be attached to URI resources in RDF/S knowledge graphs and datasets to improve quality, reliability, and analysis. There are two types of properties: object properties, and datatype properties. Type information can be made available for object properties as their object values are URIs. Typed object properties allow richer semantic analysis compared to datatype properties, whose object values are literals. In fact, many datatype properties can be analyzed to suggest types selected from a schema similar to object properties, enabling their wider use in applications. In this paper, we propose an approach to glean types for datatype properties by processing their object values. We show the usefulness of generated types by utilizing them to group facts on the basis of their semantics in computing diversified entity summaries by extending a state-of-the-art summarization algorithm."
http://videolectures.net/eswc2016_rouces_heterogeneous_knowledge/,"With recent advances in information extraction techniques, various large-scale knowledge bases covering a broad range of knowledge have become publicly available. As no single knowledge base covers all information, many applications require access to integrated knowledge from multiple knowledge bases. Achieving this, however, is challenging due to differences in knowledge representation. To address this problem, this paper proposes to use linguistic frames as a common representation and maps heterogeneous knowledge bases to the FrameBase schema, which is formed by a large inventory of these frames. We develop several methods to create complex mappings from external knowledge bases to this schema, using text similarity measures, machine learning, and different heuristics. We test them with different widely used large-scale knowledge bases, YAGO2s, Freebase and WikiData. The resulting integrated knowledge can then be queried in a homogeneous way."
http://videolectures.net/eswc2016_schaible_open_data/,"Deciding which RDF vocabulary terms to use when modeling data as Linked Open Data (LOD) is far from trivial. In this paper, we propose TermPicker as a novel approach enabling vocabulary reuse by recommending vocabulary terms based on various features of a term. These features include the term’s popularity, whether it is from an already used vocabulary, and the so-called schema-level pattern (SLP) feature that exploits which terms other data providers on the LOD cloud use to describe their data. We apply Learning To Rank to establish a ranking model for vocabulary terms based on the utilized features. The results show that using the SLP-feature improves the recommendation quality by 29–36 % considering the Mean Average Precision and the Mean Reciprocal Rank at the first five positions compared to recommendations based on solely the term’s popularity and whether it is from an already used vocabulary."
http://videolectures.net/eswc2016_pareti_linking_data/,"An increasing number of everyday tasks involve a mixture of human actions and machine computation. This paper presents the first framework that allows non-programmer users to create and execute workflows where each task can be completed by a human or a machine. In this framework, humans and machines interact through a shared knowledge base which is both human and machine understandable. This knowledge base is based on the prohow Linked Data vocabulary that can represent human instructions and link them to machine functionalities. Our hypothesis is that non-programmer users can describe how to achieve certain tasks at a level of abstraction which is both human and machine understandable. This paper presents the prohow vocabulary and describes its usage within the proposed framework. We substantiate our claim with a concrete implementation of our framework and by experimental evidence."
http://videolectures.net/eswc2016_avgoustaki_provenance_management/,"Tracking the provenance of information published on the Web is of crucial importance for effectively supporting trustworthiness, accountability and repeatability in the Web of Data. Although extensive work has been done on computing the provenance for SPARQL queries, little research has been conducted for the case of SPARQL updates. This paper proposes a new provenance model that borrows properties from both how and where provenance models, and is suitable for capturing the triple and attribute level provenance of data introduced via SPARQL INSERT updates. To the best of our knowledge, this is the first model that deals with the provenance of SPARQL updates using algebraic expressions, in the spirit of the well-established model of provenance semirings. We present an algorithm that records the provenance of SPARQL update results, and a reconstruction algorithm that uses this provenance to identify a SPARQL update that is compatible to the original one, given only the recorded provenance. Our approach is implemented and evaluated on top of Virtuoso Database Engine."
http://videolectures.net/eswc2016_cheatham_record_linkage/,"The rise of Big Data Analytics has shown the utility of analyzing all aspects of a problem by bringing together disparate data sets. Efficient and accurate private record linkage algorithms are necessary to achieve this. However, records are often linked based on personally identifiable information, and protecting the privacy of individuals is critical. This paper contributes to this field by studying an important component of the private record linkage problem: linking based on names while keeping those names encrypted, both on disk and in memory. We explore the applicability, accuracy and speed of three different primary approaches to this problem (along with several variations) and compare the results to common name-matching metrics on unprotected data. While these approaches are not new, this paper provides a thorough analysis on a range of datasets containing systematically introduced flaws common to name-based data entry, such as typographical errors, optical character recognition errors, and phonetic errors."
http://videolectures.net/eswc2016_ben_ellefi_data_linking/,"With the growing quantity and diversity of publicly available web datasets, most notably Linked Open Data, recommending datasets, which meet specific criteria, has become an increasingly important, yet challenging problem. This task is of particular interest when addressing issues such as entity retrieval, semantic search and data linking. Here, we focus on that last issue. We introduce a dataset recommendation approach to identify linking candidates based on the presence of schema overlap between datasets. While an understanding of the nature of the content of specific datasets is a crucial prerequisite, we adopt the notion of dataset profiles, where a dataset is characterized through a set of schema concept labels that best describe it and can be potentially enriched by retrieving their textual descriptions. We identify schema overlap by the help of a semantico-frequential concept similarity measure and a ranking criterium based on the tf*idf cosine similarity. The experiments , conducted over all available linked datasets on the Linked Open Data cloud, show that our method achieves an average precision of up to 53% for a recall of 100%. As an additional contribution, our method returns the mappings between the schema concepts across datasets – a particularly useful input for the data linking step."
http://videolectures.net/eswc2016_zheng_iterative_entity/,"With the increasing volume of Linked Data, the diverse links and the large amount of linked entities make it difficult for users to traverse RDF data. As semantic links and classes of linked entities are two key aspects to help users navigate, clustering links and classes can offer effective ways of navigating over RDF data. In this paper, we propose a co-clustering approach to provide users with iterative entity navigation. It clusters both links and classes simultaneously utilizing both the relationship between link and class, and the intra-link relationship and intra-class relationship. We evaluate our approach on a real-world data set and the experimental results demonstrate the effectiveness of our approach. A user study is conducted on a prototype system to show that our approach provides useful support for iterative entity navigation."
http://videolectures.net/eswc2016_zwicklbauer_semantic_embeddings/,"Entity disambiguation is the task of mapping ambiguous terms in natural-language text to its entities in a knowledge base. It finds its application in the extraction of structured data in RDF (Resource Description Framework) from textual documents, but equally so in facilitating artificial intelligence applications, such as Semantic Search, Reasoning and Question & Answering. In this work, we propose DoSeR (Disambiguation of Semantic Resources), a (named) entity disambiguation framework that is knowledge-base-agnostic in terms of RDF (e.g. DBpedia) and entity-annotated document knowledge bases (e.g. Wikipedia). Initially, our framework automatically generates semantic entity embeddings given one or multiple knowledge bases. In the following, DoSeR accepts documents with a given set of surface forms as input and collectively links them to an entity in a knowledge base with a graph-based approach. We evaluate DoSeR on seven different data sets against publicly available, state-of-the-art (named) entity disambiguation frameworks. Our approach outperforms the state-of-the-art approaches that make use of RDF knowledge bases and/or entity-annotated document knowledge bases by up to 10 % F1 measure."
http://videolectures.net/eswc2016_yang_graph_modelling/,"Latent embedding models are the basis of state-of-the art statistical solutions for modelling Knowledge Graphs and Recommender Systems. However, to be able to perform predictions for new entities and relation types, such models have to be retrained completely to derive the new latent embeddings. This could be a potential limitation when fast predictions for new entities and relation types are required. In this paper we propose approaches that can map new entities and new relation types into the existing latent embedding space without the need for retraining. Our proposed models are based on the observable - even incomplete - features of a new entity, e.g. a subset of observed links to other known entities. We show that these mapping approaches are efficient and are applicable to a wide variety of existing factorization models, including nonlinear models. We report performance results on multiple real-world datasets and evaluate the performances from different aspects."
http://videolectures.net/eswc2016_ristoski_enriching_product/,"Product ads are a popular form of search advertizing offered by major search engines, including Yahoo, Google and Bing. Unlike traditional search ads, product ads include structured product specifications, which allow search engine providers to perform better keyword-based ad retrieval. However, the level of completeness of the product specifications varies and strongly influences the performance of ad retrieval. On the other hand, online shops are increasing adopting semantic markup languages such as Microformats, RDFa and Microdata, to annotate their content, making large amounts of product description data publicly available. In this paper, we present an approach for enriching product ads with structured data extracted from thousands of online shops offering Microdata annotations. In our approach we use structured product ads as supervision for training feature extraction models able to extract attribute-value pairs from unstructured product descriptions. We use these features to identify matching products across different online shops and enrich product ads with the extracted data. Our evaluation on three product categories related to electronics show promising results in terms of enriching product ads with useful product data."
