Video_Presentation,Abstracts
http://videolectures.net/iswc2018_baumgartner_kade_aligning_regularized/,"Knowledge Bases (KBs) and textual documents contain rich and complementary information about real-world objects, as well as relations among them. While text documents describe entities in freeform, KBs organizes such information in a structured way. This makes these two forms to represent information hard to compare and integrate, limiting the possibility to use them jointly to improve predictive and analytical tasks. In this article, we study this problem, and we propose KADE, a solution based on a regularized multi-task learning of KB and document embeddings. KADE can potentially incorporate any KB and document embedding learning method. Our experiments on multiple datasets and methods show that KADE effectively aligns documents and entities embedding, while maintaining the characteristics of the embedding models."
http://videolectures.net/iswc2018_gliozzo_implicit_relations_distantly/,"In this paper we present Socrates, a deep learning based solutions for Automated Knowledge Base Population. Socrates does not require hand labelled data for domain adaptation. Instead, it exploits a partially populated knowledge base and a large corpus of text documents to train a deep neural network model. As a result of the training process, the system learns how to identify implicit relations between entities across a highly heterogeneous set of documents from various sources, making it suitable for large-scale knowledge extraction from Web documents. We provide an extensive evaluation of the system across three different benchmarks, showing that we consistently improve over state of the art solutions. Remarkably, Socrates ranked first in both the knowledge base population and attribute validation track at the Semantic Web Challenge at ISWC 2017."
http://videolectures.net/iswc2018_bianchi_towards_encoding_time/,"Knowledge Graphs (KG) are widely used for knowledge representation. Recently, approaches aimed to represent the KG structure in an embedded space have become increasingly popular for their ability to capture high-level similarities between entities and relations. However, these embedded representations commonly give low consideration to the time aspect. Real-world entities exist and act in a defined temporal interval, consequently time is a valuable element of information in their description. In this work, we study the influence of time on the embedded representations of entities that are generated from text. The preliminary evaluation shows that generating a specific representation for temporal entities (e.g., years) can result in a more informative entity representation space. Then, we propose a new time-aware similarity metric that can be used to evaluate the similarity between entities by either flattening their time distance or boosting it."
http://videolectures.net/iswc2018_stepanova_rule_learning/,"Rules over a Knowledge Graph (KG) capture interpretable patterns in data and various methods for rule learning have been proposed. Since KGs are inherently incomplete, rules can be used to deduce missing facts. Statistical measures for learned rules such as confidence reflect rule quality well when the KG is reasonably complete; however, these measures might be misleading otherwise. So it is difficult to learn high-quality rules from the KG alone, and scalability dictates that only a small set of candidate rules is generated. Therefore, the ranking and pruning of candidate rules is a major problem. To address this issue, we propose a rule learning method that utilizes probabilistic representations of missing facts. In particular, we iteratively extend rules induced from a KG by relying on feedback from a precomputed embedding model over the KG and external information sources including text corpora. Experiments on real-world KGs demonstrate the effectiveness of our novel approach both with respect to the quality of the learned rules and fact predictions that they produce."
http://videolectures.net/iswc2018_lisena_ensemble_method_disambiguation/,"Named entity recognition (NER) and disambiguation (NED) are subtasks of information extraction that respectively aim to recognize named entities mentioned in text, to assign them pre-defined types, and to link them with their matching entities in a knowledge base. Many approaches, often exposed as web APIs, have been proposed to solve these tasks during the last years. These APIs classify entities using different taxonomies and disambiguate them with different knowledge bases. In this paper, we describe Ensemble Nerd, a framework that collects numerous extractors responses, normalizes them and combines them in order to produce a final entity list according to the pattern (surface form, type, link). The presented approach is based on representing the extractors responses as real-value vectors and on using them as input samples for two Deep Learning networks: ENNTR (Ensemble Neural Network for Type Recognition) and ENND (Ensemble Neural Network for Disambiguation). We train these networks using specific gold standards. We show that the models produced outperform each single extractor responses in terms of micro and macro F1 measures computed by the GERBIL framework."
http://videolectures.net/iswc2018_salas_canonicalisation_sparql_queries/,"Caching in the context of expressive query languages such as SPARQL is complicated by the difficulty of detecting equivalent queries: deciding if two conjunctive queries are equivalent is npc, where adding further query features makes the problem undecidable. Despite this complexity, in this paper we propose an algorithm that performs syntactic canonicalisation of SPARQL queries such that the answers for the canonicalised query will not change versus the original. We can guarantee that the canonicalisation of two queries within a core fragment of SPARQL (monotone queries with select, project, join and union) is equal if and only if the two queries are equivalent; we also support other SPARQL features but with a weaker soundness guarantee: that the (partially) canonicalised query is equivalent to the input query. Despite the fact that canonicalisation must be harder than the equivalence problem, we show the algorithm to be practical for real-world queries taken from SPARQL endpoint logs, and further show that it detects more equivalent queries than when compared with purely syntactic methods. We also present the results of experiments over synthetic queries designed to stress-test the canonicalisation method, highlighting difficult cases."
http://videolectures.net/iswc2018_taelman_comunica_modular_sparql/,"Query evaluation over Linked Data sources has become a complex story, given the multitude of algorithms and techniques for single- and multi-source querying, as well as the heterogeneity of Web interfaces through which data is published online. Today's query processors are insufficiently adaptable to test multiple query engine aspects in combination, such as evaluating the performance of a certain join algorithm over a federation of heterogeneous interfaces. The Semantic Web research community is in need of a flexible query engine that allows plugging in new components such as different algorithms, new or experimental SPARQL features, and support for new Web interfaces. We designed and developed a Web-friendly and modular meta query engine called Comunica that meets these specifications. In this article, we introduce this query engine and explain the architectural choices behind its design. We show how its modular nature makes it an ideal research platform for investigating new kinds of Linked Data interfaces and querying algorithms. Comunica facilitates the development, testing, and evaluation of new query processing capabilities, both in isolation and in combination with others."
http://videolectures.net/iswc2018_heling_querying_fragments_study/,"Triple Pattern Fragments (TPFs) are a novel interface for accessing data in knowledge graphs on the web. Up to this date, work on performance evaluation and optimization has focused mainly on SPARQL query execution over TPF servers. However, in order to devise querying techniques that efficiently access large knowledge graphs via TPFs, we need to identify and understand the variables that influence the performance of TPF servers on a fine-grained level. In this work, we assess the performance of TPFs by measuring the response time for different requests and analyze how the requests' properties, as well as the TPF server configuration, may impact the performance. For this purpose, we developed the Triple Pattern Fragment Profiler to determine the performance of TPF server. The resource is openly available at https://github.com/Lars-H/tpf_profiler. To this end, we conduct an empirical study over four real-world knowledge graphs in different server environments and configurations. As part of our analysis, we provide an extensive evaluation of the results and focus on the impact of the variables: triple pattern type, answer cardinality, page size, backend and the environment type on the response time. The results suggest that all variables impact on the measured response time and allow for deriving suggestions for TPF server configurations and query optimization."
http://videolectures.net/iswc2018_arnaout_effective_rdf_graphs/,"RDF knowledge graphs are typically searched using triple-pattern queries. Often, triple-pattern queries will return too many or too few results, making it difficult for users to find relevant answers to their information needs. To remedy this, we propose a general framework for effective searching of RDF knowledge graphs. Our framework extends both the searched knowledge graph and triple-pattern queries with keywords to allow users to form a wider range of queries. In addition, it provides result ranking based on statistical machine translation, and performs automatic query relaxation to improve query recall. Finally, we also define a notion of result diversity in the setting of RDF data and provide mechanisms to diversify RDF search results using Maximal Marginal Relevance. We evaluate the effectiveness of our retrieval framework using various carefully-designed user studies on DBpedia, a large and real-world RDF knowledge graph."
http://videolectures.net/iswc2018_saleem_largerdfbench_billion_sparql/,"Gathering information from the distributed Web of Data is commonly carried out by using SPARQL query federation approaches. However, the fitness of current SPARQL query federation approaches for real applications is difficult to evaluate with current benchmarks as they are either synthetic, too small in size and complexity or do not provide means for a fine-grained evaluation. We propose LargeRDFBench, a billion-triple benchmark for SPARQL query federation which encompasses real data as well as real queries pertaining to real bio-medical use cases. We evaluate state-of-the-art SPARQL endpoint federation approaches on this benchmark with respect to their query runtime, triple pattern-wise source selection, number of endpoints requests, and result completeness and correctness. Our evaluation results suggest that the performance of current SPARQL query federation systems on simple queries (in terms of total triple patterns, query result set sizes, execution time, use of SPARQL features etc.) does not reflect the systems' performance on more complex queries. Moreover, current federation systems seem unable to deal with real queries that involve processing large intermediate result sets or lead to large result sets."
http://videolectures.net/iswc2018_janke_impact_distributed_rdf/,"In the last years, scalable RDF stores in the cloud have been developed, where graph data is distributed over compute and storage nodes for scaling efforts of query processing and memory needs. One main challenge in these RDF stores is the data placement strategy that can be formalized in terms of graph covers. These graph covers determine whether (a) the triples distribution is well-balanced over all storage nodes (storage balance) (b) different query results may be computed on several compute nodes in parallel (vertical parallelization) and (c) individual query results can be produced only from triples assigned to few — ideally one — storage node (horizontal containment). We analyse the impact of three most commonly used graph cover strategies in these terms and found out that balancing query workload reduces the query execution time more than reducing data transfer over network. To this end, we present our novel benchmark and open source evaluation platform Koral."
http://videolectures.net/iswc2018_giese_optiquevqs_ontologies_industry/,"An important application of semantic technologies in industry has been the formalisation of information models using OWL 2 ontologies and the use of RDF for storing and exchanging application data. Moreover, legacy data can be virtualised as RDF using ontologies following the ontology-based data access (OBDA) approach. In all these applications, it is important to provide domain experts with query formulation tools for expressing their information needs in terms of queries over ontologies. In this work, we present such a tool, OptiqueVQS, which is designed based on our experience with OBDA applications in Statoil and Siemens and on best HCI practices for interdisciplinary engineering environments. OptiqueVQS implements a number of unique techniques distinguishing it from analogous query formulation systems. In particular, it exploits ontology projection techniques to enable graph-based navigation over an ontology during query construction. Secondly, while OptiqueVQS is primarily ontology driven, it exploits sampled data to enhance selection of data values for some data attributes. Finally, OptiqueVQS is built on well grounded requirements, design rationale, and quality attributes. We evaluated OptiqueVQS with both domain experts and casual users and qualitatively compared our system against prominent visual systems for ontology-driven query formulation and exploration of semantic data. OptiqueVQS is available online and can be downloaded together with an example OBDA scenario."
http://videolectures.net/iswc2018_stolpe_distributed_query_nodes/,"This paper demonstrates that the presence of blank nodes in RDF data represents a problem for distributed processing of SPARQL queries. It is shown that the usual decomposition strategies from the literature will leak information—even when information derives from a single source. It is argued that this leakage, and the proper reparational measures, need to be accounted for in a formal semantics. To this end a set semantics for SPARQL is generalized with a parameter representing execution contexts. This makes it possible to keep tabs on the naming of blank nodes across execution contexts, which in turn makes it possible to articulate a decomposition strategy that is provably sound and complete wrt. any selection of RDF sources even when blank nodes are allowed. Alas, this strategy is not computationally tractable. However, there are ways of utilizing knowledge about the sources, if one has it, that will help considerably."
http://videolectures.net/iswc2018_madkour_woqr_workload_driven/,"Cloud-based systems provide a rich platform for managing large-scale RDF data. However, the distributed nature of these systems introduces several performance challenges, e.g., disk I/O and network shuffling overhead, especially for RDF queries that involve multiple join operations. To alleviate these challenges, this paper studies the effect of several optimization techniques that enhance the performance of RDF queries. Based on the query workload, reduced sets of intermediate results (or reductions, for short) that are common for certain join pattern(s) are computed. Furthermore, these reductions are not computed beforehand, but are rather computed only for the frequent join patterns in an online fashion using Bloom filters. Rather than caching the final results of each query, we show that caching the reductions allows reusing intermediate results across multiple queries that share the same join patterns. In addition, we introduce an efficient solution for RDF queries with unbound properties. Based on a realization of the proposed optimizations on top of Spark, extensive experimentation using two synthetic benchmarks and a real dataset demonstrates how these optimizations lead to an order of magnitude enhancement in terms of preprocessing, storage, and query performance compared to the state-of-the-art solutions."
http://videolectures.net/iswc2018_razniewski_answering_provenance_aware/,"The steadily-growing popularity of semantic data on the Web and the support for aggregation queries in SPARQL 1.1 have propelled the interest in Online Analytical Processing (OLAP) and data cubes in RDF. Query processing in such settings is challenging because SPARQL OLAP queries usually contain many triple patterns with grouping and aggregation. Moreover, one important factor of query answering on Web data is its provenance, i.e., metadata about its origin. Some applications in data analytics and access control require to augment the data with provenance metadata and run queries that impose constraints on this provenance. This task is called provenance-aware query answering. In this paper, we investigate the benefit of caching some parts of an RDF cube augmented with provenance information when answering provenance-aware SPARQL queries. We propose provenance-aware caching (PAC), a caching approach based on a provenance-aware partitioning of RDF graphs, and a benefit model for RDF cubes and SPARQL queries with aggregation. Our results on real and synthetic data show that PAC outperforms significantly the LRU strategy (least recently used) and the Jena TDB native caching in terms of hit-rate and response time."
http://videolectures.net/iswc2018_suchanek_bash_datalog/,"Dealing with large tabular datasets often requires extensive preprocessing. This preprocessing happens only once, so that loading and indexing the data in a database or triple store may be an overkill. In this paper, we present an approach that allows preprocessing large tabular data in Datalog – without indexing the data. The Datalog query is translated to Unix Bash and can be executed in a shell. Our experiments show that, for the use case of data preprocessing, our approach is competitive with state-of-the-art systems in terms of scalability and speed, while at the same time requiring only a Bash shell, and a Unix-compatible operating system."
http://videolectures.net/iswc2018_wang_towards_empty_sparql/,"The LOD cloud offers a plethora of RDF data sources where users discover items of interest by issuing SPARQL queries. A common query problem for users is to face with empty answers: given a SPARQL query that returns nothing, how to refine the query to obtain a non-empty set? In this paper, we propose an RDF graph embedding based framework to solve the SPARQL empty-answer problem in terms of a continuous vector space. We first project the RDF graph into a continuous vector space by an entity context preserving translational embedding model which is specially designed for SPARQL queries. Then, given a SPARQL query that returns an empty set, we partition it into several parts and compute approximate answers by leveraging RDF embeddings and the translation mechanism. We also generate logical and alternative queries for returned answers, which helps users recognize their expectations and refine the original query finally. To validate the effectiveness and efficiency of our framework, we conduct extensive experiments on the real-world RDF dataset. The results show that our framework can significantly improve the quality of approximate answers and speed up the generation of alternative queries."
http://videolectures.net/iswc2018_aroyo_rijksmuseum_collection_data/,"Many museums are currently providing online access to their collections. The state of the art research in the last decade shows that it is beneficial for institutions to provide their datasets as Linked Data in order to achieve easy cross-referencing, interlinking and integration. In this paper, we present the Rijksmuseum linked dataset (accessible at http://datahub.io/dataset/rijksmuseum), along with collection and vocabulary statistics, as well as lessons learned from the process of converting the collection to Linked Data. The version of March 2016 contains over 350,000 objects, including detailed descriptions and high-quality images released under a public domain license."
http://videolectures.net/iswc2018_salatino_ontology_areas/,"Ontologies of research areas are important tools for characterising, exploring, and analysing the research landscape. Some fields of research are comprehensively described by large-scale taxonomies, e.g., MeSH in Biology and PhySH in Physics. Conversely, current Computer Science taxonomies are coarse-grained and tend to evolve slowly. For instance, the ACM classification scheme contains only about 2K research topics and the last version dates back to 2012. In this paper, we introduce the Computer Science Ontology (CSO), a large-scale, automatically generated ontology of research areas, which includes about 15K topics and 70K semantic relationships. It was created by applying the Klink-2 algorithm on a very large dataset of 16M scientific articles. CSO presents two main advantages over the alternatives: i) it includes a very large number of topics that do not appear in other classifications, and ii) it can be updated automatically by running Klink-2 on recent corpora of publications. CSO powers several tools adopted by the editorial team at Springer Nature and has been used to enable a variety of solutions, such as classifying research publications, detecting research communities, and predicting research trends. To facilitate the uptake of CSO we have developed the CSO Portal, a web application that enables users to download, explore, and provide granular feedback on CSO at different levels. Users can use the portal to rate topics and relationships, suggest missing relationships, and visualise sections of the ontology. The portal will support the publication of and access to regular new releases of CSO, with the aim of providing a comprehensive resource to the various communities engaged with scholarly data."
http://videolectures.net/iswc2018_peroni_spar_ontologies/,"Over the past eight years, we have been involved in the development of a set of complementary and orthogonal ontologies that can be used for the description of the main areas of the scholarly publishing domain, known as the SPAR (Semantic Publishing and Referencing) Ontologies. In this paper, we introduce this suite of ontologies, discuss the basic principles we have followed for their development, and describe their uptake and usage within the academic, institutional and publishing communities."
http://videolectures.net/iswc2018_lofi_tse_ner_iterative/,"Named Entity Recognition and Typing (NER/NET) is a challenging task, especially with long-tail entities such as the ones found in scientific publications. These entities – e.g. ""WebKB"", ""StatSnowball"", etc. – are rare, often relevant only in specific knowledge domains, but are yet important for retrieval and exploration purposes. State-of-the-artNER approaches employ supervised machine learning models, trained on expensive type-labeled data laboriously produced by human annotators. A common workaround is the generation of labeled training data from knowledge bases; this approach is not suitable for long-tail entity types that are, by definition, scarcely represented in KBs.This paper presents an iterative approach for training NER and NET classifiers for long-tail entity types in scientific publications that relies on minimal human input, namely a small seed set of instances for the targeted entity type. We introduce different strategies for training data extraction, semantic expansion, and result entity filtering. We evaluate our approach on scientific publications, focusing on the long-tail entities typesDatasets, Methods in computer science publications, and Proteins in biomedical publications."
http://videolectures.net/iswc2018_pertsas_ontology_extraction_research/,"We address the automatic extraction from publications of two key concepts for representing research processes: the concept of research activity and the sequence relation between successive activities. These representations are driven by the Scholarly Ontology (SO), specifically conceived for documenting research processes. Unlike usual named entity extraction tasks, we are facing textual descriptions of activities of widely variable length, while pairs of successive activities often span different sentences. We developed and experimented with several sliding window classifiers using Logistic Regression, SVMs, and Random Forests, as well as a two-stage pipeline classifier. Our classifiers employ task-specific features, as well as word, part-of-speech and dependency embeddings, engineered to exploit distinctive traits of research publication written in English. The extracted activities and sequences are associated with other relevant information from publication metadata and stored as RDF triples in a knowledge base. Evaluation on datasets from three disciplines, Digital Humanities, Bioinformatics, and Medicine, shows very promising performance."
