Video_Presentation,Abstracts
http://videolectures.net/classconference2012_keahey_computing/,"Infrastructure-as-a-Service cloud computing has profoundly changed the way we procure, manage, and use compute and storage resources. Since it allows users to easily provision remote resources on-demand, it enabled whole communities to treat the acquisition of compute and storage resources as an operational consideration rather than capital acquisition. The emergence of this new model raises many questions. How will infrastructure clouds change our work patterns? Is it a viable solution for scientific applications? What challenges need to be overcome to enable and facilitate a transition to this new computing model? The Nimbus project has been promoting the use of infrastructure clouds in the scientific community for nearly a decade. In this talk, I will describe what attracted various communities to infrastructure cloud computing, give examples of how they integrated this new model into their work, and describe the challenges they encountered while doing so. I will briefly discuss how those challenges shaped the development of a variety of features in Nimbus Infrastructure as well as infrastructure cloud platform which provides an integrated set of tools enabling deployment, auto-scaling and high availability across multiple academic and commercial clouds. I will discuss scientific applications currently making use of such multi-cloud environment as well as factors shaping the future of this rapidly developing field."
http://videolectures.net/classconference2012_little_vision/,"Platform as a Service has gained great popularity over the past two years. Many vendors have rewritten their middleware handbooks, and discarded existing investments in Java EE. With the rapid growth in interest around mobile, we're starting to hear the same things: that existing middleware implementations and approaches are simply not right for the mobile developer. In short, Cloud and Mobile represent the death of middleware! However, we believe that this approach may be short-sighted and risky. Not only does enterprise Java (particularly Java EE) have a critical role to play in Java-based PaaS and mobile solutions, but it can also be used as a platform for other languages such as Ruby, that are finding growing adoption in both of these areas. The requirements for real world Cloud or Mobile applications include reliability, security, fault tolerance and much more: things that your typical enterprise middleware developer has taken for granted for four decades. In this session we will discuss the needs for enterprise Java in both Cloud and Mobile. We will also suggest how Java, the JVM and associated standards and communities need to evolve in order to better serve these two growing and important aspects computing."
http://videolectures.net/classconference2012_morin_clouds/,"Cloud computing has rapidly gained momentum in industry and research. The Silicon Valley is a unique ecosystem in the world with large companies like Google, Apple and a myriad of start-ups shaping the future of cloud computing together with leading research labs such as the AmpLab laboratory at UC Berkeley and the Lawrence Berkeley National Laboratory (LBNL). While AmpLab research activities are at the intersection of machine learning, cloud computing, and crowd sourcing, researchers at LBNL investigate cloud computing and data analytics for Science. In my talk, I will present some of the on-going research and development projects on cloud computing carried out in the San Francisco Bay area."
http://videolectures.net/classconference2012_podgorsek_applications/,"We will introduce IBM Image Construction and Composition Tool that allows you to create custom operating system content, custom middleware, IBM & non-IBM software into custom cloud content and deploy to supported Cloud Provider. ICCT provides a systematic approach to construct virtual images in the cloud. During activation of the virtual image, you can provide customisation parameters for your environment. This allows a single virtual image to take on many different forms during the activation process in the cloud, thus allowing a single image to meet a wide variety of usage scenarios and is improving your application lifecycle maintenance."
http://videolectures.net/classconference2012_talia_data/,This talk discusses two important research topics in Cloud Computing: service-oriented knowledge discovery and agent computing in Cloud systems. Cloud-based knowledge discovery issues and systems are presented and the integrated use of multi-agent systems and Clouds are discussed.
http://videolectures.net/classconference2012_di_martino_project/,"Cloud vendor lock-in and interoperability gaps arise (among many reasons) when semantics of resources and services, and of Application Programming Interfaces is not shared. Standards and techniques borrowed from SOA and Semantic Web Services areas might help in gaining shared, machine readable description of Cloud offerings (resources, Services at Platform and Application level, and their API groundings), thus allowing automatic discovery, matchmaking, and thus supporting selection, brokering, interoperability end even composition of Cloud Services among multiple Clouds. The EU funded mOSAIC project (http://www.mosaic-cloud.eu) aims at designing and developing an innovative open-source API and platform that enables applications to be Cloud providers' neutral and to negotiate Cloud services as requested by their users. Using the mOSAIC Cloud ontology and Semantic Engine, cloud applications' developers will be able to specify their services and resources requirements and communicate them to the mOSAIC Platform and Cloud Agency. The mOSAIC Cloud Agency will implement a multi-agent brokering mechanism that will search for Cloud services matching the applications’ request, and possibly compose the requested service."
http://videolectures.net/classconference2012_ducatel_leadership/,"The European Commission is making a strategic plan to promote the take-up of cloud in the EU. The actions in the plan provide a basis for tackling some of the key issues that stakeholders have identified as major barriers such as trust and security, and for contract terms that give users the confidence to adopt services that are open and portable. The Commission has also announced a European Cloud Partnership to put Europe's public authorities at the forefront of cloud adoption by developing common requirements and more common approaches in general. The presentation will explain the steps that the Commission is taking to implement these actions, the analysis behind and how the cloud communities on the ground in Member States can get involved."
http://videolectures.net/classconference2012_banatre_innovations/,"The overall objective of EIT is to establish a new, radically more responsive configuration of how Education, Research, and Business work together to create significant innovations. EIT builds on top of already existing instruments and uses its own resources to catalyse systemic and lasting changes in the Knowledge Triangle encompassing Education-Research-Business. EIT ICT Labs implements this by adopting and applying the catalyst-carrier model in focused Action Lines addressing selected societal challenges and driven by their needs and opportunities. The educational catalysts focus on robust entrepreneurship education to empower students and integrate them to innovation ecosystems. Through research catalysts for experimental and living labs, we embrace the users and engage them with our research. The business catalysts give hands-on and timely help to new ventures or entrepreneurs in large companies."
http://videolectures.net/classconference2012_antokol_computing/,"This panel will explore the widespread use of cloud computing by organizations in the US. In particular, the panel will discuss: 1) The evolving cloud computing landscape in the US—where it stands now and where it is heading; 2) The impact of the US Patriot Act on cloud storage – and whether multinational organizations are more or less likely to have to provide documents under that Act should it store documents in the cloud; 3) The coexistence of cloud computing with seeming inconsistent data privacy and regulatory laws, such as those that apply to medical, clinical research, and genetic data; 4) The risk of security breaches in the cloud—and the corresponding impact on your organization."
http://videolectures.net/classconference2012_soumelidis_cloud/,"Why Cloud Computing fits in the 21st century so well, why it will be successful and yet decision makers are currently still reluctant to go for it with enthusiasm? The key-note tries to give answers to this questions, highlighting the mega trend that fosters Cloud Computing and to uncover the obstacles that the IT industry needs to overcome to get the CIO’s full attention."
http://videolectures.net/classconference2012_zalar_habinc_fundraising/,"Raising money is hard and long process for both sides of the table. Learn firsthand how VC investor chooses his investment and how a startup entrepreneur attracts VC. Rok Habinc (managing partner at STH ventures), and Matej Zalar (founder and CEO at Visionect), will showcase some of the important steps in a fundraising process through an actual case - STH Ventures investing 1,5 mio EUR into Visionect in August 2012."
http://videolectures.net/classconference2012_reichstaedter_cloud/,"The IT industry is pushing cloud computing with the use of new paradigms. The keyword cloud means highly complex and standardized provisioning. Cloud especially change the legal environment - direct control is replaced with contractual agreements (who is responsible for for the management of data protection and the owner of the the data). We have to develop policies/guidelines especially for small public administration units (e.g. municipalities) before we start. More and more less transparency where are my data, how they are protected - maybe no national or european control. Even in the cloud we need security standards like eIDs."
http://videolectures.net/classconference2012_lind_cloud/,"This is a brief on what Helix Nebula wish to achieve by building the European science cloud in which the ever growing compute demand from European research organisations is satisfied by a ""compute exchange"" with a unified API layer and compute power supplied by the cooperative efforts of European commercial IaaS vendors."
http://videolectures.net/classconference2012_ounapuu_digital/,"As a core part of the implementing e-government solutions, a common e-Government usiness Community Model (eGCM), which is developed based on a multi-disciplinary, holistic approach, which takes into account the varikus key dimensions and the complexity of e-Government. The aim is to benchmark for the advancement of e-Government through collaboration between stakeholders and public and private partnership. The justification and objective of eGCM is to serve as e-Government framework model and reference point for research, development, demonstration, implementation and benchmarking for the e-Goverment solutions."
http://videolectures.net/classconference2012_skufca_zaversek_system/,"We are second biggest Telco provider in Slovenia and most advanced in offering cloud services in Balkan region and part of Telekom Austria Group also partner of Vodafone we target with our cloud brokerage solution first our 8 Telco’s (Austria, Bulgaria, Belarus, Croatia, Serbia, Macedonia, Lichtenstein) in Telekom Austria Group. Simobil will present successful case of national, next phase regional Brokerage cloud platform."
http://videolectures.net/classconference2012_marusic_region/,"Despite the difficult current economic enviroment in the countries of the South-Eastern European region, IT is far away from standing still. The presentation will guide the listeners through key initiatives in the region and provide a comparison with the rest of Europe."
http://videolectures.net/classconference2012_vujovic_lucic_platform/,The presentation describes implementation of the Cloud Control Panel software as a middle layer between CA AppLogic cloud platform for enterprises and service providers and end-users.Cloud Control Panel solution is designed to ensure fast and efficient delivery of business services and provides a low risk method for increasing agility and reducing costs. The emphasis is on the enhancements of the service design and management capabilities of cloud platform infrastructure.
http://videolectures.net/classconference2012_car_cloud/,"There is a lot of buzz about different Cloud solutions available on the market. But when one tries those solutions in practice, it becomes obvious that components or knowledge is largely still missing. Together with Combis, T-HT has deployed Public Cloud solutions. This real life experience gives us good insight what are crucial technical and marketing parameters for success."
http://videolectures.net/classconference2012_petcu_hpc/,"An overview is provided about different aspects of the HPC in the Cloud like what profile has an HPC application which can be efficient in a Cloud environment, how to coupe with the elasticity characteristic, or when the costs are in favor of selecting a Cloud environment."
http://videolectures.net/classconference2012_schubert_infrastructures/,"Future usage requirements are designated by a vast heterogeneity on all levels: not only types of resources, but also interconnects, use cases and users. And yet, it will be expected that they all will be supported equally well with little additional effort on behalf of the user and, ideally, the developer. Classical execution and programming mechanisms, i.e. operating systems, virtualisation technologies etc. are insufficient for this vision. Instead, a complete rethinking of how we understand programs and execution is necessary."
http://videolectures.net/classconference2012_nemirowsky_fog/,"""Fog computing"" is a new paradigm that exploits the benefits of virtualized IT infrastructures closer to end-users. In a nutshell, Fog computing offers an appealing combination of computational power, storage capacity, and networking services at the edge of the networks. Fog computing supports applications and services that require very low latency, location awareness, and mobility (including vehicular mobility). The spectrum of potential uses cases is huge, and Fog computing works in concert with Cloud computing. Indeed, Fog promises to extend the reach and complement current cloud services. Smart cities, smart grid, smart connected vehicles are active areas where Fog plays a significant role. Emerging distributed services and applications at the edge of the network is the theme of FOG workshop. The workshop will be an excellent forum to present and discuss hierarchical partitioning of computation and data, distributed algorithms for data and computation placement, security issues in a multi-tenant environment, and network-based computing and storage. The FOG workshop aims at bringing together researchers from Academia and Industry, to identify and discuss technical challenges, exchange novel ideas, and explore enabling technologies."
http://videolectures.net/classconference2012_baskovc_result/,"The goal of national project KC Class is a development of services and products in the area of cloud computing. With the development of competences in this area it is possible to increase the competitiveness of cooperating partners in the project as well as – with the help of access to the newest technologies and knowledge in this area – competitiveness of Slovene economy in general. The development of KC will be based on: international breakthrough of services and products, scientific excellence and long-term development in building of the consortium. The key component for achieving the objectives is an effective knowledge flow from research institutions to the companies and back. With this we enable transfer of knowledge gained in research to innovative services and products with a high added value. Through standardized activities the consortium will support open interfaces and protocols."
http://videolectures.net/classconference2012_petcu_results/,"mOSAIC facilitates development of platform and language agnostic Cloud applications. An API, software platform and tools are provided to manage the overall life-cycle of Cloud applications. The mOSAIC project has been by selected by SEQUOIA as one of the five EC projects of the ICT- Internet of Services area, which scored highest in terms of potential socio-economic impact."
http://videolectures.net/classconference2012_harsh_results/,"Contrail (http://contrail-project.eu/) develops an integrated approach to virtualization. It offers smart provisioning of resources over IaaS clouds through Virtual Execution Platform (http://vep.gforge.inria.fr/), provides services for federating IaaS clouds and Contrail Platform as a Service (ConPaaS) (http://www.conpaas.eu/) stack on top of federated clouds. Contrail technology also deploys the reliable cloud file system XtreemFS/GAFS (http://www.xtreemfs.org/) to provide location aware storage service. One of the primary objectives of Contrail is to offer performance (QoS) and security (QoP) guarantees via SLA enforcement, data location awareness, and a scalable management of the computing resources via an interoperable Federation. The first public release of the Contrail system is available (http://contrail.projects.ow2.org/xwiki/bin/view/Main/WebHome)."
http://videolectures.net/classconference2012_stankovski_results/,"The series of Workshops on Software Services (WoSS) is dedicated to recent significant developments in the field of software services. WoSS intends to be an open forum for academics, practitioners, and vendors, allowing them to discuss the current trends and scientific and technological challenges, such as service quality assurance, adaptability, reliability, interoperability, and automating service-oriented application construction and management. The first three editions of this forum were organized with the support of the FP7-ICT SPRERS project, with the aim to highlight the achievements of the on-going European collaborative projects subscribing to FP7-ICT programme and the activities of the teams from new member states in software services area. The fourth edition is dedicated to Cloud and Grid Applications for Science and Industry and is supported by the FP7-ICT mOSAIC project."
http://videolectures.net/classconference2012_verber_future/,"This paper discusses the two of the most pervasive topics in information technology today: cloud computing and mobile computing. The paper describes the opportunities and challenges offered by a combination of these technologies. The current conditions are presented, followed by some existing solutions in this area. Some examples of archetypal cloud services for mobile applications are offered."
http://videolectures.net/classconference2012_baskovc_certification/,"Security and compliance are two the most important issues that stand out from the many that exist within cloud computing. By working out the fundamentals of the legal background, EuroCloud Europe has started important projects to improve the general framework for a successful implementation of Cloud services in different areas (software, platform and infrastructure)."
http://videolectures.net/classconference2012_petcu_support/,"In this paper we argue that the Platform-as-a-Service (PaaS) has a high potential to improve the state-of-the-art of infrastructure programmability. In this context we analyze the basic requirements for programmability and their fulfillment by the current PaaSs. As case study, the readiness for programming infrastructure of a recent developed open- source PaaS is analyzed."
http://videolectures.net/classconference2012_skerlavaj_monitoring/,"IT infrastructure monitoring system keeps the running costs low and allows the services to run uninterrupted. In this presentation the basic properties of such system will be outlined, especially in connection with overall infrastructure overview, early error detection and prevention techniques, infrastructure management accountability (audit logs) and configuration changes monitoring."
http://videolectures.net/classconference2012_bule_class/,"The aim of our work is the implementation of biometric verification based on fingerprints in a cloud platform. Within this work we 1) develop own system for verification of persons based on fingerprint, 2) integrate system in a cloud platform, 3) address aspect of data security and authentication data fusion, 4) use adjusted e-learning system as a test environment for proof-of-concept. A pilot version of the entire system is already installed."
http://videolectures.net/classconference2012_cigoj_cloud/,"Provided security is one of the key requirements of cloud computing users. In our presentation we will give a short overview of the current state of security in cloud computing, introduce security mechanisms that are part of the latest OpenStack version, and present guidelines for the secure use of OpenStack."
http://videolectures.net/classconference2012_potocnik_integration/,"Although in the recent years there has been an increase of SaaS (Software as a Service) applications providing the new opportunities, we still face the integration challenges that have been known in the world of local, siloed applications. The main reason for integration problems is the insufficient mechanisms for integration of SaaS applications that are conceptually different from local applications. As the use of SaaS applications grows the need for efficient and robust integration approach is becoming obvious. In our presentation, we will present the requirements for the realization of SaaS integration and how the IPaaS (Integration Platform as a Service) addresses integration challenges in the cloud. We will also present today’s innovative IPaaS solutions and how could next-generation SaaS integration look like in the future."
http://videolectures.net/classconference2012_tomasic_hadoop/,MapReduce is a programming model implemented with a library for processing large datasets - often termed as BigData - on clusters of commodity computers. MapReduce is typically used for distributed processing of non-structured datasets. The map function processes key/value pairs and generates intermediate key/value pairs based on user specified map function. The reduce function merges and processes intermediate values belonging to the same key. A simple example of MapReduce will be shown on the open source software framework Apache Hadoop.
http://videolectures.net/classconference2012_dukaric_platform/,"The recent development in cloud computing also resulted in a demand for designing and executing Java EE applications in the cloud environment. The existing design of Java EE does not allow the developers and infrastructure providers to take full advantage of cloud computing for running such applications — containers do not scale automatically, multitenancy is not supported and finally, there are no monitoring capabilities. In this paper we review the characteristics of Java EE execution in the cloud environment and propose a parameter system to support and effect the deployment and application execution. Based on the proposed parameter system we derive metadata which can be used by developers to take the advantage of cloud specific behaviour. We show how metadata was implemented and how the application scalability capabilities were improved."
http://videolectures.net/classconference2012_dukaric_solutions/,"Infrastructure as a Service (IaaS) is one of the most important layers of Cloud Computing. However, there is an evident deficiency of mechanisms for analysis, comparison and evaluation of IaaS cloud implementations, since no unified reference architecture is available. In this article, we propose a reference IaaS architectural framework. The reference framework is structured around seven layers: core service layer, support layer, value-added services, control layer, management layer, security layer and resource abstraction. We provide detailed description of each layer and define dependencies between the layers and components. Finally, we validate the proposed reference IaaS architectural framework on several real-world projects, while performing a comprehensive analysis of the most important commercial and open-source IaaS products. The evaluation results show notable distinction of feature support and capabilities between commercial and open-source IaaS platforms, significant deficiency of important architectural components in terms of fulfilling true promise of infrastructure clouds, and real-world usability of the proposed architectural framework."
http://videolectures.net/classconference2012_czarnul_providers/,"The paper focuses on how to create an effective dynamic ranking service for IaaS, PaaS and SaaS cloud providers. It considers building of a quality model for this purpose along with definition of quality measurement procedures. The paper discusses several techniques known from already existing price comparison engines that could be modified and adopted for comparison of cloud providers. Furthermore, a technique for filtering measured data is proposed, in particular to avoid vendor lock-in issues."
