Video_Presentation,Abstracts
http://videolectures.net/eccv2016_tang_normalized_cut/,"We propose a new segmentation model combining common regularization energies, e.g. Markov Random Field (MRF) potentials, and standard pairwise clustering criteria like Normalized Cut (NC), average association (AA), etc. These clustering and regularization models are widely used in machine learning and computer vision, but they were not combined before due to significant differences in the corresponding optimization, e.g. spectral relaxation and combinatorial max-flow techniques. On the one hand, we show that many common applications using MRF segmentation energies can benefit from a high-order NC term, e.g. enforcing balanced clustering of arbitrary high-dimensional image features combining color, texture, location, depth, motion, etc. On the other hand, standard clustering applications can benefit from an inclusion of common pairwise or higher-order MRF constraints, e.g. edge alignment, bin-consistency, label cost, etc. To address joint energies like NC+MRF, we propose efficient Kernel Cut algorithms based on bound optimization. While focusing on graph cut and move-making techniques, our new unary (linear) kernel and spectral bound formulations for common pairwise clustering criteria allow to integrate them with any regularization functionals with existing discrete or continuous solvers."
http://videolectures.net/eccv2016_koltun_global_registration/,"We present an algorithm for fast global registration of partially overlapping 3D surfaces. The algorithm operates on candidate matches that cover the surfaces. A single objective is optimized to align the surfaces and disable false matches. The objective is defined densely over the surfaces and the optimization achieves tight alignment with no initialization. No correspondence updates or closest-point queries are performed in the inner loop. An extension of the algorithm can perform joint global registration of many partially overlapping surfaces. Extensive experiments demonstrate that the presented approach matches or exceeds the accuracy of state-of-the-art global registration pipelines, while being at least an order of magnitude faster. Remarkably, the presented approach is also faster than local refinement algorithms such as ICP. It provides the accuracy achieved by well-initialized local refinement algorithms, without requiring an initialization and at lower computational cost."
http://videolectures.net/eccv2016_douze_polysemous_codes/,"This paper considers the problem of approximate nearest neighbor search in the compressed domain. We introduce polysemous codes, which offer both the distance estimation quality of product quantization and the efficient comparison of binary codes with Hamming distance. Their design is inspired by algorithms introduced in the 90's to construct channel-optimized vector quantizers. At search time, this dual interpretation accelerates the search. Most of the indexed vectors are filtered out with Hamming distance, letting only a fraction of the vectors to be ranked with an asymmetric distance estimator.  The method is complementary with a coarse partitioning of the feature space such as the inverted multi-index. This is shown by our experiments performed on several public benchmarks such as the BIGANN dataset comprising one billion vectors, for which we report state-of-the-art results for query times below 0.3\,millisecond per core. Last but not least, our approach allows the approximate computation of the k-NN graph associated with the Yahoo Flickr Creative Commons 100M, described by CNN image descriptors, in less than 8 hours on a single machine."
http://videolectures.net/eccv2016_do_binary_hashing/,"This paper proposes two approaches for inferencing binary codes in two-step (supervised, unsupervised) hashing. We first introduce an unified formulation for both supervised and unsupervised hashing. Then, we cast the learning of one bit as a Binary Quadratic Problem (BQP). We propose two approaches to solve BQP. In the first approach, we relax BQP as a semidefinite programming problem which its global optimum can be achieved. We theoretically prove that the objective value of the binary solution achieved by this approach is well bounded. In the second approach, we propose an augmented Lagrangian based approach to solve BQP directly without relaxing the binary constraint. Experimental results on three benchmark datasets show that our proposed methods compare favorably with the state of the art."
http://videolectures.net/eccv2016_desmaison_continuous_relaxations/,"Dense conditional random fields (CRF) with Gaussian pairwise potentials have emerged as a popular framework for several computer vision applications such as stereo correspondence and semantic segmentation. By modeling long-range interactions, dense CRFs provide a more detailed labelling compared to their sparse counterparts. Variational inference in these dense models is performed using a filtering-based mean-field algorithm in order to obtain a fully-factorized distribution minimising the Kullback-Leibler divergence to the true distribution. In contrast to the continuous relaxation-based energy minimisation algorithms used for sparse CRFs, the mean-field algorithm fails to provide strong theoretical guarantees on the quality of its solutions. To address this deficiency, we show that it is possible to use the same filtering approach to speed-up the optimisation of several continuous relaxations. Specifically, we solve a convex quadratic programming (QP) relaxation using the efficient Frank-Wolfe algorithm. This also allows us to solve difference-of-convex relaxations via the iterative concave-convex procedure where each iteration requires solving a convex QP. Finally, we develop a novel divide-and-conquer method to compute the subgradients of a linear programming relaxation that provides the best theoretical bounds for energy minimisation. We demonstrate the advantage of continuous relaxations over the widely used mean-field algorithm on publicly available datasets."
http://videolectures.net/eccv2016_shekhovtsov_discrete_energy/,"Discrete energy minimization is widely-used in computer vision and machine learning for problems such as MAP inference in graphical models. The problem, in general, is notoriously intractable, and finding the global optimal solution is known to be NP-hard. However, is it possible to approximate this problem with a reasonable ratio bound on the solution quality in polynomial time? We show in this paper that the answer is no. Specifically, we show that general energy minimization, even in the 2-label pairwise case, and planar energy minimization with three or more labels are exp-APX-complete. This finding rules out the existence of any approximation algorithm with a sub-exponential approximation ratio in the input size for these two problems, including constant factor approximations. Moreover, we collect and review the computational complexity of several subclass problems and arrange them on a complexity scale consisting of three major complexity classes -- PO, APX, and exp-APX, corresponding to problems that are solvable, approximable, and inapproximable in polynomial time. Problems in the first two complexity classes can serve as alternative tractable formulations to the inapproximable ones. This paper can help vision researchers to select an appropriate model for an application or guide them in designing new algorithms."
http://videolectures.net/eccv2016_windheuser_convex_solution/,"We propose a convex formulation of the correspondence problem between two images with respect to an energy function measuring data consistency and spatial regularity. To this end, we formulate the general correspondence problem as the search for a minimal two-dimensional surface in R4. We then use tools from geometric measure theory and introduce 2-vector fields as a representation of two-dimensional surfaces in R4. We propose a discretization of this surface formulation that gives rise to a convex minimization problem and compute a globally optimal solution using an efficient primal-dual algorithm."
http://videolectures.net/eccv2016_barron_bilateral_solver/,"We present the bilateral solver, a novel algorithm for edge-aware smoothing that combines the flexibility and speed of simple filtering approaches with the accuracy of domain-specific optimization algorithms. Our technique is capable of matching or improving upon state-of-the-art results on several different computer vision tasks (stereo, depth superresolution, colorization, and semantic segmentation) while being 10-1000 times faster than competing approaches. The bilateral solver is fast, robust, straightforward to generalize to new domains, and simple to integrate into deep learning pipelines."
http://videolectures.net/eccv2016_zhang_image_colorization/,"Given a grayscale photograph as input, this paper attacks the problem of hallucinating a plausible color version of the photograph. This problem is clearly underconstrained, so previous approaches have either relied on significant user interaction or resulted in desaturated colorizations. We propose a fully automatic approach that produces vibrant and realistic colorizations. We embrace the underlying uncertainty of the problem by posing it as a classification task and use class-rebalancing at training time to increase the diversity of colors in the result. The system is implemented as a feed-forward pass in a CNN at test time and is trained on over a million color images. We evaluate our algorithm using a ""colorization Turing test,"" asking human participants to choose between a generated and ground truth color image. Our method successfully fools humans on 32% of the trials, significantly higher than previous methods. Moreover, we show that colorization can be a powerful pretext task for self-supervised feature learning, acting as a cross-channel encoder. This approach results in state-of-the-art performance on several feature learning benchmarks."
http://videolectures.net/eccv2016_alexander_focal_flow/,"We present the focal flow sensor. It is an unactuated, monocular camera that simultaneously exploits defocus and differential motion to measure a depth map and a 3D scene velocity field. It does so using an optical-flow-like, per-pixel linear constraint that relates image derivatives to depth and velocity. We derive this constraint, prove its invariance to scene texture, and prove that it is exactly satisfied only when the sensor’s blur kernels are Gaussian. We analyze the inherent sensitivity of the ideal focal flow sensor, and we build and test a prototype. Experiments produce useful depth and velocity information for a broader set of aperture configurations, including a simple lens with a pillbox aperture."
http://videolectures.net/eccv2016_gkioulekas_inverse_scattering/,"Inferring internal scattering parameters for general, heterogeneous materials, remains a challenging inverse problem. Its difficulty arises from the complex way in which scattering materials interact with light, as well as the very high dimensionality of the material space implied by heterogeneity. The recent emergence of diverse computational imaging techniques, together with the widespread availability of computing power, present a renewed opportunity for tackling this problem. We take first steps in this direction, by deriving theoretical results, developing an algorithmic framework, and performing quantitative evaluations for the problem of heterogeneous inverse scattering from simulated measurements of different computational imaging configurations."
http://videolectures.net/eccv2016_li_adversatial_networks/,"This paper proposes Markovian Generative Adversarial Networks (MGANs), a method for training generative neural networks for efficient texture synthesis. While deep neural network approaches have recently demonstrated remarkable results in terms of synthesis quality, they still come at considerable computational costs (minutes of run-time for low-res images). Our paper addresses this efficiency issue. Instead of a numerical deconvolution in previous work, we precompute a feed-forward, strided convolutional network that captures the feature statistics of Markovian patches and is able to directly generate outputs of arbitrary dimensions. Such network can directly decode brown noise to realistic texture, or photos to artistic paintings. With adversarial training, we obtain quality comparable to recent neural texture synthesis methods. As no optimization is required any longer at generation time, our run-time performance (0.25M pixel images at 25Hz) surpasses previous neural texture synthesizers by a significant margin (at least 500 times faster). We apply this idea to texture synthesis, style transfer, and video stylization."
http://videolectures.net/eccv2016_lu_depth_motion/,"We study the problems of upsampling a low-resolution depth map and interpolating an initial set of sparse motion matches, with the guidance from a corresponding high-resolution color image. The common objective for both tasks is to densify a set of sparse data points, either regularly distributed or scattered, to a full image grid through a 2D guided interpolation process. We propose a unified approach that casts the fundamental guided interpolation problem into a hierarchical, global optimization framework. Built on a weighted least squares (WLS) formulation with its recent fast solver – fast global smoothing (FGS) technique, our method progressively densifies the input data set by ef- ficiently performing the cascaded, global interpolation (or smoothing) with alternating guidances. Our cascaded scheme effectively addresses the potential structure inconsistency between the sparse input data and the guidance image, while preserving depth or motion boundaries. To prevent new data points of low confidence from contaminating the next interpolation process, we also prudently evaluate the consensus of the interpolated intermediate data. Experiments show that our general interpolation approach successfully tackles several notorious challenges. Our method achieves quantitatively competitive results on various benchmark evaluations, while running much faster than other competing methods designed specifically for either depth upsampling or motion interpolation."
http://videolectures.net/eccv2016_xiao_document_photographs/,"Photographs of text documents taken by hand-held cameras can be easily degraded by camera motion during exposure. In this paper, we propose a new method for blind deconvolution of document images. Observing that document images are usually dominated by small-scale high-order structures, we propose to learn a multi-scale, interleaved cascade of shrinkage fields model, which contains a series of high-order filters to facilitate joint recovery of blur kernel and latent image. With extensive experiments, we show that our method produces high quality results and is highly efficient at the same time, making it a practical choice for deblurring high resolution text images captured by modern mobile devices."
http://videolectures.net/eccv2016_torii_inverse_rendering/,"3D shape reconstruction with multi-view stereo (MVS) relies on a robust evaluation of photo consistencies across images. The robustness is ensured by isolating surface albedo and scene illumination from the shape recovery, i.e. shading and colour variation are regarded as a nuisance in MVS. This yields a gap in the qualities between the recovered shape and the images used. We present a method to address it by jointly estimating detailed shape, illumination and albedo using the initial shape robustly recovered by MVS. This is achieved by solving the multi-view inverse rendering problem using the geometric and photometric smoothness terms and the normalized spherical harmonics illumination model. Our method allows spatially-varying albedo and per image illumination without any prerequisites such as training data or image segmentation. We demonstrate that our method can clearly improve the 3D shape and recover illumination and albedo on real world scenes."
http://videolectures.net/eccv2016_rastegari_neural_networks/,"We propose two efficient approximations to standard convolutional neural networks: Binary-Weight-Networks and XNOR-Networks. In Binary-Weight-Networks, the filters are approximated with binary values resulting in 32x memory saving. In XNOR-Networks, both the filters and the input to convolutional layers are binary. XNOR-Networks approximate convolutions using primarily binary operations. This results in 58x faster convolutional operations and 32x memory savings. XNOR-Nets offer the possibility of running state-of-the-art networks on CPUs (rather than GPUs) in real-time. Our binary networks are simple, accurate, efficient, and work on challenging visual tasks. We evaluate our approach on the ImageNet classification task. The classification accuracy with a Binary-Weight-Network version of AlexNet is only 2.9% less than the full-precision AlexNet (in top-1 measure). We compare our method with recent network binarization methods, BinaryConnect and BinaryNets, and outperform these methods by large margins on ImageNet, more than 16% in top-1 accuracy."
http://videolectures.net/eccv2016_sclaroff_excitation_backprop/,"We aim to model the top-down attention of a Convolutional Neural Network (CNN) classifier for generating task-specific attention maps. Inspired by a top-down human visual attention model, we propose a new backpropagation scheme, called Excitation Backprop, to pass along top-down signals downwards in the network hierarchy via a probabilistic Winner-Take-All process. Furthermore, we introduce the concept of contrastive attention to make the top-down attention maps more discriminative. In experiments, we demonstrate the accuracy and generalizability of our method in weakly supervised localization tasks on the MS COCO, PASCAL VOC07 and ImageNet datasets. The usefulness of our method is further validated in the text-to-region association task. On the Flickr30k Entities dataset, we achieve promising performance in phrase localization by leveraging the top-down attention of a CNN model that has been trained on weakly labeled web images."
http://videolectures.net/eccv2016_liu_recursive_filters/,"In this paper, we consider numerous low-level vision problems (e.g., edge-preserving filtering and denoising) as recursive image filtering via a hybrid neural network. The network contains several spatially variant recurrent neural networks (RNN) as equivalents of a group of distinct recursive filters for each pixel, and a deep convolutional neural network (CNN) that learns the weights of RNNs. The deep CNN can learn regulations of recurrent propagation for various tasks and effectively guides recurrent propagation over an entire image. The proposed model does not need a large number of convolutional channels nor big kernels to learn features for low-level vision filters. It is significantly smaller and faster in comparison with a deep CNN based image filter. Experimental results show that many low-level vision tasks can be effectively learned and carried out in real-time by the proposed algorithm."
http://videolectures.net/eccv2016_larsson_automatic_colorization/,"We develop a fully automatic image colorization system. Our approach leverages recent advances in deep networks, exploiting both low-level and semantic representations. As many scene elements naturally appear according to multimodal color distributions, we train our model to predict per-pixel color histograms. This intermediate output can be used to automatically generate a color image, or further manipulated prior to image formation. On both fully and partially automatic colorization tasks, we outperform existing methods. We also explore colorization as a vehicle for self-supervised visual representation learning."
http://videolectures.net/eccv2016_ghifary_domain_adaptation/,"In this paper, we propose a novel unsupervised domain adaptation algorithm based on deep learning for visual object recognition. Specifically, we design a new model called Deep Reconstruction-Classification Network (DRCN), which jointly learns a shared encoding representation for two tasks: i) supervised classification of labeled source data, and ii) unsupervised reconstruction of unlabeled target data.In this way, the learnt representation not only preserves discriminability, but also encodes useful information from the target domain. Our new DRCN model can be optimized by using backpropagation similarly as the standard neural networks.  We evaluate the performance of DRCN on a series of cross-domain object recognition tasks, where DRCN provides a considerable improvement (up to 8% in accuracy) over the prior state-of-the-art algorithms. Interestingly, we also observe that the reconstruction pipeline of DRCN transforms images from the source domain into images whose appearance resembles the target dataset. This suggests that DRCN's performance is due to constructing a single composite representation that encodes information about both the structure of target images and the classification of source images. Finally, we provide a formal analysis to justify the algorithm's objective in domain adaptation context."
http://videolectures.net/eccv2016_li_without_forgetting/,"When building a unified vision system or gradually adding new capabilities to a system, the usual assumption is that training data for all tasks is always available. However, as the number of tasks grows, storing and retraining on such data becomes infeasible. A new problem arises where we add new capabilities to a Convolutional Neural Network (CNN), but the training data for its existing capabilities are unavailable. We propose our Learning without Forgetting method, which uses only new task data to train the network while preserving the original capabilities. Our method performs favorably compared to commonly used feature extraction and fine-tuning adaption techniques and performs similarly to multitask learning that uses original task data we assume unavailable. A more surprising observation is that Learning without Forgetting may be able to replace fine-tuning as standard practice for improved new task performance."
http://videolectures.net/eccv2016_zhang_residual_networks/,"Deep residual networks have emerged as a family of extremely deep architectures showing compelling accuracy and nice convergence behaviors. In this paper, we analyze the propagation formulations behind the residual building blocks, which suggest that the forward and backward signals can be directly propagated from one block to any other block, when using identity mappings as the skip connections and after-addition activation. A series of ablation experiments support the importance of these identity mappings. This motivates us to propose a new residual unit, which makes training easier and improves generalization. We report improved results using a 1001-layer ResNet on CIFAR-10 (4.62% error) and CIFAR-100, and a 200-layer ResNet on ImageNet. Code is available at https://github.com/KaimingHe/resnet-1k-layers."
http://videolectures.net/eccv2016_sun_deep_networks/,"Very deep convolutional networks with hundreds of layers have led to significant reductions in error on competitive benchmarks. Although the unmatched expressiveness of the many layers can be highly desirable at test time, training very deep networks comes with its own set of challenges. The gradients can vanish, the forward flow often diminishes, and the training time can be painfully slow. To address these problems, we propose stochastic depth, a training procedure that enables the seemingly contradictory setup to train short networks and use deep networks at test time. We start with very deep networks but during training, for each mini-batch, randomly drop a subset of layers and bypass them with the identity function. This simple approach complements the recent success of residual networks. It reduces training time substantially and improves the test error significantly on almost all data sets that we used for evaluation. With stochastic depth we can increase the depth of residual networks even beyond 1200 layers and still yield meaningful improvements in test error (4.91% on CIFAR-10)."
http://videolectures.net/eccv2016_zhou_compact_cnns/,"To attain a favorable performance on large-scale datasets, convolutional neural networks (CNNs) are usually designed to have very high capacity involving millions of parameters. In this work, we aim at optimizing the number of neurons in a network, thus the number of parameters. We show that, by incorporating sparse constraints into the objective function, it is possible to decimate the number of neurons during the training stage. As a result, the number of parameters and the memory footprint of the neural network are also reduced, which is also desirable at the test time. We evaluated our method on several well-known CNN structures including AlexNet, and VGG over different datasets including ImageNet. Extensive experimental results demonstrate that our method leads to compact networks. Taking first fully connected layer as an example, our compact CNN contains only 30%30% of the original neurons without any degradation of the top-1 classification accuracy."
