0,1
http://videolectures.net/eswc2016_ruan_queriability_to_informativity/,"In recent years, an increasing number of semantic data sources have been published on the web. These sources are further interlinked to form the Linking Open Data (LOD) cloud. To make full use of these data sets, it is necessary to learn their data qualities. Researchers have proposed several metrics and have developed numerous tools to measure the qualities of the data sets in LOD from different dimensions. However, there exist few studies on evaluating data set quality from the users’ usability perspective and usability has great impacts on the spread and reuse of LOD data sets. On the other hand, usability is well studied in the area of software quality. In the newly published standard ISO/IEC 25010, usability is further broadened to include the notion of “quality in use” besides the other two factors, namely, internal and external. In this paper, we first adapt the notions and the methods used in software quality to assess the data set quality. Second, we formally define two quality dimensions, namely, Queriability and Informativity from the perspective of quality in use. The two proposed dimensions correspond to querying and answering, respectively, which are the most frequent usage scenarios for accessing LOD data sets. Then we provide a series of metrics to measure the two dimensions. Last, we apply the metrics to two representative data sets in LOD (i.e., YAGO and DBpedia). In the evaluating process, we select dozens of questions from both QALD and WebQuestions and ask a group of users to construct queries as well as to check the answers with the help of our usability testing tool. The findings during the assessment not only illustrate the capability of our method and metrics but also give new insights on data quality of the two knowledge bases."
http://videolectures.net/eswc2016_roeder_topic_modelling/,"The Web of data is growing continuously with respect to both the size and number of the datasets published. Porting a dataset to five-star Linked Data however requires the publisher of this dataset to link it with the already available linked datasets. Given the size and growth of the Linked Data Cloud, the current mostly manual approach used for detecting relevant datasets for linking is obsolete. We study the use of topic modelling for dataset search experimentally and present Tapioca, a linked dataset search engine that provides data publishers with similar existing datasets automatically. Our search engine uses a novel approach for determining the topical similarity of datasets. This approach relies on probabilistic topic modelling to determine related datasets by relying solely on the metadata of datasets. We evaluate our approach on a manually created gold standard and with a user study. Our evaluation shows that our algorithm outperforms a set of comparable baseline algorithms including standard search engines significantly by 6 % F1-score. Moreover, we show that it can be used on a large real world dataset with a comparable performance."
http://videolectures.net/eswc2016_gunaratna_gleaning_types/,"Associating meaning with data in a machine-readable format is at the core of the Semantic Web vision, and typing is one such process. Typing (assigning a class selected from schema) information can be attached to URI resources in RDF/S knowledge graphs and datasets to improve quality, reliability, and analysis. There are two types of properties: object properties, and datatype properties. Type information can be made available for object properties as their object values are URIs. Typed object properties allow richer semantic analysis compared to datatype properties, whose object values are literals. In fact, many datatype properties can be analyzed to suggest types selected from a schema similar to object properties, enabling their wider use in applications. In this paper, we propose an approach to glean types for datatype properties by processing their object values. We show the usefulness of generated types by utilizing them to group facts on the basis of their semantics in computing diversified entity summaries by extending a state-of-the-art summarization algorithm."
http://videolectures.net/eswc2016_rouces_heterogeneous_knowledge/,"With recent advances in information extraction techniques, various large-scale knowledge bases covering a broad range of knowledge have become publicly available. As no single knowledge base covers all information, many applications require access to integrated knowledge from multiple knowledge bases. Achieving this, however, is challenging due to differences in knowledge representation. To address this problem, this paper proposes to use linguistic frames as a common representation and maps heterogeneous knowledge bases to the FrameBase schema, which is formed by a large inventory of these frames. We develop several methods to create complex mappings from external knowledge bases to this schema, using text similarity measures, machine learning, and different heuristics. We test them with different widely used large-scale knowledge bases, YAGO2s, Freebase and WikiData. The resulting integrated knowledge can then be queried in a homogeneous way."
http://videolectures.net/eswc2016_schaible_open_data/,"Deciding which RDF vocabulary terms to use when modeling data as Linked Open Data (LOD) is far from trivial. In this paper, we propose TermPicker as a novel approach enabling vocabulary reuse by recommending vocabulary terms based on various features of a term. These features include the term’s popularity, whether it is from an already used vocabulary, and the so-called schema-level pattern (SLP) feature that exploits which terms other data providers on the LOD cloud use to describe their data. We apply Learning To Rank to establish a ranking model for vocabulary terms based on the utilized features. The results show that using the SLP-feature improves the recommendation quality by 29–36 % considering the Mean Average Precision and the Mean Reciprocal Rank at the first five positions compared to recommendations based on solely the term’s popularity and whether it is from an already used vocabulary."
http://videolectures.net/eswc2016_pareti_linking_data/,"An increasing number of everyday tasks involve a mixture of human actions and machine computation. This paper presents the first framework that allows non-programmer users to create and execute workflows where each task can be completed by a human or a machine. In this framework, humans and machines interact through a shared knowledge base which is both human and machine understandable. This knowledge base is based on the prohow Linked Data vocabulary that can represent human instructions and link them to machine functionalities. Our hypothesis is that non-programmer users can describe how to achieve certain tasks at a level of abstraction which is both human and machine understandable. This paper presents the prohow vocabulary and describes its usage within the proposed framework. We substantiate our claim with a concrete implementation of our framework and by experimental evidence."
http://videolectures.net/eswc2016_avgoustaki_provenance_management/,"Tracking the provenance of information published on the Web is of crucial importance for effectively supporting trustworthiness, accountability and repeatability in the Web of Data. Although extensive work has been done on computing the provenance for SPARQL queries, little research has been conducted for the case of SPARQL updates. This paper proposes a new provenance model that borrows properties from both how and where provenance models, and is suitable for capturing the triple and attribute level provenance of data introduced via SPARQL INSERT updates. To the best of our knowledge, this is the first model that deals with the provenance of SPARQL updates using algebraic expressions, in the spirit of the well-established model of provenance semirings. We present an algorithm that records the provenance of SPARQL update results, and a reconstruction algorithm that uses this provenance to identify a SPARQL update that is compatible to the original one, given only the recorded provenance. Our approach is implemented and evaluated on top of Virtuoso Database Engine."
http://videolectures.net/eswc2016_cheatham_record_linkage/,"The rise of Big Data Analytics has shown the utility of analyzing all aspects of a problem by bringing together disparate data sets. Efficient and accurate private record linkage algorithms are necessary to achieve this. However, records are often linked based on personally identifiable information, and protecting the privacy of individuals is critical. This paper contributes to this field by studying an important component of the private record linkage problem: linking based on names while keeping those names encrypted, both on disk and in memory. We explore the applicability, accuracy and speed of three different primary approaches to this problem (along with several variations) and compare the results to common name-matching metrics on unprotected data. While these approaches are not new, this paper provides a thorough analysis on a range of datasets containing systematically introduced flaws common to name-based data entry, such as typographical errors, optical character recognition errors, and phonetic errors."
http://videolectures.net/eswc2016_ben_ellefi_data_linking/,"With the growing quantity and diversity of publicly available web datasets, most notably Linked Open Data, recommending datasets, which meet specific criteria, has become an increasingly important, yet challenging problem. This task is of particular interest when addressing issues such as entity retrieval, semantic search and data linking. Here, we focus on that last issue. We introduce a dataset recommendation approach to identify linking candidates based on the presence of schema overlap between datasets. While an understanding of the nature of the content of specific datasets is a crucial prerequisite, we adopt the notion of dataset profiles, where a dataset is characterized through a set of schema concept labels that best describe it and can be potentially enriched by retrieving their textual descriptions. We identify schema overlap by the help of a semantico-frequential concept similarity measure and a ranking criterium based on the tf*idf cosine similarity. The experiments , conducted over all available linked datasets on the Linked Open Data cloud, show that our method achieves an average precision of up to 53% for a recall of 100%. As an additional contribution, our method returns the mappings between the schema concepts across datasets – a particularly useful input for the data linking step."
http://videolectures.net/eswc2016_zheng_iterative_entity/,"With the increasing volume of Linked Data, the diverse links and the large amount of linked entities make it difficult for users to traverse RDF data. As semantic links and classes of linked entities are two key aspects to help users navigate, clustering links and classes can offer effective ways of navigating over RDF data. In this paper, we propose a co-clustering approach to provide users with iterative entity navigation. It clusters both links and classes simultaneously utilizing both the relationship between link and class, and the intra-link relationship and intra-class relationship. We evaluate our approach on a real-world data set and the experimental results demonstrate the effectiveness of our approach. A user study is conducted on a prototype system to show that our approach provides useful support for iterative entity navigation."
http://videolectures.net/eswc2016_zwicklbauer_semantic_embeddings/,"Entity disambiguation is the task of mapping ambiguous terms in natural-language text to its entities in a knowledge base. It finds its application in the extraction of structured data in RDF (Resource Description Framework) from textual documents, but equally so in facilitating artificial intelligence applications, such as Semantic Search, Reasoning and Question & Answering. In this work, we propose DoSeR (Disambiguation of Semantic Resources), a (named) entity disambiguation framework that is knowledge-base-agnostic in terms of RDF (e.g. DBpedia) and entity-annotated document knowledge bases (e.g. Wikipedia). Initially, our framework automatically generates semantic entity embeddings given one or multiple knowledge bases. In the following, DoSeR accepts documents with a given set of surface forms as input and collectively links them to an entity in a knowledge base with a graph-based approach. We evaluate DoSeR on seven different data sets against publicly available, state-of-the-art (named) entity disambiguation frameworks. Our approach outperforms the state-of-the-art approaches that make use of RDF knowledge bases and/or entity-annotated document knowledge bases by up to 10 % F1 measure."
http://videolectures.net/eswc2016_yang_graph_modelling/,"Latent embedding models are the basis of state-of-the art statistical solutions for modelling Knowledge Graphs and Recommender Systems. However, to be able to perform predictions for new entities and relation types, such models have to be retrained completely to derive the new latent embeddings. This could be a potential limitation when fast predictions for new entities and relation types are required. In this paper we propose approaches that can map new entities and new relation types into the existing latent embedding space without the need for retraining. Our proposed models are based on the observable - even incomplete - features of a new entity, e.g. a subset of observed links to other known entities. We show that these mapping approaches are efficient and are applicable to a wide variety of existing factorization models, including nonlinear models. We report performance results on multiple real-world datasets and evaluate the performances from different aspects."
http://videolectures.net/eswc2016_ristoski_enriching_product/,"Product ads are a popular form of search advertizing offered by major search engines, including Yahoo, Google and Bing. Unlike traditional search ads, product ads include structured product specifications, which allow search engine providers to perform better keyword-based ad retrieval. However, the level of completeness of the product specifications varies and strongly influences the performance of ad retrieval. On the other hand, online shops are increasing adopting semantic markup languages such as Microformats, RDFa and Microdata, to annotate their content, making large amounts of product description data publicly available. In this paper, we present an approach for enriching product ads with structured data extracted from thousands of online shops offering Microdata annotations. In our approach we use structured product ads as supervision for training feature extraction models able to extract attribute-value pairs from unstructured product descriptions. We use these features to identify matching products across different online shops and enrich product ads with the extracted data. Our evaluation on three product categories related to electronics show promising results in terms of enriching product ads with useful product data."
http://videolectures.net/eswc2016_schaible_user_study/,"When modeling Linked Open Data (LOD), reusing appropriate vocabulary terms to represent the data is difficult, because there are many vocabularies to choose from. Vocabulary term recommendations could alleviate this situation. We present a user study evaluating a vocabulary term recommendation service that is based on how other data providers have used RDF classes and properties in the LOD cloud. Our study compares the machine learning technique Learning to Rank (L2R), the classical data mining approach Association Rule mining (AR), and a baseline that does not provide any recommendations. Results show that utilizing AR, participants needed less time and less effort to model the data, which in the end resulted in models of better quality."
http://videolectures.net/eswc2016_paulheim_efficient_approximation/,"Ontology reasoning is typically a computationally intensive operation. While soundness and completeness of results is required in some use cases, for many others, a sensible trade-off between computation efforts and correctness of results makes more sense. In this paper, we show that it is possible to approximate a central task in reasoning, i.e., A-box consistency checking, by training a machine learning model which approximates the behavior of that reasoner for a specific ontology. On four different datasets, we show that such learned models constantly achieve an accuracy above 95% at less than 2% of the runtime of a reasoner, using a decision tree with no more than 20 inner nodes. For example, this allows for validating 293M Microdata documents against the schema.org ontology in less than 90 minutes, compared to 18 days required by a state of the art ontology reasoner."
http://videolectures.net/eswc2016_ferre_natural_languages/,"The Semantic Web is founded on a number of Formal Languages (FL) whose benefits are precision, lack of ambiguity, and ability to automate reasoning tasks such as inference or query answering. This however poses the challenge of mediation between machines and users because the latter generally prefer Natural Languages (NL) for accessing and authoring knowledge. In this paper, we introduce the N<A>F design pattern based on Abstract Syntax Trees (AST), Huet’s zippers and Montague grammars to zip together a natural language and a formal language. Unlike question answering, translation does not go from NL to FL, but as symbol N<A>F suggests, from ASTs (A) of an intermediate language to both NL (N<A) and FL (A>F). ASTs are built interactively and incrementally through a user-machine dialog where the user only sees NL, and the machine only sees FL."
http://videolectures.net/eswc2016_dubey_natural_language/,"Natural Language Query Formalization involves semantically parsing queries in natural language and translating them into their corresponding formal representations. It is a key component for developing question-answering (QA) systems on RDF data. The chosen formal representation language in this case is often SPARQL. In this paper, we propose a framework, called AskNow, where users can pose queries in English to a target RDF knowledge base (e.g. DBpedia), which are first normalized into an intermediary canonical syntactic form, called Normalized Query Structure (NQS), and then translated into SPARQL queries. NQS facilitates the identification of the desire (or expected output information) and the user-provided input information, and establishing their mutual semantic relationship. At the same time, it is sufficiently adaptive to query paraphrasing. We have empirically evaluated the framework with respect to the syntactic robustness of NQS and semantic accuracy of the SPARQL translator on standard benchmark datasets."
http://videolectures.net/eswc2016_saif_topic_compass/,"Characterising social media topics often requires new features to be continuously taken into account, and thus increasing the need for classifier retraining. One challenging aspect is the emergence of ambiguous features, which can affect classification performance. In this paper we investigate the impact of the use of ambiguous features in a topic classification task, and introduce the Semantic Topic Compass (STC) framework, which characterises ambiguity in a topics feature space. STC makes use of topic priors derived from structured knowledge sources to facilitate the semantic feature grading of a topic. Our findings demonstrate the proposed framework offers competitive boosts in performance across all datasets."
http://videolectures.net/eswc2016_farber_novel_statements/,"In media monitoring users have a clearly defined information need to find so far unknown statements regarding certain entities or relations mentioned in natural-language text. However, commonly used keyword-based search technologies are focused on finding relevant documents and cannot judge the novelty of statements contained in the text. In this work, we propose a new semantic novelty measure that allows to retrieve statements, which are both novel and relevant, from natural-language sentences in news articles. Relevance is defined by a semantic query of the user, while novelty is ensured by checking whether the extracted statements are related, but non-existing in a knowledge base containing the currently known facts. Our evaluation performed on English news texts and on CrunchBase as the knowledge base demonstrates the effectiveness, unique capabilities and future challenges of this novel approach to novelty."
http://videolectures.net/eswc2016_paul_document_similarity/,"Assessing the relatedness of documents is at the core of many applications such as document retrieval and recommendation. Most similarity approaches operate on word-distribution-based document representations - fast to compute, but problematic when documents differ in language, vocabulary or type, and neglecting the rich relational knowledge available in Knowledge Graphs. In contrast, graph-based document models can leverage valuable knowledge about relations between entities - however, due to expensive graph operations, similarity assessments tend to become infeasible in many applications. This paper presents an efficient semantic similarity approach exploiting explicit hierarchical and transversal relations. We show in our experiments that (i) our similarity measure provides a significantly higher correlation with human notions of document similarity than comparable measures, (ii) this also holds for short documents with few annotations, (iii) document similarity can be calculated efficiently compared to other graph-traversal based approaches."
http://videolectures.net/eswc2016_rospocher_information_retrieval/,"Document retrieval is the task of returning relevant textual resources for a given user query. In this paper, we investigate whether the semantic analysis of the query and the documents, obtained exploiting state-of-the-art Natural Language Processing techniques (e.g., Entity Linking, Frame Detection) and Semantic Web resources (e.g., YAGO, DBpedia), can improve the performances of the traditional term-based similarity approach. Our experiments, conducted on a recently released document collection, show that Mean Average Precision (MAP) increases of 3.5 % points when combining textual and semantic analysis, thus suggesting that semantic content can effectively improve the performances of Information Retrieval systems."
http://videolectures.net/eswc2016_lefrancois_custom_datatypes/,"In the Resource Description Framework, literals are composed of a UNICODE string (the lexical form), a datatype IRI, and optionally, when the datatype IRI is rdf:langString, a language tag. Any IRI can take the place of a datatype IRI, but the specification only defines the precise meaning of a literal when the datatype IRI is among a predefined subset. Custom datatypes have reported use on the Web of Data, and show some advantages in representing some classical structures. Yet, their support by RDF processors is rare and implementation specific. In this paper, we first present the minimal set of functions that should be defined in order to make a custom datatype usable in query answering and reasoning. Based on this, we discuss solutions that would enable: (i) data publishers to publish the definition of arbitrary custom datatypes on the Web, and (ii) generic RDF processor or SPARQL query engine to discover custom datatypes on-the-fly, and to perform operations on them accordingly. Finally, we detail a concrete solution that targets arbitrarily complex custom datatypes, we overview its implementation in Jena and ARQ, and we report the results of an experiment on a real world DBpedia use case."
http://videolectures.net/eswc2016_polleres_handling_inconsistencies/,"The problem of updating ontologies has received increased attention in recent years. In the approaches proposed so far, either the update language is restricted to sets of ground atoms or, where the full SPARQL update language is allowed, the TBox language is restricted so that no inconsistencies can arise. In this paper we discuss directions to overcome these limitations. Starting from a DL-Lite fragment covering RDFS and concept disjointness axioms, we define three semantics for SPARQL instance-level (ABox) update: under cautious semantics, inconsistencies are resolved by rejecting updates potentially introducing conflicts; under brave semantics, instead, conflicts are overridden in favor of new information where possible; finally, the fainthearted semantics is a compromise between the former two approaches, designed to accommodate as much of the new information as possible, as long as consistency with the prior knowledge is not violated. We show how these semantics can be implemented in SPARQL via rewritings of polynomial size and draw first conclusions from their practical evaluation."
