Video_Presentation,Abstracts
http://videolectures.net/eccv2014_gorelick_shape_prior/,"Convexity is known as an important cue in human vision. We propose shape convexity as a new high-order regularization constraint for binary image segmentation. In the context of discrete optimization, object convexity is represented as a sum of 3-clique potentials penalizing any 1-0-1 configuration on all straight lines. We show that these non-submodular interactions can be efficiently optimized using a trust region approach. While the quadratic number of all 3-cliques is prohibitively high, we designed a dynamic programming technique for evaluating and approximating these cliques in linear time. Our experiments demonstrate general usefulness of the proposed convexity constraint on synthetic and real image segmentation examples. Unlike standard second-order length regularization, our convexity prior is scale invariant, does not have shrinking bias, and is virtually parameter-free."
http://videolectures.net/eccv2014_tang_binary_energies/,"High-order and non-submodular pairwise energies are important for image segmentation, surface matching, deconvolution, tracking and other computer vision problems. Minimization of such energies is generally NP-hard. One standard approximation approach is to optimize an auxiliary function - an upper bound of the original energy across the entire solution space. This bound must be amenable to fast global solvers. Ideally, it should also closely approximate the original functional, but it is very difficult to find such upper bounds in practice. Our main idea is to relax the upper-bound condition for an auxiliary function and to replace it with a family of pseudo-bounds, which can better approximate the original energy. We use fast polynomial parametric maxflow approach to explore all global minima for our family of submodular pseudo-bounds. The best solution is guaranteed to decrease the original energy because the family includes at least one auxiliary function. Our Pseudo-Bound Cuts algorithm improves the state-of-the-art in many applications: appearance entropy minimization, target distribution matching, curvature regularization, image deconvolution and interactive segmentation."
http://videolectures.net/eccv2014_mairon_object_saliency/,"Visual context is used in different forms for saliency computation. While its use in saliency models for fixations prediction is often reasoned, this is less so the case for approaches that aim to compute saliency at the object level. We argue that the types of context employed by these methods lack clear justification and may in fact interfere with the purpose of capturing the saliency of whole visual objects. In this paper we discuss the constraints that different types of context impose and suggest a new interpretation of visual context that allows the emergence of saliency for more complex, abstract, or multiple visual objects. Despite shying away from an explicit attempt to capture “objectness” (e.g., via segmentation), our results are qualitatively superior and quantitatively better than the state-of-the-art."
http://videolectures.net/eccv2014_kraehenbuehl_object_proposals/,"We present an approach for identifying a set of candidate objects in a given image. This set of candidates can be used for object recognition, segmentation, and other object-based image parsing tasks. To generate the proposals, we identify critical level sets in geodesic distance transforms computed for seeds placed in the image. The seeds are placed by specially trained classifiers that are optimized to discover objects. Experiments demonstrate that the presented approach achieves significantly higher accuracy than alternative approaches, at a fraction of the computational cost."
http://videolectures.net/eccv2014_lin_common_objects/,"We present a new dataset with the goal of advancing the state-of-the-art in object recognition by placing the question of object recognition in the context of the broader question of scene understanding. This is achieved by gathering images of complex everyday scenes containing common objects in their natural context. Objects are labeled using per-instance segmentations to aid in precise object localization. Our dataset contains photos of 91 objects types that would be easily recognizable by a 4 year old. With a total of 2.5 million labeled instances in 328k images, the creation of our dataset drew upon extensive crowd worker involvement via novel user interfaces for category detection, instance spotting and instance segmentation. We present a detailed statistical analysis of the dataset in comparison to PASCAL, ImageNet, and SUN. Finally, we provide baseline performance analysis for bounding box and segmentation detection results using a Deformable Parts Model."
http://videolectures.net/eccv2014_song_depth_images/,"The depth information of RGB-D sensors has greatly simplified some common challenges in computer vision and enabled breakthroughs for several tasks. In this paper, we propose to use depth maps for object detection and design a 3D detector to overcome the major difficulties for recognition, namely the variations of texture, illumination, shape, viewpoint, clutter, occlusion, self-occlusion and sensor noises. We take a collection of 3D CAD models and render each CAD model from hundreds of viewpoints to obtain synthetic depth maps. For each depth rendering, we extract features from the 3D point cloud and train an Exemplar-SVM classifier. During testing and hard-negative mining, we slide a 3D detection window in 3D space. Experiment results show that our 3D detector significantly outperforms the state-of-the-art algorithms for both RGB and RGB-D images, and achieves about ×1.7 improvement on average precision compared to DPM and R-CNN. All source code and data are available online."
http://videolectures.net/eccv2014_li_car_detection/,"This paper presents a method of learning reconfigurable hierarchical And-Or models to integrate context and occlusion for car detection. The And-Or model represents the regularities of car-to-car context and occlusion patterns at three levels: (i) layouts of spatially-coupled N cars, (ii) single cars with different viewpoint-occlusion configurations, and (iii) a small number of parts. The learning process consists of two stages. We first learn the structure of the And-Or model with three components: (a) mining N-car contextual patterns based on layouts of annotated single car bounding boxes, (b) mining the occlusion configurations based on the overlapping statistics between single cars, and (c) learning visible parts based on car 3D CAD simulation or heuristically mining latent car parts. The And-Or model is organized into a directed and acyclic graph which leads to the Dynamic Programming algorithm in inference. In the second stage, we jointly train the model parameters (for appearance, deformation and bias) using Weak-Label Structural SVM. In experiments, we test our model on four car datasets: the KITTI dataset [11], the street parking dataset [19], the PASCAL VOC2007 car dataset [7], and a self-collected parking lot dataset. We compare with state-of-the-art variants of deformable part-based models and other methods. Our model obtains significant improvement consistently on the four datasets."
http://videolectures.net/eccv2014_zhang_panoramic_scene/,"The field-of-view of standard cameras is very small, which is one of the main reasons that contextual information is not as useful as it should be for object detection. To overcome this limitation, we advocate the use of 360° full-view panoramas in scene understanding, and propose a whole-room context model in 3D. For an input panorama, our method outputs 3D bounding boxes of the room and all major objects inside, together with their semantic categories. Our method generates 3D hypotheses based on contextual constraints and ranks the hypotheses holistically, combining both bottom-up and top-down context information. To train our model, we construct an annotated panorama dataset and reconstruct the 3D model from single-view using manual annotation. Experiments show that solely based on 3D context without any image region category classifier, we can achieve a comparable performance with the state-of-the-art object detector. This demonstrates that when the FOV is large, context is as powerful as object appearance. All data and source code are available online."
http://videolectures.net/eccv2014_ford_fouhey_origami_world/,"In this work, we present a method for single-view reasoning about 3D surfaces and their relationships. We propose the use of mid-level constraints for 3D scene understanding in the form of convex and concave edges and introduce a generic framework capable of incorporating these and other constraints. Our method takes a variety of cues and uses them to infer a consistent interpretation of the scene. We demonstrate improvements over the state-of-the art and produce interpretations of the scene that link large planar surfaces."
http://videolectures.net/eccv2014_quiroga_flow_estimation/,"Scene flow is defined as the motion field in 3D space, and can be computed from a single view when using an RGBD sensor. We propose a new scene flow approach that exploits the local and piecewise rigidity of real world scenes. By modeling the motion as a field of twists, our method encourages piecewise smooth solutions of rigid body motions. We give a general formulation to solve for local and global rigid motions by jointly using intensity and depth data. In order to deal efficiently with a moving camera, we model the motion as a rigid component plus a non-rigid residual and propose an alternating solver. The evaluation demonstrates that the proposed method achieves the best results in the most commonly used scene flow benchmark. Through additional experiments we indicate the general applicability of our approach in a variety of different scenarios."
http://videolectures.net/eccv2014_russell_dynamic_scenes/,"Consider a video sequence captured by a single camera observing a complex dynamic scene containing an unknown mixture of multiple moving and possibly deforming objects. In this paper we propose an unsupervised approach to the challenging problem of simultaneously segmenting the scene into its constituent objects and reconstructing a 3D model of the scene. The strength of our approach comes from the ability to deal with real-world dynamic scenes and to handle seamlessly different types of motion: rigid, articulated and non-rigid. We formulate the problem as hierarchical graph-cut based segmentation where we decompose the whole scene into background and foreground objects and model the complex motion of non-rigid or articulated objects as a set of overlapping rigid parts. We evaluate the motion segmentation functionality of our approach on the Berkeley Motion Segmentation Dataset. In addition, to validate the capability of our approach to deal with real-world scenes we provide 3D reconstructions of some challenging videos from the YouTube-Objects dataset."
http://videolectures.net/eccv2014_zheng_trajectory_triangulation/,"We introduce the problem of joint object class sequencing and trajectory triangulation (JOST), which is defined as the reconstruction of the motion path of a class of dynamic objects through a scene from an unordered set of images. We leverage standard object detection techinques to identify object instances within a set of registered images. Each of these object detections defines a single 2D point with a corresponding viewing ray. The set of viewing rays attained from the aggregation of all detections belonging to a common object class is then used to estimate a motion path denoted as the object class trajectory. Our method jointly determines the topology of the objects motion path and reconstructs the 3D object points corresponding to our object detections. We pose the problem as an optimization over both the unknown 3D points and the topology of the path, which is approximated by a Generalized Minimum Spanning Tree (GMST) on a multipartite graph and then refined through a continuous optimization over the 3D object points. Experiments on synthetic and real datasets demonstrate the effectiveness of our method and the feasibility to solve a previously intractable problem."
http://videolectures.net/eccv2014_matzen_scene_chronology/,"We present a new method for taking an urban scene reconstructed from a large Internet photo collection and reasoning about its change in appearance through time. Our method estimates when individual 3D points in the scene existed, then uses spatial and temporal affinity between points to segment the scene into spatio-temporally consistent clusters. The result of this segmentation is a set of spatio-temporal objects that often correspond to meaningful units, such as billboards, signs, street art, and other dynamic scene elements, along with estimates of when each existed. Our method is robust and scalable to scenes with hundreds of thousands of images and billions of noisy, individual point observations. We demonstrate our system on several large-scale scenes, and demonstrate an application to time stamping photos. Our work can serve to chronicle a scene over time, documenting its history and discovering dynamic elements in a way that can be easily explored and visualized."
