0,1
http://videolectures.net/eswc2018_mondal_similarity_computation/,"Most solutions providing hiring analytics involve mapping provided job descriptions to a standard job framework, thereby requiring computation of a document similarity score between two job descriptions. Finding semantic similarity between a pair of documents is a problem that is yet to be solved satisfactorily over all possible domains/contexts. Most document similarity calculation exercises require a large corpus of data for training the underlying models. In this paper we compare three methods of document similarity for job descriptions – topic modeling (LDA), doc2vec, and a novel part-of-speech tagging based document similarity (POSDC) calculation method. LDA and doc2vec require a large corpus of data to train, while POCDC exploits a domain specific property of descriptive documents (such as job descriptions) that enables us to compare two documents in isolation. POSDC method is based on an ”action-object-attribute” representation of documents, that allows meaningful comparisons. We use Standford Core NLP and NLTK Wordnet to do a multilevel semantic match between the actions and corresponding objects. We use sklearn for topic modeling and gensim for doc2vec. We compare the results from these three methods based on IBM Kenexa Talent frameworks job taxonomy"
http://videolectures.net/eswc2018_schouten_service_aspects/,"With so much opinionated, but unstructured, data available on the Web, sentiment analysis has become popular with both companies and researchers. Aspect-based sentiment analysis goes one step further by relating the expressed sentiment in a text to the topic, or aspect, the sentiment is expressed on. This enables a detailed analysis of the sentiment expressed in, for example, reviews of products or services. In this paper we propose a knowledge-driven approach to aspect sentiment analysis that complements traditional machine learning methods. By utilizing common domain knowledge, as encoded in an ontology, we improve the sentiment analysis of a given aspect. The domain knowledge is used to determine which words are expressing sentiment on the given aspect as well as to disambiguate sentiment carrying words or phrases. The proposed method has a highly competitive performance of over 80% accuracy on both SemEval-2015 and SemEval-2016 data, significantly outperforming the considered baselines."
http://videolectures.net/eswc2017_crosbie_financial_markets/,"The most successful hedge-funds in today’s financial markets are consuming large amounts of alternative data, including satellite imagery, point-of-sale data, news, social media and publications from the web. This new trend is driven by the fact that traditional factors have become less predictive in recent years, requiring sophisticated investors to explore new data sources. The majority of this new alternative content is unstructured and hence must first be converted into structured analytics data in order to be used systematically. Instead of building such capabilities themselves, financial firms are turning towards companies that specialize in this field. In this talk, Kevin will discuss some of the practical challenges of giving structure to unstructured content, how entities and ontologies may be used to link data and the ways in which semantic intelligence can be derived for use in financial trading algorithms."
http://videolectures.net/eswc2017_sheridan_digital_archives/,"What will people in the future know of today? As the homes for our collective memory archives have a special role to play. Semantic Web technologies address some important needs for digital archives and are being ever more embraced by the archival community. Archives face a big challenge. The use of digital technologies has profoundly shaped what types of record are created, captured, shared and made available. Digital records are not just documents or email but all sorts of content such as websites, threaded discussions, video, websites, structured datasets and even computer code. Yet, in the digital era, when so much is encoded as 0s and 1s there is no long term solution to the challenge of preservation. All archives can do is make the institutional commitment to continue to invest, through generations of technological change, in the engineering effort required for records to continue to be available. The National Archives is one of the world’s leading digital archives. Our Digital Records Infrastructure, which makes extensive use of RDF and SPARQL, is capable of safely, securely and actively preserving large quantities of data. Our Web Archive provides a comprehensive record of government on the web. We also lead the maintenance of a register of file format signatures that is used relied on by archives and other memory institutions around the world. As a digital archive we provide value by preserving digital records, keeping them safe for the future. We maintain the context for the records so their evidential value can be understood in the context of their creation and continuing use. We produce records so that they are available for others to access, and we also enable use. Semantic Web technologies play a key role in each of these areas and are integral to our approach for preserving, contextualising, presenting and enable use of digital records. This presentation will explain why and how we have used semantic web technologies for digital archiving and the benefits we have seen, for managing heterogeneous metadata and also in areas such a provenance and trust. It will explore new opportunities for archives from using Semantic Web technologies in particular around contextual description, with digital records increasingly contextualising each other. This is part of a shift to a more fluid approach where context grows with an archives collection and in relation to other collections. Finally it will also look at the challenges for archives with using Semantic Web technologies in particular around how best to manage uncertainty in our data as we increasingly use probabilistic approaches"
http://videolectures.net/eswc2017_aroyo_comfort_zone/,"Ambiguity in interpreting signs is not a new idea, yet the vast majority of research in machine interpretation of signals such as speech, language, images, video, audio, etc., tend to ignore ambiguity. This is evidenced by the fact that metrics for quality of machine understanding rely on a ground truth, in which each instance (a sentence, a photo, a sound clip, etc) is assigned a discrete label, or set of labels, and the machine’s prediction for that instance is compared to the label to determine if it is correct. This determination yields the familiar precision, recall, accuracy, and f-measure metrics, but clearly presupposes that this determination can be made. CrowdTruth is a form of collective intelligence based on a vector representation that accommodates diverse interpretation perspectives and encourages human annotators to disagree with each other, in order to expose latent elements such as ambiguity and worker quality. In other words, CrowdTruth assumes that when annotators disagree on how to label an example, it is because the example is ambiguous, the worker isn’t doing the right thing, or the task itself is not clear. In previous work on CrowdTruth, the focus was on how the disagreement signals from low quality workers and from unclear tasks can be isolated. Recently, we observed that disagreement can also signal ambiguity. The basic hypothesis is that, if workers disagree on the correct label for an example, then it will be more diﬃcult for a machine to classify that example. The elaborate data analysis to determine if the source of the disagreement is ambiguity supports our intuition that low clarity signals ambiguity, while high clarity sentences quite obviously express one or more of the target relations. In this talk I will share the experiences and lessons learned on the path to understanding diversity in human interpretation and the ways to capture it as ground truth to enable machines to deal with such diversity."
http://videolectures.net/eswc2017_roeder_entity_linking/,"The evaluation of Named Entity Recognition as well as Entity Linking systems is mostly based on manually created gold standards. However, the current gold standards have three main drawbacks. First, they do not share a common set of rules pertaining to what is to be marked and linked as an entity. Moreover, most of the gold standards have not been checked by other researchers after they were published. Hence, they commonly contain mistakes. Finally, many gold standards lack actuality as in most cases the reference knowledge bases used to link entities are refined over time while the gold standards are typically not updated to the newest version of the reference knowledge base. In this work, we analyze existing gold standards and derive a set of rules for annotating documents for named entity recognition and entity linking. We derive Eaglet, a tool that supports the semi-automatic checking of a gold standard based on these rules. A manual evaluation of Eaglet’s results shows that it achieves an accuracy of up to 88% when detecting errors. We apply Eaglet to 13 English gold standards and detect 38,453 errors. An evaluation of 10 tools on a subset of these datasets shows a performance difference of up to 10% micro F-measure on average."
http://videolectures.net/eswc2017_inel_harnessing_diversity/,"Over the last years, information extraction tools have gained a great popularity and brought significant performance improvement in extracting meaning from structured or unstructured data. For example, named entity recognition (NER) tools identify types such as people, organizations or places in text. However, despite their high F1 performance, NER tools are still prone to brittleness due to their highly specialized and constrained input and training data. Thus, each tool is able to extract only a subset of the named entities (NE) mentioned in a given text. In order to improve NE Coverage, we propose a hybrid approach, where we first aggregate the output of various NER tools and then validate and extend it through crowdsourcing. The results from our experiments show that this approach performs significantly better than the individual state-of-the-art tools (including existing tools that integrate individual outputs already). Furthermore, we show that the crowd is quite effective in (1) identifying mistakes, inconsistencies and ambiguities in currently used ground truth, as well as in (2) a promising approach to gather ground truth annotations for NER that capture a multitude of opinions."
http://videolectures.net/eswc2017_tran_entity_recommendation/,"Entities and their relatedness are useful information in various tasks such as entity disambiguation, entity recommendation or search. In many cases, entity relatedness is highly affected by dynamic contexts, which can be reflected in the outcome of different applications. However, the role of context is largely unexplored in existing entity relatedness measures. In this paper, we introduce the notion of contextual entity relatedness, and show its usefulness in the new yet important problem of context-aware entity recommendation. We propose a novel method of computing the contextual relatedness with integrated time and topic models. By exploiting an entity graph and enriching it with an entity embedding method, we show that our proposed relatedness can effectively recommend entities, taking contexts into account. We conduct large-scale experiments on a real-world data set, and the results show considerable improvements of our solution over the states of the art."
http://videolectures.net/eswc2017_zhang_entity_deduplication/,"ScholarlyData is the new and currently the largest reference linked dataset of the Semantic Web community about papers, people, organisations, and events related to its academic conferences. Originally started from the Semantic Web Dog Food (SWDF), it addressed multiple issues on data representation and maintenance by (i) adopting a novel data model and (ii) establishing an open source workflow to support the addition of new data from the community. Nevertheless, the major issue with the current dataset is the presence of multiple URIs for the same entities, typically in persons and organisations. In this work we: (i) perform entity deduplication on the whole dataset, using supervised classification methods; (ii) devise a protocol to choose the most representative URI for an entity and deprecate duplicated ones, while ensuring backward compatibilities for them; (iii) incorporate the automatic deduplication step in the general workflow to reduce the creation of duplicate URIs when adding new data. Our early experiment focused on the person and organisation URIs and results show significant improvement over state-of-the-art solutions. We managed to consolidate, on the entire dataset, over 100 and 800 pairs of duplicate person and organisation URIs and their associated triples (over 1,800 and 5,000) respectively, hence significantly improving the overall quality and connectivity of the data graph. Integrated into the ScholarlyData data publishing workflow, we believe that this serves a major step towards the creation of clean, high-quality scholarly linked data on the Semantic Web."
http://videolectures.net/eswc2017_sarasua_intrinsic_evaluation/,"The current Web of Data contains a large amount of interlinked data. However, there is still a limited understanding about the quality of the links connecting entities of different and distributed data sets. Our goal is to provide a collection of indicators that help assess existing interlinking. In this paper, we present a framework for the intrinsic evaluation of RDF links, based on core principles of Web data integration and foundations of Information Retrieval. We measure the extent to which links facilitate the discovery of an extended description of entities, and the discovery of other entities in other data sets. We also measure the use of different vocabularies. We analysed links extracted from a set of data sets from the Linked Data Crawl 2014 using these measures."
http://videolectures.net/eswc2017_sherif_link_discovery/,"A significant portion of the evolution of Linked Data datasets lies in updating the links to other datasets. An important challenge when aiming to update these links automatically under the open-world assumption is the fact that usually only positive examples for the links exist. We address this challenge by presenting and evaluating Wombat, a novel approach for the discovery of links between knowledge bases that relies exclusively on positive examples. Wombat is based on generalisation via an upward refinement operator to traverse the space of link specification. We study the theoretical characteristics of Wombat and evaluate it on 8 different benchmark datasets. Our evaluation suggests that Wombat outperforms state-of-the-art supervised approaches while relying on less information. Moreover, our evaluation suggests that Wombat’s pruning algorithm allows it to scale well even on large datasets."
http://videolectures.net/eswc2017_koutraki_linked_datasets/,"The large number of linked datasets in the Web, and their diversity in terms of schema representation has led to a fragmented dataset landscape. Querying and addressing information needs that span across disparate datasets requires the alignment of such schemas. Majority of schema and ontology alignment approaches focus exclusively on class alignment. Yet, relation alignment has not been fully addressed, and existing approaches fall short on addressing the dynamics of datasets and their size. In this work, we address the problem of relation alignment across disparate linked datasets. Our approach focuses on two main aspects. First, online relation alignment, where we do not require full access, and sample instead for a minimal subset of the data. Thus, we address the main limitation of existing work on dealing with the large scale of linked datasets, and in cases where the datasets provide only query access. Second, we learn supervised machine learning models for which we employ various features or matchers that account for the diversity of linked datasets at the instance level. We perform an experimental evaluation on real-world linked datasets, DBpedia, YAGO, and Freebase. The results show superior performance against state-of-the-art approaches in schema matching, with an average relation alignment accuracy of 84%. In addition, we show that relation alignment can be performed efficiently at scale."
http://videolectures.net/eswc2017_de_oliveira_melo_knowledge_graphs/,"Despite the growing amount of research in link and type prediction in knowledge graphs, systematic benchmark datasets are still scarce. In this paper, we propose a synthesis model for the generation of benchmark datasets for those tasks. Synthesizing data is a way of having control over important characteristics of the data, and allows the study of the impact of such characteristics on the performance of different methods. The proposed model uses existing knowledge graphs to create synthetic graphs with similar characteristics, such as distributions of classes, relations, and instances. As a first step, we replicate already existing knowledge graphs in order to validate the synthesis model. To do so, we perform extensive experiments with different link and type prediction methods. We show that we can systematically create knowledge graph benchmarks which allow for quantitative measurements of the result quality and scalability of link and type prediction methods."
http://videolectures.net/eswc2017_saif_social_media/,"From its start, the so-called Islamic State of Iraq and the Levant (ISIL/ISIS) has been successfully exploiting social media networks, most notoriously Twitter, to promote its propaganda and recruit new members, resulting in thousands of social media users adopting a pro-ISIS stance every year. Automatic identification of pro-ISIS users on social media has, thus, become the centre of interest for various governmental and research organisations. In this paper we propose a semantic graph-based approach for radicalisation detection on Twitter. Unlike previous works, which mainly rely on the lexical representation of the content published by Twitter users, our approach extracts and makes use of the underlying semantics of words exhibited by these users to identify their pro/anti-ISIS stances. Our results show that classifiers trained from semantic features outperform those trained from lexical, sentiment, topic and network features by 7.8% on average F1-measure."
http://videolectures.net/eswc2017_lu_crowdsourced_affinity/,"User-entity affinity is an essential component of many user-centric information systems such as online advertising, exploratory search, recommender system etc. The affinity is often assessed by analysing the interactions between users and entities within a data space. Among different affinity assessment techniques, content-based ones hypothesize that users have higher affinity with entities similar to the ones with which they had positive interactions in the past. Knowledge graph and folksonomy are respectively the milestones of Semantic Web and Social Web. Despite their shared crowdsourcing trait (not necessarily all knowledge graphs but some major large-scale ones), the encoded data are different in nature and structure. Knowledge graph encodes factual data with a formal ontology. Folksonomy encodes experience data with a loose structure. Many efforts have been made to make sense of folksonomy and to structure the community knowledge inside. Both data spaces allow to compute similarity between entities which can thereafter be used to calculate user-entity affinity. In this paper, we are interested in observing their comparative performance in the affinity assessment task. To this end, we carried out a first experiment within a travel destination recommendation scenario on a gold standard dataset. Our main findings are that knowledge graph helps to assess more accurately the affinity but folksonomy helps to increase the diversity and the novelty. This interesting complementarity motivated us to develop a semantic affinity framework to harvest the benefits of both data spaces. A second experiment with real users showed the utility of the proposed framework and confirmed our findings."
http://videolectures.net/eswc2017_capadisli_linked_data/,"In this article we describe the Linked Data Notifications (LDN) protocol, which is a W3C Candidate Recommendation. Notifications are sent over the Web for a variety of purposes, for example, by social applications. The information contained within a notification is structured arbitrarily, and typically only usable by the application which generated it in the first place. In the spirit of Linked Data, we propose that notifications should be reusable by multiple authorised applications. Through separating the concepts of senders, receivers and consumers of notifications, and leveraging Linked Data principles of shared vocabularies and URIs, LDN provides a building block for decentralised Web applications. This permits end users more freedom to switch between the online tools they use, as well as generating greater value when notifications from different sources can be used in combination. We situate LDN alongside related initiatives, and discuss additional considerations such as security and abuse prevention measures. We evaluate the protocol’s effectiveness by analysing multiple, independent implementations, which pass a suite of formal tests and can be demonstrated interoperating with each other. To experience the described features please open this document in your Web browser under its canonical URI: http://csarven.ca/linked-data-notifications."
http://videolectures.net/eswc2017_mora_rodriguez_semantic_technologies/,"A new transparency model with more and better corporate data is necessary to promote sustainable economic growth. In particular, there is a need to link factors regarding non-financial performance of corporations - such as social and environmental impacts, both positive and negative - into decision-making processes of investors and other stakeholders. To do this, we need to develop better ways to access and analyse corporate social, environmental and financial performance information, and to link together insights from these different sources. Such sources are already on the web in non-structured and structured data formats, a big part of them in XBRL (Extensible Business Reporting Language). This study is about promoting solutions to drive effective transparency for a sustainable economy, given the current adoption of XBRL, and the new opportunities that Linked Data can offer. We present (1) a methodology to formalise XBRL as RDF using Linked data principles and (2) demonstrate its usefulness through a use case connecting and making the data accessible."
http://videolectures.net/eswc2017_chalkidis_semantic_web/,"In this work, we study how legislation can be published as open data using semantic web technologies. We focus on Greek legislation and show how it can be modeled using ontologies expressed in OWL and RDF, and queried using SPARQL. To demonstrate the applicability and usefulness of our approach, we develop a web application, called Nomothesia, which makes Greek legislation easily accessible to the public. Nomothesia offers advanced services for retrieving and querying Greek legislation and is intended for citizens through intuitive presentational views and search interfaces, but also for application developers that would like to consume content through two web services: a SPARQL endpoint and a RESTful API. Opening up legislation in this way is a great leap towards making governments accountable to citizens and increasing transparency."
http://videolectures.net/eswc2017_futia_data_inconsistency/,"Public Procurement (PP) information, made available as Open Government Data (OGD), leads to tangible benefits to identify government spending for goods and services. Nevertheless, making data freely available is a necessary, but not sufficient condition for improving transparency. Fragmentation of OGD due to diverse processes adopted by different administrations and inconsistency within data affect opportunities to obtain valuable information. In this article, we propose a solution based on linked data to integrate existing datasets and to enhance information coherence. We present an application of such principles through a semantic layer built on Italian PP information available as OGD. As result, we overcame the fragmentation of datasources and increased the consistency of information, enabling new opportunities for analyzing data to fight corruption and for raising competition between companies in the market."
http://videolectures.net/eswc2017_moreno_entity_linking/,"The correct identification of the link between an entity mention in a text and a known entity in a large knowledge base is important in information retrieval or information extraction. The general approach for this task is to generate, for a given mention, a set of candidate entities from the base and, in a second step, determine which is the best one. This paper proposes a novel method for the second step which is based on the joint learning of embeddings for the words in the text and the entities in the knowledge base. By learning these embeddings in the same space we arrive at a more conceptually grounded model that can be used for candidate selection based on the surrounding context. The relative improvement of this approach is experimentally validated on a recent benchmark corpus from the TAC-EDL 2015 evaluation campaign."
