Video_Presentation,Abstracts
http://videolectures.net/iswc2018_oldman_tanase_reshaping_knowledge/,"ResearchSpace is an open source platform designed at the British Museum to help establish a community of researchers, where their underlying activities are framed by data sharing, active engagement in formal argumentations, and semantic publishing. Using Semantic Web languages and technologies, the innovations of the system are shaped by a social conceptualisation of the graph-based representation of information. This is employed through integrated semantic components aimed at subject experts. These offer mechanisms to add and create new data, annotate, assert, argue, search, cite, and justify a scholar's research through data enriched narratives. This paper showcases a new onto-epistemological approach that supports researchers to contribute to a growing and sustainable corpus of knowledge that has history, not just provenance, built-in. It describes our considerations in designing for interdisciplinary collaboration, usability and trust in the digital space, highlighted by use cases in archaeology, art history, and history of science."
http://videolectures.net/iswc2018_dubey_earl_joint_entity/,"Many question answering systems over knowledge graphs rely on entity and relation linking components in order to connect the natural language input to the underlying knowledge graph. Traditionally, entity linking and relation linking has been performed either as a dependent, sequential tasks or as independent, parallel tasks. In this paper, we propose a framework called EARL, which performs entity linking and relation linking as a joint task. EARL implements two different solution strategies for which we provide a comparative analysis in this paper: The first strategy is a formalization of the joint entity and relation linking tasks as an instance of the Generalised Travelling Salesman Problem (GTSP). In order to be computationally feasible, we employ approximate GTSP solvers. The second strategy uses machine learning in order to exploit the connection density between nodes in the knowledge graph. It relies on three base features and re-ranking steps in order to predict entities and relations. We compare the strategies and evaluate them on a dataset with 5000 questions. Both strategies significantly outperform the current state-of-the-art approaches for entity and relation linking."
http://videolectures.net/iswc2018_rospocher_ontology_driven_soft/,"Many approaches for Knowledge Extraction and Ontology Population rely on well-known Natural Language Processing (NLP) tasks, such as Named Entity Recognition and Classification (NERC) and Entity Linking (EL), to identify and semantically characterize the entities mentioned in natural language text. Despite being intrinsically related, the analyses performed by these tasks differ, and combining their output may result in NLP annotations that are implausible or even conflicting considering common world knowledge about entities. In this paper we present a Probabilistic Soft Logic (PSL) model that leverages ontological entity classes to relate NLP annotations from different tasks insisting on the same entity mentions. The intuition behind the model is that an annotation implies some ontological classes on the entity identified by the mention, and annotations from different tasks on the same mention have to share more or less the same implied entity classes. In a setting with various NLP tools returning multiple, confidence-weighted, candidate annotations on a single mention, the model can be operationally applied to compare the different annotation combinations, and to possibly revise the tools' best annotation choice. We experimented applying the model with the candidate annotations produced by two state-of-the-art tools for NERC and EL, on three different datasets. The results show that the joint annotation revision suggested by our PSL model consistently improves the original scores of the two tools."
http://videolectures.net/iswc2018_rosales_mendez_voxel_benchmark/,"The Entity Linking (EL) task identifies entity mentions in a text corpus and associates them with corresponding entities in a given knowledge base. While traditional EL approaches have largely focused on English texts, current trends are towards language-agnostic or otherwise multilingual approaches that can perform EL over texts in many languages. One of the obstacles to ongoing research on multilingual EL is a scarcity of annotated datasets with the same text in different languages. In this work we thus propose ds: a manually-annotated gold standard for multilingual EL featuring the same text expressed in five European languages. We first motivate and describe the ds dataset, using it to compare the behavior of state of the art EL (multilingual) systems for five different languages, contrasting these results with those obtained using machine translation to English. Overall, our results identify how five state-of-the-art multilingual EL systems compare for various languages, how the results of different languages compare, and further suggest that machine translation of input text to English is now a competitive alternative to dedicated multilingual EL configurations."
http://videolectures.net/iswc2018_van_erp_lessons_neel/,"The large number of tweets generated daily is providing decision makers with means to obtain insights into recent events around the globe in near real-time. The main barrier for extracting such insights is the impossibility of manual inspection of a diverse and dynamic amount of information. This problem has attracted the attention of industry and research communities,resulting in algorithms for the automatic extraction of semantics in tweets and linking them to machine readable resources. While a tweet is shallowly comparable to any other textual content, it hides a complex and challenging structure that requires domain-specific computational approaches for mining semantics from it. The NEEL challenge series, established in 2013, has contributed to the collection of emerging trends in the field and definition of standardised benchmark corpora for entity recognition and linking in tweets, ensuring high quality labelled data that facilitates comparisons between different approaches. This article reports the findings and lessons learnt through an analysis of specific characteristics of the created corpora, limitations, lessons learnt from the different participants and pointers for furthering the field of entity recognition and linking in tweets."
http://videolectures.net/iswc2018_vakulenko_measuring_coherence_conversatio/,"Conversational systems have become increasingly popular as a way for humans to interact with computers. To be able to provide intelligent responses, conversational systems must correctly model the structure and semantics of a conversation. In this paper, we introduce the task of measuring semantic (in)coherence in a conversation with respect to the background knowledge, which relies on identification of semantic relations between concepts introduced during a conversation. We propose and evaluate graph-based and machine learning approaches for measuring semantic coherence using knowledge graphs, their vector space embeddings and word embedding models, as sources of background knowledge. We demonstrate in our evaluation results how these approaches are able to uncover different coherence patterns in conversations on the Ubuntu Dialogue Corpus."
http://videolectures.net/iswc2018_beretta_combinin_truth_discovery/,"This study exploits knowledge expressed by RDF Knowledge Bases (KBs) to enhance Truth Discovery performance. Truth Discovery aims to identify facts (true claims) when conflicting claims are provided by several sources. Based on the assumption that true claims are provided by reliable sources and reliable sources provide true claims, Truth Discovery models iteratively compute value confidence and source trustworthiness in order to determine which claims are true. We propose a model that takes advantage of the knowledge extracted from an existing RDF KB in form of rules. These rules are used to quantify the evidence given by the RDF KB to support a claim. Then, this evidence is integrated in the computation of value confidence to improve its estimation. Enhancing truth discovery models allows to efficiently obtain a larger set of reliable facts that vice versa can be used to populate RDF KBs. Empirical experiments on real-world datasets show the potential of the proposed approach which lead to an improvement up to 18% w.r.t. the model we modified."
http://videolectures.net/iswc2018_khare_cross_lingua_classification/,"Many citizens nowadays flock to social media during crises to share or acquire the latest information about the event. Due to the sheer volume of data that is typically circulated during such events, it is necessary to have the ability to efficiently filter out irrelevant posts, and thus focus attention to the posts that are truly of relevance to the crisis. Recent research experimented with various statistical, and semantic, methods to automatically classify relevant and irrelevant posts to a given crisis or set of crises. However, it is unclear how such approaches perform when the posts about a crisis are generated in different languages. The typical approach is train the model for each language, but this is costly, time consuming, and not a viable option for rapidly evolving crisis situations. In this paper we test statistical and semantic classification approaches on cross-lingual datasets from 30 crisis events, consisting of posts written mainly in English, Spanish, and Italian. We experiment with scenarios where the model is trained on one language, and tested on another, and where the data is translated to a single language. We show that the addition of semantic features extracted from external knowledge bases show increases in accuracy over the statistical model."
http://videolectures.net/iswc2018_pan_content_fake_news/,"This paper addresses the problem of fake news detection. Although there are many works already in this space, most of them are not using the content itself for the decision making. In this paper, we propose some novel approaches to detecting fake news by making use of knowledge graphs. There are a few technical challenges. Firstly, state of the art triple extraction tools are still far from perfect. Secondly, it is challenging to validate the correctness of the extracted triples. Thirdly, open knowledge graphs, such as DBPedia, are not comprehensive enough to cover all the relations needed for fake news detection. To address these challenges, we propose three approaches, which are evaluated with Kaggle's ""Getting Real about Fake News"" dataset. Our studies indicate some insights, despite the above mentioned challenges, on using knowledge graph for fake news detection."
http://videolectures.net/iswc2018_kamdar_analyzing_interactions_biomedical/,"Biomedical ontologies are large: Several ontologies in the BioPortal repository contain thousands or even hundreds of thousands of entities. The development and maintenance of such large ontologies is difficult. To support ontology authors and repository developers in their work, it is crucial to improve our understanding of how these ontologies are explored, queried, reused, and used in downstream applications by biomedical researchers. We present an exploratory empirical analysis of user activities in the BioPortal ontology repository by analyzing BioPortal interaction logs across different access modes over several years. We investigate how users of BioPortal query and search for ontologies and their classes, how they explore the ontologies, and how they reuse classes from different ontologies. Additionally, through three real-world scenarios, we not only analyze the usage of ontologies for annotation tasks but also compare it to the browsing and querying behaviors of BioPortal users. For our investigation, we use several different visualization techniques. To inspect large amounts of interaction, reuse, and real-world usage data at a glance, we make use of and extend PolygOnto, a visualization method that has been successfully used to analyze reuse of ontologies in previous work. Our results show that exploration, query, reuse, and actual usage behaviors rarely align, suggesting that different users tend to explore, query and use different parts of an ontology. Finally, we highlight and discuss differences and commonalities among users of BioPortal."
http://videolectures.net/iswc2018_kamdar_systematic_analysis_term/,"Reusing ontologies and their terms is a principle and best practice that most ontology development methodologies strongly encourage. Reuse comes with the promise to support the semantic interoperability and to reduce engineering costs. In this paper, we present a descriptive study of the current extent of term reuse and overlap among biomedical ontologies. We use the corpus of biomedical ontologies stored in the BioPortal repository, and analyze different types of reuse and overlap constructs. While we find an approximate term overlap between 25–31%, the term reuse is only <9%, with most ontologies reusing fewer than 5% of their terms from a small set of popular ontologies. Clustering analysis shows that the terms reused by a common set of ontologies have >90% semantic similarity, hinting that ontology developers tend to reuse terms that are sibling or parent–child nodes. We validate this finding by analysing the logs generated from a Protégé plugin that enables developers to reuse terms from BioPortal. We find most reuse constructs were 2-level subtrees on the higher levels of the class hierarchy. We developed a Web application that visualizes reuse dependencies and overlap among ontologies, and that proposes similar terms from BioPortal for a term of interest. We also identified a set of error patterns that indicate that ontology developers did intend to reuse terms from other ontologies, but that they were using different and sometimes incorrect representations. Our results stipulate the need for semi-automated tools that augment term reuse in the ontology engineering process through personalized recommendations."
http://videolectures.net/iswc2018_dragoni_semantic_technologies/,"People are nowadays well aware that adopting healthy lifestyles, i.e., a combination of correct diet and adequate physical activity, may significantly contribute to the prevention of chronic diseases. We present the use of Semantic Web technologies to build a system for supporting and motivating people in following healthy lifestyles. Semantic technologies are used for modeling all relevant information, and for fostering reasoning activities by combining real-time user-generated data and domain expert knowledge. The proposed solution is validated in a realistic scenario and lessons learned from this experience are reported."
http://videolectures.net/iswc2018_hall_supporting_digital_technologies/,"We report on our efforts and faced challenges in using Semantic Web technologies for the purposes of supporting healthcare services provided by babylon health. First, we created a large medical Linked Data Graph (LDG) which integrates many publicly available (bio)medical data sources as well as several country specific ones for which we had to build custom RDF-converters. Even for data sources already distributed in RDF format a conversion process had to be applied in order to unify their schemata, simplify their structure and adapt them to the babylon data model. Simplification was in general quite important in babylon due to the high complexity of many OWL constructors. Another important issue in maintaining and managing the LDG was versioning and updating with new releases of data sources. After creating the LDG, various services were built on top of it in order to provide an abstraction layer for non-expert end-users like doctors and software engineers which need to interact with it. Finally, we report on one of the key use cases built in babylon, namely an AI-based chatbot which can be used by users to determine if they are in need of immediate medical treatment or the can follow a conservative treatment at home."
http://videolectures.net/iswc2018_atzori_what_is_27/,"We present an unsupervised approach to process natural language questions that cannot be answered by factual question answering nor advanced data querying, requiring ad-hoc code generation instead. To address this challenging task, our system, AskCO, performs language-to-code translation by interpreting the natural language question and generating a SPARQL query that is run against CodeOntology, a large RDF repository containing millions of triples representing Java code constructs. The SPARQL query will result in a number of candidate Java source code snippets and methods, ranked by AskCO on both syntactic and semantic features, to find the best candidate, that is then executed to get the correct answer. The evaluation of the system is based on a dataset extracted from StackOverflow and experimental results show that our approach is comparable with other state-of-the-art proprietary systems, such as the closed-source WolframAlpha computational knowledge engine."
http://videolectures.net/iswc2018_moreno_grafa_scalable_faceted/,"Faceted browsing has become a popular paradigm for user interfaces on the Web and has also been investigated in the context of RDF graphs. However, current faceted browsers for RDF graphs encounter performance issues when faced with two challenges: scale, where large datasets generate many results, and heterogeneity, where large numbers of properties and classes generate many facets. To address these challenges, we propose GraFa: a faceted browsing system for heterogeneous large-scale RDF graphs based on a materialisation strategy that performs an offline analysis of the input graph in order to identify a subset of the exponential number of possible facet combinations that are candidates for indexing. In experiments over Wikidata, we demonstrate that materialisation allows for displaying (exact) faceted views over millions of diverse results in under a second while keeping index sizes relatively small. We also present initial usability studies over GraFa."
http://videolectures.net/iswc2018_faralli_wiki_mid_interests/,"This paper presents Wiki-MID, a LOD compliant multi-domain interests dataset to train and test Recommender Systems, and the methodology to create the dataset from Twitter messages in English and Italian. Our English dataset includes an average of 90 multi-domain preferences per user on music, books, movies, celebrities, sport, politics and much more, for about half million users traced during six months in 2017. Preferences are either extracted from messages of users who use Spotify, Goodreads and other similar content sharing platforms, or induced from their ""topical"" friends, i.e., followees representing an interest rather than a social relation between peers. In addition, preferred items are matched with Wikipedia articles describing them. This unique feature of our dataset provides a mean to categorize preferred items, exploiting available semantic resources linked to Wikipedia such as the Wikipedia Category Graph, DBpedia, BabelNet and others."
http://videolectures.net/iswc2018_mirza_enriching_knowledge_bases/,"Information extraction traditionally focuses on extracting relations between identifiable entities, such as <Monterey, locatedIn, California>. Yet, texts often also contain Counting information, stating that a subject is in a specific relation with a number of objects, without mentioning the objects themselves, for example, ""California is divided into 58 counties"". Such counting quantifiers can help in a variety of tasks such as query answering or knowledge base curation, but are neglected by prior work. This paper develops the first full-fledged system for extracting counting information from text, called CINEX. We employ distant supervision using fact counts from a knowledge base as training seeds, and develop novel techniques for dealing with several challenges: (i) non-maximal training seeds due to the incompleteness of knowledge bases, (ii) sparse and skewed observations in text sources, and (iii) high diversity of linguistic patterns. Experiments with five human-evaluated relations show that CINEX can achieve 60% average precision for extracting counting information. In a large-scale experiment, we demonstrate the potential for knowledge base enrichment by applying CINEX to 2,474 frequent relations in Wikidata. CINEX can assert the existence of 2.5M facts for 110 distinct relations, which is 28% more than the existing Wikidata facts for these relations."
http://videolectures.net/iswc2018_qiu_qa4ie_question/,"Information Extraction (IE) refers to automatically extracting structured relation tuples from unstructured texts. Common IE solutions, including Relation Extraction (RE) and open IE systems, can hardly handle cross-sentence tuples, and are severely restricted by limited relation types as well as informal relation specifications (e.g., free-text based relation tuples). In order to overcome these weaknesses, we propose a novel IE framework named QA4IE, which leverages the flexible question answering (QA) approaches to produce high quality relation triples across sentences. Based on the framework, we develop a large IE benchmark with high quality human evaluation. This benchmark contains 293K documents, 2M golden relation triples, and 636 relation types. We compare our system with some IE baselines on our benchmark and the results show that our system achieves great improvements."
http://videolectures.net/iswc2018_van_erp_constructing_recipe/,"Historical newspapers provide a lens on customs and habits of the past. For example, recipes published in newspapers highlight what and how we ate and thought about food. The challenge here is that newspaper data is often unstructured and highly varied, digitised historical newspapers add an additional challenge, namely that of fluctuations in OCR quality. Therefore, it is difficult to locate and extract recipes from them. We present our approach based on distant supervision and automatically extracted lexicons to identify recipes in digitised historical newspapers, to generate recipe tags, and to extract ingredient information. We provide OCR quality indicators and their impact on the extraction process. We enrich the recipes with links to information on the ingredients. Our research shows how combining natural language processing, machine learning, and semantic web can be used to construct a rich dataset from heterogeneous newspapers for the historical analysis of food culture."
http://videolectures.net/iswc2018_kejriwal_structured_event/,"n domains such as humanitarian assistance and disaster relief (HADR), events, rather than named entities, are the primary focus of analysts and aid officials. An important problem that must be solved to provide situational awareness to aid providers is automatic clustering sub-events that refer to the same underlying event. An effective solution to the problem requires judicious use of both domain-specific and semantic information, as well as statistical methods like deep neural embeddings. In this paper, we present an approach, AugSEER (Augmented feature sets for Structured Event Entity Resolution), that combines advances in deep neural embeddings both on text and graph data with minimally supervised inputs from domain experts. AugSEER can operate in both online and batch scenarios. On five real-world HADR datasets, AugSEER is found, on average, to outperform the next best baseline result by almost 15% on the cluster purity metric and by 3% on the F1-Measure metric. In contrast, text-based approaches are found to perform poorly, demonstrating the importance of semantic information in devising a good solution. We also use sub-event clustering visualizations to illustrate the qualitative potential of AugSEER."
http://videolectures.net/iswc2018_bontcheva_framework_real_time/,"This paper presents a framework for collecting and analysing large volume social media content. The real-time analytics framework comprises semantic annotation, Linked Open Data, semantic search, and dynamic result aggregation components. In addition, exploratory search and sense-making are supported through information visualisation interfaces, such as co-occurrence matrices, term clouds, treemaps, and choropleths. There is also an interactive semantic search interface (Prospector), where users can save, refine, and analyse the results of semantic search queries over time. Practical use of the framework is exemplified through three case studies: a general scenario analysing tweets from UK politicians and the public's response to them in the run up to the 2015 UK general election, an investigation of attitudes towards climate change expressed by these politicians and the public, via their engagement with environmental topics, and an analysis of public tweets leading up to the UK's referendum on leaving the EU (Brexit) in 2016. The paper also presents a brief evaluation and discussion of some of the key text analysis components, which are specifically adapted to the domain and task, and demonstrate scalability and eciency of our toolkit in the case studies."
