Video_Presentation,Abstracts
http://videolectures.net/eccv2016_radenovic_cnn_image/,"Convolutional Neural Networks (CNNs) achieve state-of-the-art performance in many computer vision tasks. However, this achievement is preceded by extreme manual annotation in order to perform either training from scratch or fine-tuning for the target task. In this work, we propose to fine-tune CNN for image retrieval from a large collection of unordered images in a fully automated manner. We employ state-of-the-art retrieval and Structure-from-Motion (SfM) methods to obtain 3D models, which are used to guide the selection of the training data for CNN fine-tuning. We show that both hard positive and hard negative examples enhance the final performance in particular object retrieval with compact codes."
http://videolectures.net/eccv2016_anguelov_multibox_detector/,"We present a method for detecting objects in images using a single deep neural network. Our approach, named SSD, discretizes the output space of bounding boxes into a set of default boxes over different aspect ratios and scales per feature map location. At prediction time, the network generates scores for the presence of each object category in each default box and produces adjustments to the box to better match the object shape. Additionally, the network combines predictions from multiple feature maps with different resolutions to naturally handle objects of various sizes. Our SSD model is simple relative to methods that require object proposals because it completely eliminates proposal generation and subsequent pixel or feature resampling stage and encapsulates all computation in a single network. This makes SSD easy to train and straightforward to integrate into systems that require a detection component. Experimental results on the PASCAL VOC, MS COCO, and ILSVRC datasets confirm that SSD has comparable accuracy to methods that utilize an additional object proposal step and is much faster, while providing a unified framework for both training and inference. Compared to other single stage methods, SSD has much better accuracy, even with a smaller input image size. For 300×300 input, SSD achieves 72.1% mAP on VOC2007 test at 58 FPS on a Nvidia Titan X and for 500×500 input, SSD achieves 75.1% mAP, outperforming a comparable state of the art Faster R-CNN model. Code is available at https://github.com/weiliu89/caffe/tree/ssd."
http://videolectures.net/eccv2016_peng_face_alignment/,"We propose a novel recurrent encoder-decoder network model for real-time video-based face alignment. Our proposed model predicts 2D facial point maps regularized by a regression loss, while uniquely exploiting recurrent learning at both spatial and temporal dimensions. At the spatial level, we add a feedback loop connection between the combined output response map and the input, in order to enable iterative coarse-to-fine face alignment using a single network model. At the temporal level, we first decouple the features in the bottleneck of the network into temporal-variant factors, such as pose and expression, and temporal-invariant factors, such as identity information. Temporal recurrent learning is then applied to the decoupled temporal-variant features, yielding better generalization and significantly more accurate results at test time. We perform a comprehensive experimental analysis, showing the importance of each component of our proposed model, as well as superior results over the state-of-the-art in standard datasets."
http://videolectures.net/eccv2016_xing_landmark_detection/,"In this work, we introduce a novel Recurrent Attentive-Refinement (RAR) network for facial landmark detection under unconstrained conditions, suffering from challenges like facial occlusions and/or pose variations. RAR follows the pipeline of cascaded regressions that refines landmark locations progressively. However, instead of updating all the landmark locations together, RAR refines the landmark locations sequentially at each recurrent stage. In this way, more reliable landmark points are refined earlier and help to infer locations of other challenging landmarks that may stay with occlusions and/or extreme poses. RAR can thus effectively control detection errors from those challenging landmarks and improve overall performance even in presence of heavy occlusions and/or extreme conditions. To determine the sequence of landmarks, RAR employs an attentive-refinement mechanism. The attention LSTM (A-LSTM) and refinement LSTM (R-LSTM) models are introduced in RAR. At each recurrent stage, A-LSTM implicitly identifies a reliable landmark as the attention center. Following the sequence of attention centers, R-LSTM sequentially refines the landmarks near or correlated with the attention centers and provides ultimate detection results finally. To further enhance algorithmic robustness, instead of using mean shape for initialization, RAR adaptively determines the initialization by selecting from a pool of shape centers clustered from all training shapes. As an end-to-end trainable model, RAR demonstrates superior performance in detecting challenging landmarks in comprehensive experiments and it also establishes new state-of-the-arts on the 300-W, COFW and AFLW benchmark datasets."
http://videolectures.net/eccv2016_pinheiro_refine_object/,"Object segmentation requires both object-level information and low-level pixel data. This presents a challenge for feedforward networks: lower layers in convolutional nets capture rich spatial information, while upper layers encode object-level knowledge but are invariant to factors such as pose and appearance. In this work we propose to augment feedforward nets for object segmentation with a novel top-down refinement approach. The resulting bottom-up/top-down architecture is capable of efficiently generating high-fidelity object masks. Similarly to skip connections, our approach leverages features at all layers of the net. Unlike skip connections, our approach does not attempt to output independent predictions at each layer. Instead, we first output a coarse ‘mask encoding’ in a feedforward pass, then refine this mask encoding in a top-down pass utilizing features at successively lower layers. The approach is simple, fast, and effective. Building on the recent DeepMask network for generating object proposals, we show accuracy improvements of 10–20% in average recall for various setups. Additionally, by optimizing the overall network architecture, our approach, which we call SharpMask, is 50 % faster than the original DeepMask network (under .8 s per image)."
http://videolectures.net/eccv2016_shen_portrait_matting/,"We propose an automatic image matting method for portrait images. This method does not need user interaction, which was however essential in most previous approaches. In order to accomplish this goal, a new end-to-end convolutional neural network (CNN) based framework is proposed taking the input of a portrait image. It outputs the matte result. Our method considers not only image semantic prediction but also pixel-level image matte optimization. A new portrait image dataset is constructed with our labeled matting ground truth. Our automatic method achieves comparable results with state-of-the-art methods that require specified foreground and background regions or pixels. Many applications are enabled given the automatic nature of our system."
http://videolectures.net/eccv2016_hu_natural_language/,"In this paper we approach the novel problem of segmenting an image based on a natural language expression. This is different from traditional semantic segmentation over a predefined set of semantic classes, as e.g., the phrase “two men sitting on the right bench” requires segmenting only the two people on the right bench and no one standing or sitting on another bench. Previous approaches suitable for this task were limited to a fixed set of categories and/or rectangular regions. To produce pixelwise segmentation for the language expression, we propose an end-to-end trainable recurrent and convolutional network model that jointly learns to process visual and linguistic information. In our model, a recurrent neural network is used to encode the referential expression into a vector representation, and a fully convolutional network is used to a extract a spatial feature map from the image and output a spatial response map for the target object. We demonstrate on a benchmark dataset that our model can produce quality segmentation output from the natural language expression, and outperforms baseline methods by a large margin."
http://videolectures.net/eccv2016_shen_object_parsing/,"By taking the semantic object parsing task as an exemplar application scenario, we propose the Graph Long Short-Term Memory (Graph LSTM) network, which is the generalization of LSTM from sequential data or multi-dimensional data to general graph-structured data. Particularly, instead of evenly and fixedly dividing an image to pixels or patches in existing multi-dimensional LSTM structures (e.g., Row, Grid and Diagonal LSTMs), we take each arbitrary-shaped superpixel as a semantically consistent node, and adaptively construct an undirected graph for each image, where the spatial relations of the superpixels are naturally used as edges. Constructed on such an adaptive graph topology, the Graph LSTM is more naturally aligned with the visual patterns in the image (e.g., object boundaries or appearance similarities) and provides a more economical information propagation route. Furthermore, for each optimization step over Graph LSTM, we propose to use a confidence-driven scheme to update the hidden and memory states of nodes progressively till all nodes are updated. In addition, for each node, the forgets gates are adaptively learned to capture different degrees of semantic correlation with neighboring nodes. Comprehensive evaluations on four diverse semantic object parsing datasets well demonstrate the significant superiority of our Graph LSTM over other state-of-the-art solutions."
http://videolectures.net/eccv2016_liu_image_segmentation/,"Region-based methods have proven necessary for improving segmentation accuracy of neuronal structures in electron microscopy (EM) images. Most region-based segmentation methods use a scoring function to determine region merging. Such functions are usually learned with supervised algorithms that demand considerable ground truth data, which are costly to collect. We propose a semi-supervised approach that reduces this demand. Based on a merge tree structure, we develop a differentiable unsupervised loss term that enforces consistent predictions from the learned function. We then propose a Bayesian model that combines the supervised and the unsupervised information for probabilistic learning. The experimental results on three EM data sets demonstrate that by using a subset of only 3%3% to 7%7% of the entire ground truth data, our approach consistently performs close to the state-of-the-art supervised method with the full labeled data set, and significantly outperforms the supervised method with the same labeled subset."
http://videolectures.net/eccv2016_owens_ambient_sound/,"The sound of crashing waves, the roar of fast-moving cars -- sound conveys important information about the objects in our surroundings. In this work, we show that ambient sounds can be used as a supervisory signal for learning visual models. To demonstrate this, we train a convolutional neural network to predict a statistical summary of the sound associated with a video frame. We show that, through this process, the network learns a representation that conveys information about objects and scenes. We evaluate this representation on several recognition tasks, finding that its performance is comparable to that of other state-of-the-art unsupervised learning methods. Finally, we show through visualizations that the network learns units that are selective to objects that are often associated with characteristic sounds."
http://videolectures.net/eccv2016_rohrbach_textual_phrases/,"Grounding (i.e. localizing) arbitrary, free-form textual phrases in visual content is a challenging problem with many applications for human-computer interaction and image-text reference resolution. Few datasets provide the ground truth spatial localization of phrases, thus it is desirable to learn from data with no or little grounding supervision. We propose a novel approach which learns grounding by reconstructing a given phrase using an attention mechanism, which can be either latent or optimized directly. During training our model encodes the phrase using a recurrent network language model and then learns to attend to the relevant image region in order to reconstruct the input phrase. At test time, the correct attention, i.e., the grounding, is evaluated. If grounding supervision is available it can be directly applied via a loss over the attention mechanism. We demonstrate the effectiveness of our approach on the Flickr 30k Entities and ReferItGame datasets with different levels of supervision, ranging from no supervision over partial supervision to full supervision. Our supervised variant improves by a large margin over the state-of-the-art on both datasets."
http://videolectures.net/eccv2016_yang_semantic_correlations/,"Multi-label learning has attracted significant interests in computer vision recently, finding applications in many vision tasks such as multiple object recognition and automatic image annotation. Associating multiple labels to a complex image is very difficult, not only due to the intricacy of describing the image, but also because of the incompleteness nature of the observed labels. Existing works on the problem either ignore the label-label and instance-instance correlations or just assume these correlations are linear and unstructured. Considering that semantic correlations between images are actually structured, in this paper we propose to incorporate structured semantic correlations to solve the missing label problem of multi-label learning. Specifically, we project images to the semantic space with an effective semantic descriptor. A semantic graph is then constructed on these images to capture the structured correlations between them. We utilize the semantic graph Laplacian as a smooth term in the multi-label learning formulation to incorporate the structured semantic correlations. Experimental results demonstrate the effectiveness of the proposed semantic descriptor and the usefulness of incorporating the structured semantic correlations. We achieve better results than state-of-the-art multi-label learning methods on four benchmark datasets."
http://videolectures.net/eccv2016_krishna_relationship_detection/,"Visual relationships capture a wide variety of interactions between pairs of objects in images (e.g. ""man riding bicycle"" and ""man pushing bicycle""). Consequently, the set of possible relationships is extremely large and it is difficult to obtain sufficient training examples for all possible relationships. Because of this limitation, previous work on visual relationship detection has concentrated on predicting only a handful of relationships. Though most relationships are infrequent, their objects (e.g. ""man"" and ""bicycle"") and predicates (e.g. ""riding"" and ""pushing"") independently occur more frequently. We propose a model that uses this insight to train visual models for objects and predicates individually and later combines them together to predict multiple relationships per image. We improve on prior work by leveraging language priors from semantic word embeddings to finetune the likelihood of a predicted relationship. Our model can scale to predict thousands of types of relationships from a few examples. Additionally, we localize the objects in the predicted relationships as bounding boxes in the image. We further demonstrate that understanding relationships can improve content based image retrieval."
http://videolectures.net/eccv2016_pinto_curious_robot/,"What is the right supervisory signal to train visual representations? Current approaches in computer vision use category labels from datasets such as ImageNet to train ConvNets. However, in case of biological agents, visual representation learning does not require millions of semantic labels. We argue that biological agents use physical interactions with the world to learn visual representations unlike current vision systems which just use passive observations (images and videos downloaded from web). For example, babies push objects, poke them, put them in their mouth and throw them to learn representations. Towards this goal, we build one of the first systems on a Baxter platform that pushes, pokes, grasps and observes objects in a tabletop environment. It uses four different types of physical interactions to collect more than 130K datapoints, with each datapoint providing supervision to a shared ConvNet architecture allowing us to learn visual representations. We show the quality of learned representations by observing neuron activations and performing nearest neighbor retrieval on this learned representation. Quantitatively, we evaluate our learned ConvNet on image classification tasks and show improvements compared to learning without external data. Finally, on the task of instance retrieval, our network outperforms the ImageNet network on recall@1 by 3%."
http://videolectures.net/eccv2016_li_score_distribution/,"Given a set of images containing objects from the same category, the task of image co-localization is to identify and localize each instance. This paper shows that this problem can be solved by a simple but intriguing idea, that is, a common object detector can be learnt by making its detection confidence scores distributed like those of a strongly supervised detector. More specifically, we observe that given a set of object proposals extracted from an image that contains the object of interest, an accurate strongly supervised object detector should give high scores to only a small minority of proposals, and low scores to most of them. Thus, we devise an entropy-based objective function to enforce the above property when learning the common object detector. Once the detector is learnt, we resort to a segmentation approach to refine the localization. We show that despite its simplicity, our approach outperforms state-of-the-art methods."
http://videolectures.net/eccv2016_ahmad_scene_understanding/,"Indoor scenes tend to be abundant with planar homogeneous texture, manifesting as regularly repeating scene elements along a plane. In this work, we propose to exploit such structure to facilitate high-level scene understanding. By robustly fitting a texture projection model to optimal dominant frequency estimates in image patches, we arrive at a projective-invariant method to localize such semantically meaningful regions in multi-planar scenes. The recovered projective parameters also allow an affine-ambiguous rectification in real-world images marred with outliers, room clutter, and photometric severities. Qualitative and quantitative results show our method outperforms existing representative work for both rectification and detection. We then explore the potential of homogeneous texture for two indoor scene understanding tasks. In scenes where vanishing points cannot be reliably detected, or the Manhattan assumption is not satisfied, homogeneous texture detected by the proposed approach provides alternative cues to obtain an indoor scene geometric layout. Second, low-level feature descriptors extracted upon affine rectification of detected texture are found to be not only class-discriminative but also complementary to features without rectification, improving recognition performance on the MIT Indoor67 benchmark."
http://videolectures.net/eccv2016_chao_object_recognition/,"We investigate the problem of generalized zero-shot learning (GZSL). GZSL relaxes the unrealistic assumption in conventional ZSL that test data belong only to unseen novel classes. In GZSL, test data might also come from seen classes and the labeling space is the union of both types of classes. We show empirically that a straightforward application of the classifiers provided by existing ZSL approaches does not perform well in the setting of GZSL. Motivated by this, we propose a surprisingly simple but effective method to adapt ZSL approaches for GZSL. The main idea is to introduce a calibration factor to calibrate the classifiers for both seen and unseen classes so as to balance two conflicting forces: recognizing data from seen classes and those from unseen ones. We develop a new performance metric called the Area Under Seen-Unseen accuracy Curve to characterize this tradeoff. We demonstrate the utility of this metric by analyzing existing ZSL approaches applied to the generalized setting. Extensive empirical studies reveal strengths and weaknesses of those approaches on three well-studied benchmark datasets, including the large-scale ImageNet Full 2011 with 21,000 unseen categories. We complement our comparative studies in learning methods by further establishing an upper-bound on the performance limit of GZSL. There, our idea is to use class-representative visual features as the idealized semantic embeddings. We show that there is a large gap between the performance of existing approaches and the performance limit, suggesting that improving the quality of class semantic embeddings is vital to improving zero-shot learning."
http://videolectures.net/eccv2016_yu_modeling_context/,"Humans refer to objects in their environments all the time, especially in dialogue with other people. We explore generating and comprehending natural language referring expressions for objects in images. In particular, we focus on incorporating better measures of visual context into referring expression models and find that visual comparison to other objects within an image helps improve performance significantly. We also develop methods to tie the language generation process together, so that we generate expressions for all objects of a particular category jointly. Evaluation on three recent datasets - RefCOCO, RefCOCO+, and RefCOCOg, shows the advantages of our methods for both referring expression generation and comprehension."
http://videolectures.net/eccv2016_beier_efficient_fusion/,"Many computer vision problems can be cast as an optimization problem whose feasible solutions are decompositions of a graph. The minimum cost lifted multicut problem is such an optimization problem. Its objective function can penalize or reward all decompositions for which any given pair of nodes are in distinct components. While this property has many potential applications, such applications are hampered by the fact that the problem is NP-hard. We propose a fusion move algorithm for computing feasible solutions, better and more efficiently than existing algorithms. We demonstrate this and applications to image segmentation, obtaining a new state of the art for a problem in biological image analysis."
http://videolectures.net/eccv2016_yang_subspace_clustering/,"In many real-world problems, we are dealing with collections of high-dimensional data, such as images, videos, text and web documents, DNA microarray data, and more. Often, high-dimensional data lie close to low-dimensional structures corresponding to several classes or categories the data belongs to. In this paper, we propose and study an algorithm, called Sparse Subspace Clustering (SSC), to cluster data points that lie in a union of low-dimensional subspaces. The key idea is that, among infinitely many possible representations of a data point in terms of other points, a sparse representation corresponds to selecting a few points from the same subspace. This motivates solving a sparse optimization program whose solution is used in a spectral clustering framework to infer the clustering of data into subspaces. Since solving the sparse optimization program is in general NP-hard, we consider a convex relaxation and show that, under appropriate conditions on the arrangement of subspaces and the distribution of data, the proposed minimization program succeeds in recovering the desired sparse representations. The proposed algorithm can be solved efficiently and can handle data points near the intersections of subspaces. Another key advantage of the proposed algorithm with respect to the state of the art is that it can deal with data nuisances, such as noise, sparse outlying entries, and missing entries, directly by incorporating the model of the data into the sparse optimization program. We demonstrate the effectiveness of the proposed algorithm through experiments on synthetic data as well as the two real-world problems of motion segmentation and face clustering."
