Video_Presentation,Abstracts
http://videolectures.net/iswc2018_bhatia_interesting_tell_me_more/,"We address the problem of finding descriptive explanations of facts stored in a knowledge graph. This is important in high-risk domains such as healthcare, intelligence, etc. where users need additional information for decision making and is especially crucial for applications that rely on automatically constructed knowledge bases where machine learned systems extract facts from an input corpus and working of the extractors is opaque to the end-user. We follow an approach inspired from information retrieval and propose a simple and efficient, yet effective solution that takes into account passage level as well as document level properties to produce a ranked list of passages describing a given input relation. We test our approach using Wikidata as the knowledge base and Wikipedia as the source corpus and report results of user studies conducted to study the effectiveness of our proposed model."
http://videolectures.net/iswc2018_raad_detecting_erroneous/,"Although best practices for publishing Linked Data encourage the re-use of existing IRIs, multiple names are often used to denote the same thing. Whenever multiple names are used, owl:sameAs statements are needed in order to align them. Studies that date back as far as 2009, have observed multiple misuses of owl:sameAs links. As a result, alignment of Linked Data is currently broken, since many owl:sameAs links are erroneous, even introducing inconsistencies. In this paper, we show how network metrics such as the community structure of the owl:sameAs graph can be used to detect such (possibly) erroneous statements. We evaluate our method on a subset of the LOD Cloud that contains over 558M owl:sameAs statements."
http://videolectures.net/iswc2018_krotzsch_getting_most_wikidata/,"Wikidata is the collaboratively curated knowledge graph of the Wikimedia Foundation (WMF), and the core project of Wikimedia's data management strategy. A major challenge for bringing Wikidata to its full potential was to provide reliable and powerful services for data sharing and query, and the WMF has chosen to rely on semantic technologies for this purpose. A live SPARQL endpoint, regular RDF dumps, and linked data APIs are now forming the backbone of many uses of Wikidata. We describe this influential use case, explain technical details on the underlying infrastructure, analyse current usage, and share some of the lessons we learned and future plans."
http://videolectures.net/iswc2018_kaefer_specifying_monitoring/,"We present an ontology for representing workflows over components with Read-Write Linked Data interfaces and give an operational semantics to the ontology via a rule language. Workflow languages have been successfully applied for modelling behaviour in enterprise information systems, in which the data is often managed in a relational database. Linked Data interfaces have been widely deployed on the web to support data integration in very diverse domains, increasingly also in scenarios involving the Internet of Things, in which application behaviour is often specified using imperative programming languages. With our work we aim to combine workflow languages, which allow for the high-level specification of application behaviour by non-expert users, with Linked Data, which allows for decentralised data publication and integrated data access. We show that our ontology is expressive enough to cover the basic workflow patterns and demonstrate the applicability of our approach with a prototype system that observes pilots carrying out tasks in a mixed-reality aircraft cockpit. On a synthetic benchmark from the building automation domain, the runtime scales linearly with the size of the number of Internet of Things devices."
http://videolectures.net/iswc2018_celino_framework_build_games/,"With the rise of linked data and knowledge graphs, the need becomes compelling to find suitable solutions to increase the coverage and correctness of datasets, to add missing knowledge and to identify and remove errors. For this reason, several approaches – mostly relying on machine learning and NLP techniques – have been proposed to address this refinement goal; they usually need a partial gold standard, i.e. some ""ground truth"" to train automatic models. Gold standards are manually constructed, either by involving domain experts or by adopting crowdsourcing and human computation solutions. In this paper, we present an open source software framework to build Games with a Purpose for linked data refinement, i.e. web applications to crowdsource partial ground truth, by motivating user participation through fun incentive. We detail the impact of this new resource by explaining the specific data linking ""purposes"" supported by the framework (creation, ranking and validation of links) and by defining the respective crowdsourcing tasks to achieve those goals. To show this resource's versatility, we describe a set of diverse applications that we built on top of it; to demonstrate its reusability and extensibility potential, we provide references to detailed documentation, included an entire tutorial which in a few hours guides new adopters to customize and adapt the framework to a new use case."
http://videolectures.net/iswc2018_sejdiu_distlodstats_distributed/,"Over the last years, the Semantic Web has been growing steadily. Today, we count more than 10,000 datasets made available online following Semantic Web standards. Nevertheless, many applications, such as data integration, search, and interlinking, may not take the full advantage of the data without having a priori statistical information about its internal structure and coverage. In fact, there are already a number of tools, which offer such statistics, providing basic information about RDF datasets and vocabularies. However, those usually show severe deficiencies in terms of performance once the dataset size grows beyond the capabilities of a single machine. In this paper, we introduce a software library for statistical calculations of large RDF datasets, which scales out to clusters of machines. More specifically, we describe the first distributed in-memory approach for computing 32 different statistical criteria for RDF datasets using Apache Spark. The preliminary results show that our distributed approach improves upon a previous centralized approach we compare against and provides approximately linear horizontal scale-up. The criteria are extensible beyond the 32 default criteria, is integrated into the larger SANSA framework and employed in at least four major usage scenarios beyond the SANSA community."
http://videolectures.net/iswc2018_gozukan_browsing_linked/,"The Web of Data is growing fast, as exemplified by the evolution of the Linked Open Data (LOD) cloud over the last ten years. One of the consequences of this growth is that it is becoming increasingly difficult for application developers and end-users to find the datasets that would be relevant to them. Semantic Web search engines, open data catalogs, datasets and frameworks such as LODStats and LOD Laundromat, are all useful but only give partial, even if complementary, views on what datasets are available on the Web. We introduce LODAtlas, a portal that enables users to find datasets of interest. Users can make different types of queries about both the datasets' metadata and content, aggregated from multiple sources. They can then quickly evaluate the matching datasets' relevance, thanks to LODAtlas' summary visualizations of their general metadata, connections and contents."
http://videolectures.net/iswc2018_tommasini_vocals_vocabulary/,"The nature of Web data is changing. The popularity of News feeds, and Social Media, the rise of the web of things and the adoption of sensor technologies are examples of streaming data that reached the Web Scale. The different nature of streaming data calls for specific solutions to problems like data integration and analytics. We need streaming-specific web resources: new vocabularies to describe, find and select streaming data sources and; systems that can cooperate in real-time to solve streaming processing tasks. To foster interoperability between these streaming services on the web, we propose the Vocabulary & Catalog of Linked Streams (VoCaLS). VoCaLS is a three-module ontology to (i) publish streaming data following Linked Data principles, (ii) to describe streaming services and (iii) track the provenance of the stream processing."
http://videolectures.net/iswc2018_haase_use_cases_industrial/,"The Industrial Knowledge Graph has become an integral elements in Siemens' digitalization strategy towards integlligent engineering and manufacturing. In the presentation, we will share details on how semantic technologies are used in Industrial Knowledge Graph use cases and generate business value in real-world applications."
http://videolectures.net/iswc2018_soon_kim_knowledge_based/,"DIY (Do-It-Yourself) requires extensive knowledge such as the usage of tools, properties of materials, and the procedure of activities. Most DIYers use online search to find information but it is usually time-consuming and challenging for novice DIYers to understand the retrieved results and later apply them to their individual DIY tasks. In the work, we present a Question Answering (QA) system which can address the DIYers' specific needs. The core component is a knowledge base (KB) which contains a vast amount of domain knowledge encoded in a knowledge graph. The system is able to explain how the answers are derived with reasoning process. Our user study shows that the QA system addresses DIYers' needs more effectively than the web search."
http://videolectures.net/iswc2018_llaves_populating_fle/,"In Fujitsu Laboratories of Europe (FLE), we are developing a platform to get insights in the financial sector from the analysis of multiple heterogeneous data sources. At the core of the platform, there is a knowledge graph that is populated with new nodes and relationships as new data are ingested. The benefit of using a knowledge graph in our platform is threefold. First, it reduces the time spent on simple and repetitive data integration tasks. Second, the acquired knowledge is used by a virtual assistant to facilitate the data reconciliation process, thus users do not need to be experts to merge a new dataset. And third, it adds extra value to the customer information by linking knowledge to open and private data sources."
