Video_Presentation,Abstracts
http://videolectures.net/iswc2018_golbeck_personal_privacy_sematic/,"From social media to transaction records to surveillance, vast quantities of personal data can now be accessed, integrated, and analyzed. This has the promise to support transformationally helpful applications but it also poses a serious threat to user privacy. In this talk, I will discuss user preferences for data control, how a framework for making data aggregation and analysis better for humans, and the impacts this will have on the web and semantic web technologies."
http://videolectures.net/iswc2018_noy_not_linked_data/,"We like to say that a lot of applications today are “data-driven”. And it is probably true. The Semantic Web community has focused on making a lot of this data linked and annotated with ontologies and knowledge graphs, developing a host of novel and pragmatic applications. However, the majority of data today is somewhat structured, but it is not linked data. Yet, approaches rooted in lightweight semantics can help us make that data discoverable and useful. I will talk about our experiences trying to make all the data on the Web discoverable, challenges in trying to find some order in the Wild West that is the data on the Web today, and both technology and community-building challenges that we must address."
http://videolectures.net/iswc2018_savkovic_sematics_validation_shacl/,"With the popularity of RDF as an independent data model came the need for specifying constraints on RDF graphs, and for mechanisms to detect violations of such constraints. One of the most promising schema languages for RDF is SHACL, a recent W3C recommendation. Unfortunately, the specification of SHACL leaves open the problem of validation against recursive constraints. This omission is important because SHACL by design favors constraints that reference other ones, which in practice may easily yield reference cycles. In this paper, we propose a concise formal semantics for the so-called ""core constraint components"" of SHACL. This semantics handles arbitrary recursion, while being compliant with the current standard. Graph validation is based on the existence of an assignment of SHACL ""shapes"" to nodes in the graph under validation, stating which shapes are verified or violated, while verifying the targets of the validation process. We show in particular that the nature of SHACL forces us to consider cases in which these assignments are partial, or, in other words, where the truth value of a constraints at some nodes of a graph may be left unknown. Dealing with recursion comes at a price, as validating an RDF graph against SHACL constraints is NP-hard in the size of the graph, and this lower bound still holds for a fragment of SHACL using stratified negation. Therefore we also propose a tractable approximation to the validation problem."
http://videolectures.net/iswc2018_soulet_representativeness_knowledge/,"Knowledge bases (KBs) such as DBpedia, Wikidata, and YAGO contain a huge number of entities and facts. Several recent works induce rules or calculate statistics on these KBs. Most of these methods are based on the assumption that the data is a representative sample of the studied universe. Unfortunately, KBs are biased because they are built from crowdsourcing and opportunistic agglomeration of available databases. This paper aims at approximating the representativeness of a relation within a knowledge base. For this, we use the Generalized Benford's law, which indicates the distribution expected by the facts of a relation. We then compute the minimum number of facts that have to be added in order to make the KB representative of the real world. Experiments show that our unsupervised method applies to a large number of relations. For numerical relations where ground truths exist, the estimated representativeness proves to be a reliable indicator."
http://videolectures.net/iswc2018_hernandez_certain_sparql_nodes/,"Blank nodes in RDF graphs can be used to represent existential values known to exist but whose identity remains unknown. A prominent example of such usage can be found in the Wikidata dataset where, e.g., the author of Beowulf is given as a blank node. However, while SPARQL considers blank nodes in a query as existentials, it treats blank nodes in data more like constants. Running SPARQL queries over datasets with unknown values thus may lead to uncertain results, which may make the SPARQL semantics unsuitable for datasets with existential blank nodes. We thus explore the feasibility of an alternative SPARQL semantics based on certain answers. In order to estimate the performance costs that would be associated with such a change in semantics for current implementations, we adapt and evaluate approximation techniques proposed in a relational database setting for a core fragment of SPARQL. To further understand the impact that such a change in semantics may have on query solutions, we analyse how such a change would affect the results of user queries over Wikidata."
http://videolectures.net/iswc2018_cogrel_efficient_sparql_obda/,"OPTIONAL is a key feature in SPARQL for dealing with missing information. While this operator is being used extensively, it is also known for its complexity, which can make it challenge to evaluate queries with OPTIONAL efficiently. In this paper, we tackle this challenge in the standard Ontology-Based Data Access (OBDA) setting, where the data is stored in a SQL relational database and is exposed as a virtual RDF graph by the means of an R2RML mapping. We start with a succinct translation of a fragment of SPARQL into Relational Algebra (RA) that fully respects bag semantics and three-valued logic. This translation relies on extensive use of the LEFT JOIN operator and coalesce function. We then propose a number of optimisation techniques for reducing the size and improving the structure of generated SQL queries. Our optimisations capture interactions between JOIN, LEFT JOIN, coalesce and database integrity constraints such as attribute nullability and uniqueness, and foreign key constraints. Finally, we empirically verify effectiveness of our techniques over several OBDA benchmarks."
http://videolectures.net/iswc2018_collarana_synthesizing_minte_framework/,"Institutions from different domains require the integration of data coming from heterogeneous Web sources. Typical use cases include Knowledge Search, Knowledge Building, and Knowledge Completion. We report on the implementation of the RDF Molecule-Based Integration Framework MINTE+ in three domain-specific applications: Law Enforcement, Job Market Analysis, and Manufacturing. The use of RDF molecules as data representation and a core element in the framework gives MINTE+ enough flexibility to synthesize knowledge graphs in different domains. We first describe the challenges in each domain-specific application, then the implementation and configuration of the framework to solve the particular problems of each domain. We show how the parameters defined in the framework allow to tune the integration process with the best values according to each domain. Finally, we present the main results, and the lessons learned from each application."
http://videolectures.net/iswc2018_lecue_explaining_predicting_expenses/,"Global business travel spend topped record-breaking $1:2 Trillion USD in 2015, and will reach $1:6 Trillion by 2020 according to the Global Business Travel Association, the world's premier business travel and meetings trade organization. Existing expenses systems are designed for reporting expenses, their type and amount over pre-defined views such as time period, service or employee group. However such systems do not aim at systematically detecting abnormal expenses, and more importantly explaining their causes. Therefore deriving any actionable insight for optimising spending and saving from their analysis is time-consuming, cumbersome and often impossible. Towards this challenge we present AIFS, a system designed for expenses business owner and auditors. Our system is manipulating and combining semantic web and machine learning technologies for (i) identifying, (ii) explaining and (iii) predicting abnormal expenses claim by employees of large organisations. Our prototype of semantics-aware employee expenses analytics and reasoning, experimented with 191; 346 unique Accenture employees in 2015, has demonstrated scalability and accuracy for the tasks of explaining and predicting abnormal expenses."
http://videolectures.net/iswc2018_zhou_complex_alignment_geolink/,"Ontology alignment has been studied for over a decade, and over that time many alignment systems and methods have been developed by researchers in order to find simple 1-to-1 equivalence matches between two ontologies. However, very few alignment systems focus on finding complex correspondences. One reason for this limitation may be that there are no widely accepted alignment benchmarks that contain such complex relationships. In this paper, we propose a real-world dataset from the GeoLink project as a potential complex alignment benchmark. The dataset consists of two ontologies, the GeoLink Base Ontology (gbo) and the GeoLink Modular Ontology (gmo), as well as a manually created reference alignment, that were developed in consultation with domain experts from different institutions. The alignment includes 1:1, 1:n, and m:n equivalence and subsumption correspondences, and is available in both EDOAL and rules syntax."
http://videolectures.net/iswc2018_ceriani_commons_ontology_ecosystem/,"Multiple online services host repositories of audio clips of different kinds, ranging from music tracks, albums, playlists, to instrument samples and loops, to a variety of recorded or synthesized sounds. Programmatic access to these resources maybe used by client applications for tasks ranging from customized musical listening and exploration, to music/sounds creation from existing sounds and samples, to audio-based user interaction in apps and games. To facilitate interoperability among repositories and clients in this domain, we designed an ontology that covers it. There was no previous comprehensive data model for this domain, however the new ontology relates to existing ontologies such as the Functional Requirements for Bibliographic Records for the authoring and publication process of creative works, the Music Ontology for the authoring and publication of music, the EBU Core ontology to describe media files and formats, the Creative Commons Licensing ontology to describe licences. This paper documents the design of the ontology and its evaluation in respect to the requirements and scope."
http://videolectures.net/iswc2018_ferrara_sabine_multi_purpose/,"Social Business Intelligence (SBI) is the discipline that combines corporate data with social content to let decision makers analyze the trends perceived from the environment. SBI poses research challenges in several areas, such as IR, data mining, and NLP; unfortunately, SBI research is often restrained by the lack of publicly-available, real-world data for experimenting approaches, and by the difficulties in determining a ground truth. To fill this gap we present SABINE, a modular dataset in the domain of European politics. SABINE includes 6 millions bilingual clips crawled from 50 000 web sources, each associated with metadata and sentiment scores; an ontology with 400 topics, their occurrences in the clips, and their mapping to DBpedia; two multidimensional cubes for analyzing and aggregating sentiment and semantic occurrences. We also propose a set of research challenges that can be addressed using SABINE; remarkably, the presence of an expert-validated ground truth ensures the possibility of testing approaches to the whole SBI process as well as to each single task."
http://videolectures.net/iswc2018_saveta_spgen_benchmark_generator/,"A number of real and synthetic benchmarks have been proposed for evaluating the performance of link discovery systems. So far, only a limited number of link discovery benchmarks target the problem of linking geo-spatial entities. However, some of the largest knowledge bases of the Linked Open Data Web, such as LinkedGeoData contain vast amounts of spatial information. Several systems that manage spatial data and consider the topology of the spatial resources and the topological relations between them have been developed. In order to assess the ability of these systems to handle the vast amount of spatial data and perform the much needed data integration in the Linked Geo Data Cloud, it is imperative to develop benchmarks for geo-spatial link discovery. In this paper we propose the Spatial Benchmark Generator SPgen that can be used to test the performance of link discovery systems which deal with topological relations as proposed in the state of the art DE-9IM (Dimensionally Extended nine-Intersection Model). SPgen implements all topological relations of DE-9IM between LineStrings and Polygons in the two-dimensional space. A comparative analysis with benchmarks produced using the SPgen to assess and identify the capabilities of AML, OntoIdea, RADON and Silk spatial link discovery systems is provided"
http://videolectures.net/iswc2018_oltramari_privonto_semantic_framework/,"Privacy policies are intended to inform users about the collection and use of their data by websites, mobile apps and other services or appliances they interact with. This also includes informing users about any choices they might have regarding such data practices. However, few users read these often long privacy policies; and those who do have difficulty understanding them, because they are written in convoluted and ambiguous language. A promising approach to help overcome this situation revolves around semi-automatically annotating policies, using combinations of crowdsourcing, machine learning and natural language processing. In this article, we introduce PrivOnto, a semantic framework to represent annotated privacy policies. PrivOnto relies on an ontology developed to represent issues identified as critical to users and/or legal experts. PrivOnto has been used to analyze a corpus of over 23,000 annotated data practices, extracted from 115 privacy policies of US-based companies. We introduce a collection of 57 SPARQL queries to extract information from the PrivOnto knowledge base, with the dual objective of (1) answering privacy questions of interest to users and (2) supporting researchers and regulators in the analysis of privacy policies at scale. We present an interactive online tool using PrivOnto to help users explore our corpus of 23,000 annotated data practices. Finally, we outline future research and open challenges in using semantic technologies for privacy policy analysis."
http://videolectures.net/iswc2018_delanaux_query_based_anonymization/,We introduce and develop a declarative framework for privacy-preserving Linked Data publishing in which privacy and utility policies are specified as SPARQL queries. Our approach is data-independent and leads to inspect only the privacy and utility policies in order to determine the sequence of anonymization operations applicable to any graph instance for satisfying the policies. We prove the soundness of our algorithms and gauge their performance through experiments.
http://videolectures.net/iswc2018_lombardo_drammar_omprehensive_ontological/,"This paper reports about the release of a comprehensive ontological resource on drama, called Drammar. Drama is pervasive across cultures and is realized through disparate media items. Drammar has been realized by a collaboration of computer scientists and drama scholars, who have built the formal representation through a wiki platform, which has supported the exchanging of definitional assets and the encoding of axioms. Drammar has been designed with the goals to describe and encode the core dramatic qualities and to serve as a knowledge base underlying a number of applications. The impact of the resource is displayed through its direct application in a few tasks and its extension to serve in novel projects in the digital humanities."
http://videolectures.net/iswc2018_lisena_dormeus_graph_musical/,"Three major French cultural institutions—the French National Library (BnF), Radio France and the Philharmonie de Paris—have come together in order to develop shared methods to describe semantically their catalogs of music works and events. This process comprises the construction of knowledge graphs representing the data contained in these catalogs following a novel agreed upon ontology that extends CIDOC-CRM and FRBRoo, the linking of these graphs and their open publication on the web. A number of specialized tools that allow for the reproduction of this process are developed, as well as web applications for easy access and navigation through the data. The paper presents one of the main outcomes of this project—the DOREMUS knowledge graph, consisting of three linked datasets describing classical music works and their associated events (e.g. performances in concerts). This resource fills an important gap between library content description and music metadata. We present the DOREMUS pipeline for lifting and linking the data, the tools developed for these purposes, as well as a search application allowing to explore the data."
http://videolectures.net/iswc2018_dragoni_helis_ontology_lifestyles/,"The use of knowledge resources in the digital health domain is a trending activity significantly grown in the last decade. In this paper, we present HeLiS: an ontology aiming to provide in tandem a representation of both the food and physical activity domains and the definition of concepts enabling the monitoring of users' actions and of their unhealthy behaviors. We describe the construction process, the plan for its maintenance, and how this ontology has been used into a real-world system with a focus on ""Key to Health"": a project for promoting healthy lifestyles on workplaces. In turn, this project is part of the ""Trentino Salute 4.0"" framework: a long-term initiative promoted by the regional government that is responsible for the sustainability of the presented ontology and of the services connected with it."
http://videolectures.net/iswc2018_seneviratne_knowledge_disease/,"With the rapid advancements in cancer research, the information that is useful for characterizing disease, staging tumors, and creating treatment and survivorship plans has been changing at a pace that creates challenges when practicing oncologists and physicians try to remain current. One example of this involves increasing usage of biomarkers when characterizing the pathologic prognostic stage of a breast tumor. We present our semantic technology approach to support cancer characterization and demonstrate it in our end-to-end prototype system that collects the newest breast cancer staging criteria from authoritative oncology manuals to construct an ontology for breast cancer. Using a tool we developed that utilizes this ontology, physicians can quickly stage a new patient to support identifying risks, treatment options, and monitoring plans based on authoritative and best practice guidelines. Physicians can also re-stage an existing patient, allowing them to find patients whose stage has changed in a given patient cohort. As new guidelines emerge, using our proposed mechanism, which is grounded by semantic technologies for ingesting new data from staging manuals, we have created an enriched cancer staging ontology that integrates relevant data from several sources with very little human intervention."
http://videolectures.net/iswc2018_skjaveland_practical_instantiation_templa/,"Reasonable Ontology Templates (OTTR) is a language for representing ontology modelling patterns in the form of parameterised ontologies. Ontology templates are simple and powerful abstractions useful for constructing, interacting with and maintaining ontologies. With ontology templates modelling patterns can be uniquely identified and encapsulated, broken down into convenient and manageable pieces, instantiated and used as queries. Formal relations defined over templates supports sophisticated maintenance tasks for sets of templates, such as revealing redundancies and suggesting new templates for representing implicit patterns. Ontology templates are designed for practical use; an OWL vocabulary, convenient serialisation formats for the semantic web and for terse specification of template definitions and bulk instances are available, including an open source implementation for using templates. Our approach is successfully tested on a real-world large-scale ontology in the engineering domain."
http://videolectures.net/iswc2018_stoilos_novel_apporach_practical/,"Today a wealth of knowledge and data are distributed using Semantic Web standards. Especially in the (bio)medical several sources like SNOMED, NCI, FMA, and more are distributed in the form of OWL ontologies. These can be aligned and integrated in order to create one large medical Knowledge Base. However, an important issue is that the structure of these ontologies may be profoundly different hence naively integrating them can lead to incoherences or changes in their original structure which may affect applications. In this paper we present a framework and novel approach for integrating independently developed ontologies. Starting from an initial seed ontology which may already be in use by an application, new sources are used to iteratively enrich and extend the seed one. To deal with structural incompatibilities we present a novel fine-grained approach which is based on mapping repair and alignment conservativity, formalise it and provide an exact as well as approximate but practical algorithms. Our framework has already been used to integrate a number of medical ontologies and support real-world healthcare services provided by babylon health. Finally, we also perform an experimental evaluation and compare with state-of-the-art ontology integration systems that take into account the structure and coherency of the integrated ontologies obtaining encouraging results."
http://videolectures.net/iswc2018_osborne_pragmatic_ontology_evolution/,"Increasingly, organizations are adopting ontologies to describe their large catalogues of items. These ontologies need to evolve regularly in response to changes in the domain and the emergence of new requirements. An important step of this process is the selection of candidate concepts to include in the new version of the ontology. This operation needs to take into account a variety of factors and in particular reconcile user requirements and application performance. Current ontology evolution methods focus either on ranking concepts according to their relevance or on preserving compatibility with existing applications. However, they do not take in consideration the impact of the ontology evolution process on the performance of computational tasks – e.g., in this work we focus on instance tagging, similarity computation, generation of recommendations, and data clustering. In this paper, we propose the Pragmatic Ontology Evolution (POE) framework, a novel approach for selecting from a group of candidates a set of concepts able to produce a new version of a given ontology that i) is consistent with the a set of user requirements (e.g., max number of concepts in the ontology), ii) is parametrised with respect to a number of dimensions (e.g., topological considerations), and iii) effectively supports relevant computational tasks. Our approach also supports users in navigating the space of possible solutions by showing how certain choices, such as limiting the number of concepts or privileging trendy concepts rather than historical ones, would reflect on the application performance. An evaluation of POE on the real-world scenario of the evolving Springer Nature taxonomy for editorial classification yielded excellent results, demonstrating a significant improvement over alternative approaches."
http://videolectures.net/iswc2018_fink_fine_grained_completion/,"Over the recent years embeddings have attracted increasing research focus as a means for knowledge graph completion. Similarly, rule-based systems have been studied for this task in the past as well. What is missing from existing works so far, is a common evaluation that includes more than one type of method. We close this gap by comparing representatives of both types of systems in a frequently used evaluation format. Leveraging the explanatory qualities of rule-based systems, we present a fine-grained evaluation scenario that gives insight into characteristics of the most popular datasets and points out the different strengths and shortcomings of the examined approaches. Our results show that models such as TransE, RESCAL or HolE have problems in solving certain types of completion tasks that can be solved by a rule-based approach with high precision. At the same time there are other completion tasks that are difficult for rule-based systems. Motivated by these insights we combine both families of approaches via ensemble learning. The results support our assumption that the two methods can complement each other in a beneficial way."
