Video_Presentation,Abstracts
http://videolectures.net/eswc2016_schaible_user_study/,"When modeling Linked Open Data (LOD), reusing appropriate vocabulary terms to represent the data is difficult, because there are many vocabularies to choose from. Vocabulary term recommendations could alleviate this situation. We present a user study evaluating a vocabulary term recommendation service that is based on how other data providers have used RDF classes and properties in the LOD cloud. Our study compares the machine learning technique Learning to Rank (L2R), the classical data mining approach Association Rule mining (AR), and a baseline that does not provide any recommendations. Results show that utilizing AR, participants needed less time and less effort to model the data, which in the end resulted in models of better quality."
http://videolectures.net/eswc2016_paulheim_efficient_approximation/,"Ontology reasoning is typically a computationally intensive operation. While soundness and completeness of results is required in some use cases, for many others, a sensible trade-off between computation efforts and correctness of results makes more sense. In this paper, we show that it is possible to approximate a central task in reasoning, i.e., A-box consistency checking, by training a machine learning model which approximates the behavior of that reasoner for a specific ontology. On four different datasets, we show that such learned models constantly achieve an accuracy above 95% at less than 2% of the runtime of a reasoner, using a decision tree with no more than 20 inner nodes. For example, this allows for validating 293M Microdata documents against the schema.org ontology in less than 90 minutes, compared to 18 days required by a state of the art ontology reasoner."
http://videolectures.net/eswc2016_ferre_natural_languages/,"The Semantic Web is founded on a number of Formal Languages (FL) whose benefits are precision, lack of ambiguity, and ability to automate reasoning tasks such as inference or query answering. This however poses the challenge of mediation between machines and users because the latter generally prefer Natural Languages (NL) for accessing and authoring knowledge. In this paper, we introduce the N<A>F design pattern based on Abstract Syntax Trees (AST), Huet’s zippers and Montague grammars to zip together a natural language and a formal language. Unlike question answering, translation does not go from NL to FL, but as symbol N<A>F suggests, from ASTs (A) of an intermediate language to both NL (N<A) and FL (A>F). ASTs are built interactively and incrementally through a user-machine dialog where the user only sees NL, and the machine only sees FL."
http://videolectures.net/eswc2016_dubey_natural_language/,"Natural Language Query Formalization involves semantically parsing queries in natural language and translating them into their corresponding formal representations. It is a key component for developing question-answering (QA) systems on RDF data. The chosen formal representation language in this case is often SPARQL. In this paper, we propose a framework, called AskNow, where users can pose queries in English to a target RDF knowledge base (e.g. DBpedia), which are first normalized into an intermediary canonical syntactic form, called Normalized Query Structure (NQS), and then translated into SPARQL queries. NQS facilitates the identification of the desire (or expected output information) and the user-provided input information, and establishing their mutual semantic relationship. At the same time, it is sufficiently adaptive to query paraphrasing. We have empirically evaluated the framework with respect to the syntactic robustness of NQS and semantic accuracy of the SPARQL translator on standard benchmark datasets."
http://videolectures.net/eswc2016_saif_topic_compass/,"Characterising social media topics often requires new features to be continuously taken into account, and thus increasing the need for classifier retraining. One challenging aspect is the emergence of ambiguous features, which can affect classification performance. In this paper we investigate the impact of the use of ambiguous features in a topic classification task, and introduce the Semantic Topic Compass (STC) framework, which characterises ambiguity in a topics feature space. STC makes use of topic priors derived from structured knowledge sources to facilitate the semantic feature grading of a topic. Our findings demonstrate the proposed framework offers competitive boosts in performance across all datasets."
http://videolectures.net/eswc2016_farber_novel_statements/,"In media monitoring users have a clearly defined information need to find so far unknown statements regarding certain entities or relations mentioned in natural-language text. However, commonly used keyword-based search technologies are focused on finding relevant documents and cannot judge the novelty of statements contained in the text. In this work, we propose a new semantic novelty measure that allows to retrieve statements, which are both novel and relevant, from natural-language sentences in news articles. Relevance is defined by a semantic query of the user, while novelty is ensured by checking whether the extracted statements are related, but non-existing in a knowledge base containing the currently known facts. Our evaluation performed on English news texts and on CrunchBase as the knowledge base demonstrates the effectiveness, unique capabilities and future challenges of this novel approach to novelty."
http://videolectures.net/eswc2016_paul_document_similarity/,"Assessing the relatedness of documents is at the core of many applications such as document retrieval and recommendation. Most similarity approaches operate on word-distribution-based document representations - fast to compute, but problematic when documents differ in language, vocabulary or type, and neglecting the rich relational knowledge available in Knowledge Graphs. In contrast, graph-based document models can leverage valuable knowledge about relations between entities - however, due to expensive graph operations, similarity assessments tend to become infeasible in many applications. This paper presents an efficient semantic similarity approach exploiting explicit hierarchical and transversal relations. We show in our experiments that (i) our similarity measure provides a significantly higher correlation with human notions of document similarity than comparable measures, (ii) this also holds for short documents with few annotations, (iii) document similarity can be calculated efficiently compared to other graph-traversal based approaches."
http://videolectures.net/eswc2016_rospocher_information_retrieval/,"Document retrieval is the task of returning relevant textual resources for a given user query. In this paper, we investigate whether the semantic analysis of the query and the documents, obtained exploiting state-of-the-art Natural Language Processing techniques (e.g., Entity Linking, Frame Detection) and Semantic Web resources (e.g., YAGO, DBpedia), can improve the performances of the traditional term-based similarity approach. Our experiments, conducted on a recently released document collection, show that Mean Average Precision (MAP) increases of 3.5 % points when combining textual and semantic analysis, thus suggesting that semantic content can effectively improve the performances of Information Retrieval systems."
http://videolectures.net/eswc2016_lefrancois_custom_datatypes/,"In the Resource Description Framework, literals are composed of a UNICODE string (the lexical form), a datatype IRI, and optionally, when the datatype IRI is rdf:langString, a language tag. Any IRI can take the place of a datatype IRI, but the specification only defines the precise meaning of a literal when the datatype IRI is among a predefined subset. Custom datatypes have reported use on the Web of Data, and show some advantages in representing some classical structures. Yet, their support by RDF processors is rare and implementation specific. In this paper, we first present the minimal set of functions that should be defined in order to make a custom datatype usable in query answering and reasoning. Based on this, we discuss solutions that would enable: (i) data publishers to publish the definition of arbitrary custom datatypes on the Web, and (ii) generic RDF processor or SPARQL query engine to discover custom datatypes on-the-fly, and to perform operations on them accordingly. Finally, we detail a concrete solution that targets arbitrarily complex custom datatypes, we overview its implementation in Jena and ARQ, and we report the results of an experiment on a real world DBpedia use case."
http://videolectures.net/eswc2016_polleres_handling_inconsistencies/,"The problem of updating ontologies has received increased attention in recent years. In the approaches proposed so far, either the update language is restricted to sets of ground atoms or, where the full SPARQL update language is allowed, the TBox language is restricted so that no inconsistencies can arise. In this paper we discuss directions to overcome these limitations. Starting from a DL-Lite fragment covering RDFS and concept disjointness axioms, we define three semantics for SPARQL instance-level (ABox) update: under cautious semantics, inconsistencies are resolved by rejecting updates potentially introducing conflicts; under brave semantics, instead, conflicts are overridden in favor of new information where possible; finally, the fainthearted semantics is a compromise between the former two approaches, designed to accommodate as much of the new information as possible, as long as consistency with the prior knowledge is not violated. We show how these semantics can be implemented in SPARQL via rewritings of polynomial size and draw first conclusions from their practical evaluation."
http://videolectures.net/eswc2016_beek_contextualised_semantics/,"Identity relations are at the foundation of the Semantic Web and the Linked Data Cloud. In many instances the classical interpretation of identity is too strong for practical purposes. This is particularly the case when two entities are considered the same in some but not all contexts. Unfortunately, modeling the specific contexts in which an identity relation holds is cumbersome and, due to arbitrary reuse and the Open World Assumption, it is impossible to anticipate all contexts in which an entity will be used. We propose an alternative semantics for owl:sameAs that partitions the original relation into a hierarchy of subrelations. The subrelation to which an identity statement belongs depends on the dataset in which the statement occurs. Adding future assertions may change the subrelation to which an identity statement belongs, resulting in a contextdependent and non-monotonic semantics. We show that this more fine-grained semantics is better able to characterize the actual use of owl:sameAs as observed in Linked Open Datasets."
http://videolectures.net/eswc2016_alec_ontology_approach/,"This paper deals with an ontology-driven approach for semantic annotation of documents from a corpus where each document describes an entity of a same domain. The goal is to annotate each document with concepts being too specific to be explicitly mentioned in texts. The only thing we know about the concepts is their labels, i.e., we have no semantic information about these concepts. Moreover, their characteristics in the texts are incomplete. We propose an ontology-based approach, named Saupodoc, aiming to perform this particular annotation process by combining several approaches. Indeed, Saupodoc relies on a domain ontology relative to the field under study, which has a pivotal role, on its population with property assertions coming from documents and external resources, and its enrichment with formal specific concept definitions. Experiments have been carried out in two application domains, showing the benefit of the approach compared to well-known classifiers."
http://videolectures.net/eswc2016_both_qanary/,"It is very challenging to access the knowledge expressed within (big) data sets. Question answering (QA) aims at making sense out of data via a simpleto-use interface. However, QA systems are very complex and earlier approaches are mostly singular and monolithic implementations for QA in specific domains. Therefore, it is cumbersome and inefficient to design and implement new or improved approaches, in particular as many components are not reusable. Hence, there is a strong need for enabling best-of-breed QA systems, where the best performing components are combined, aiming at the best quality achievable in the given domain. Taking into account the high variety of functionality that might be of use within a QA system and therefore reused in new QA systems, we provide an approach driven by a core QA vocabulary that is aligned to existing, powerful ontologies provided by domain-specific communities. We achieve this by a methodology for binding existing vocabularies to our core QA vocabulary without re-creating the information provided by external components. We thus provide a practical approach for rapidly establishing new (domain-specific) QA systems, while the core QA vocabulary is re-usable across multiple domains. To the best of our knowledge, this is the first approach to open QA systems that is agnostic to implementation details and that inherently follows the linked data principles."
http://videolectures.net/eswc2016_keet_driven_development/,"Emerging ontology authoring methods to add knowledge to an ontology focus on ameliorating the validation bottleneck. The verification of the newly added axiom is still one of trying and seeing what the reasoner says, because a systematic testbed for ontology authoring is missing. We sought to address this by introducing the approach of test-driven development for ontology authoring. We specify 36 generic tests, as TBox queries and TBox axioms tested through individuals, and structure their inner workings in an ‘open box’-way, which cover the OWL 2 DL language features. This is implemented as a Protégé plugin so that one can perform a TDD test as a black box test. We evaluated the two test approaches on their performance. The TBox queries were faster, and that effect is more pronounced the larger the ontology is."
http://videolectures.net/eswc2016_fokoue_link_prediction/,"Drug-Drug Interactions (DDIs) are a major cause of preventable adverse drug reactions and a huge burden on public health and the healthcare system. On the other hand, there is a large amount of drug-related (open) data published on the Web, describing various properties of drugs and their relationships to other drugs, genes, diseases, and related concepts and entities. In this demonstration, we describe an end-to-end system we have designed to take in various Web data sources as input and provide as output a prediction of DDIs along with an explanation of why two drugs may interact. The system first creates a knowledge graph out of input data sources through large-scale semantic integration, and then performs link prediction among drug entities in the graph through large-scale similarity analysis and machine learning. The link prediction is performed using a logistic regression model over several similarity matrices built using different drug similarity measures. We present both the efficient link prediction framework implemented in Apache Spark, and our APIs and Web interface for predicting DDIs and exploring their potential causes and nature."
http://videolectures.net/eswc2016_dragoni_semantic_linking/,"Cultural heritage institutions have recently started to explore the added value of sharing their data, opening to initiatives that are using the Linked Open Data cloud to integrate and enrich metadata of their cultural heritage collections. However, each museum and each collection shows peculiarities, which make it difficult to generalize this process and offer one-size-fits-all solutions. In this paper, we report on the integration, enrichment and interlinking activities of metadata from a small collection of verbo-visual artworks in the context of the Verbo-Visual-Virtual project. We investigate how to exploit Semantic Web technologies and languages combined with natural language processing methods to transform and boost the access to documents providing cultural information, i.e., artist descriptions, collection notices, information about technique. We also discuss the open challenges raised by working with a small collection including little-known artists and information gaps, for which additional data can be hardly retrieved from the Web."
http://videolectures.net/eswc2016_heyvaert_data_mappings/,"Although several tools have been implemented to generate Linked Data from raw data, users still need to be aware of the underlying technologies and Linked Data principles to use them. Mapping languages enable to detach the mapping definitions from the implementation that executes them. However, no thorough research has been conducted on how to facilitate the editing of mappings. We propose the rmleditor, a visual graph-based user interface, which allows users to easily define the mappings that deliver the rdf representation of the corresponding raw data. Neither knowledge of the underlying mapping language nor the used technologies is required. The rmleditor aims to facilitate the editing of mappings, and thereby lowers the barriers to create Linked Data. The rmleditor is developed for use by data specialists who are partners of (i) a companies-driven pilot and (ii) a community group. The current version of the rmleditor was validated: participants indicate that it is adequate for its purpose and the graph-based approach enables users to conceive the linked nature of the data."
http://videolectures.net/eswc2016_bereta_maritime_security/,"The maritime security domain is challenged by a number of data analysis needs focusing on increasing the maritime situation awareness, i.e., detection and analysis of abnormal vessel behaviors and suspicious vessel movements. The need for efficient processing of dynamic and/or static vessel data that come from different heterogeneous sources is emerged. In this paper we describe how we address the challenge of combining and processing real-time and static data from different sources using ontology-based data access techniques, and we explain how the application of semantic web technologies increases the value of data and improves the processing workflow in the maritime domain."
http://videolectures.net/eswc2016_hyvonen_data_service/,"This paper presents the WarSampo system for publishing collections of heterogeneous, distributed data about the Second World War on the Semantic Web. WarSampo is based on harmonizing massive datasets using event-based modeling, which makes it possible to enrich datasets semantically with each others’ contents. WarSampo has two components: First, a Linked Open Data (LOD) service WarSampo Data for Digital Humanities (DH) research and for creating applications related to war history. Second, a semantic WarSampo Portal has been created to test and demonstrate the usability of the data service. The WarSampo Portal allows both historians and laymen to study war history and destinies of their family members in the war from different interlinked perspectives. Published in November 2015, the WarSampo Portal had some 20,000 distinct visitors during the first three days, showing that the public has a great interest in this kind of applications."
http://videolectures.net/eswc2016_kontokostas_use_case/,"The publishing industry is undergoing major changes. These changes are mainly based on technical developments and related habits of information consumption. Wolters Kluwer already engaged in new solutions to meet these challenges and to improve all processes of generating good quality content in the backend on the one hand and to deliver information and software in the frontend that facilitates the customer’s life on the other hand. JURION is an innovative legal information platform developed by Wolters Kluwer Germany (WKD) that merges and interlinks over one million documents of content and data from diverse sources such as national and European legislation and court judgments, extensive internally authored content and local customer data, as well as social media and web data (e.g. DBpedia). In collecting and managing this data, all stages of the Data Lifecycle are present – extraction, storage, authoring, interlinking, enrichment, quality analysis, repair and publication. Ensuring data quality is a key step in the JURION data lifecycle. In this industry paper we present two use cases for verifying quality: (1) integrating quality tools in the existing software infrastructure and (2) improving the data enrichment step by checking the external sources before importing them in JURION. We open-source part of our extensions and provide a screencast with our prototype in action."
http://videolectures.net/eswc2016_khalili_linked_data/,"Due to the increasing amount of Linked Data openly published on the Web, user-facing Linked Data Applications (LDAs) are gaining momentum. One of the major entrance barriers for Web developers to contribute to this wave of LDAs is the required knowledge of Semantic Web (SW) technologies such as the RDF data model and SPARQL query language. This paper presents an adaptive component-based approach together with its open source implementation for creating flexible and reusable SW interfaces driven by Linked Data. Linked Data-driven (LD-R) Web components abstract the complexity of the underlying SW technologies in order to allow reuse of existing Web components in LDAs, enabling Web developers who are not experts in SW to develop interfaces that view, edit and browse Linked Data. In addition to the modularity provided by the LD-R components, the proposed RDF-based configuration method allows application assemblers to reshape their user interface for different use cases, by either reusing existing shared configurations or by creating their proprietary configurations."
http://videolectures.net/eswc2016_zervakis_ontology_systems/,"We envision a publish/subscribe ontology system that is able to index millions of user subscriptions and filter them against ontology data that arrive in a streaming fashion. In this work, we propose a SPARQL extension appropriate for a publish/subscribe setting; our extension builds on the natural semantic graph matching of the language and supports the creation of full-text subscriptions. Subsequently, we propose a main-memory subscription indexing algorithm which performs both semantic and full-text matching at low complexity and minimal filtering time. Thus, when ontology data are published matching subscriptions are identified and notifications are forwarded to users."
http://videolectures.net/eswc2016_tommasini_stream_processing/,"Benchmarks like LSBench, SRBench, CSRBench and, more recently, CityBench satisfy the growing need of shared datasets, ontologies and queries to evaluate window-based RDF Stream Processing (RSP) engines. However, no clear winner emerges out of the evaluation. In this paper, we claim that the RSP community needs to adopt a Systematic Comparative Research Approach (SCRA) if it wants to move a step forward. To this end, we propose a framework that enables SCRA for window based RSP engines. The contributions of this paper are: (i) the requirements to satisfy for tools that aim at enabling SCRA; (ii) the architecture of a facility to design and execute experiment guaranteeing repeatability, reproducibility and comparability; (iii) HHeaven – a proof of concept implementation of such architecture that we released as open source –; (iv) two RSP engine implementations, also open source, that we propose as baselines for the comparative research (i.e., they can serve as terms of comparison in future works). We prove HHeaven effectiveness using the baselines by: (i) showing that top-down hypothesis verification is not straight forward even in controlled conditions and (ii) providing examples of bottom-up comparative analysis."
http://videolectures.net/eswc2016_calbimonte_stream_processing/,"Querying and reasoning over RDF streams are two increasingly relevant areas in the broader scope of processing structured data on the Web. While RDF Stream Processing (RSP) has focused so far on extending SPARQL for continuous query and event processing, stream reasoning has concentrated on ontology evolution and incremental materialization. In this paper we propose a different approach for querying RDF streams over ontologies, based on the combination of query rewriting and stream processing. We show that it is possible to rewrite continuous queries over streams of RDF data, while maintaining efficiency for a wide range of scenarios. We provide a detailed description of our approach, as well as an implementation, StreamQR, which is based on the kyrie rewriter, and can be coupled with a native RSP engine, namely CQELS. Finally, we show empirical evidence of the performance of StreamQR in a series of experiments based on the SRBench query set."
