Video_Presentation,Abstracts
https://www.youtube.com/watch?v=w6-yib0JUOk,"We consider the problem of non-parametric Conditional Independence testing (CI testing) for continuous random variables. Given i.i.d samples from the joint distribution $f(x,y,z)$ of continuous random vectors $X,Y$ and $Z,$ we determine whether $X \independent Y \vert Z$. We approach this by converting the conditional independence test into a classification problem.  This allows us to harness very powerful classifiers like gradient-boosted trees and deep neural networks.  These models can handle complex probability distributions and allow us to perform significantly better compared to the prior state of the art, for high-dimensional CI testing. The main technical challenge in the classification problem is the need for samples from the conditional product distribution $f^{CI}(x,y,z) = f(x|z)f(y|z)f(z)$ -- the joint distribution if and only if $X \independent Y \vert Z.$ -- when given access only to i.i.d.  samples from the true joint distribution $f(x,y,z)$.  To tackle this problem we propose a novel nearest neighbor bootstrap procedure and theoretically show that our generated samples are indeed close to $f^{CI}$ in terms of total variational distance. We then develop theoretical results regarding the generalization bounds for classification for our problem, which translate into error bounds for CI testing. We provide a novel analysis of Rademacher type classification bounds in the presence of non-i.i.d \textit{near-independent} samples. We empirically validate the performance of our algorithm on simulated and real datasets and show performance gains over previous methods."
https://youtu.be/SrrO4OxydO0,"This paper studies the numerical computation of integrals, representing estimates or predictions, over the output $f(x)$ of a computational model with respect to a distribution $p(\mathrm{d}x)$ over uncertain inputs $x$ to the model. For the functional cardiac models that motivate this work, neither $f$ nor $p$ possess a closed-form expression and evaluation of either requires $\approx$ 100 CPU hours, precluding standard numerical integration methods. Our proposal is to treat integration as an estimation problem, with a joint model for both the a priori unknown function $f$ and the a priori unknown distribution $p$. The result is a posterior distribution over the integral that explicitly accounts for dual sources of numerical approximation error due to a severely limited computational budget. This construction is applied to account, in a statistically principled manner, for the impact of numerical errors that (at present) are confounding factors in functional cardiac model assessment."
https://youtu.be/C4ZLupAbszM,"Gaussian processes are rich distributions over functions, with generalization properties determined by a kernel function. When used for long-range extrapolation, predictions are particularly sensitive to the choice of kernel parameters. It is therefore critical to account for kernel uncertainty in our predictive distributions. We propose a distribution over kernels formed by modelling a spectral mixture density with a Levy process. The resulting distribution has support for all stationary covariances---including the popular RBF, periodic, and Matern kernels---combined with inductive biases which enable automatic and data efficient learning, long-range extrapolation, and state of the art predictive performance. The proposed model also presents an approach to spectral regularization, as the Levy process introduces a sparsity-inducing prior over mixture components, allowing automatic selection over model order and pruning of extraneous components. We exploit the algebraic structure of the proposed process for O(n) training and O(1) predictions. We perform extrapolations having reasonable uncertainty estimates on several benchmarks, show that the proposed model can recover flexible ground truth covariances and that it is robust to errors in initialization."
https://www.youtube.com/watch?v=zQyWMHFjewU,"One of the main challenges in reinforcement learning (RL) is generalisation. In typical deep RL methods this is achieved by approximating the optimal value function with a low-dimensional representation using a deep network.  While this approach works well in many domains, in domains where the optimal value function cannot easily be reduced to a low-dimensional representation, learning can be very slow and unstable. This paper contributes towards tackling such challenging domains, by proposing a new method, called Hybrid Reward Architecture (HRA). HRA takes as input a decomposed reward function and learns a separate value function for each component reward function. Because each component typically only depends on a subset of all features, the corresponding value function can be approximated more easily by a low-dimensional representation, enabling more effective learning. We demonstrate HRA on a toy-problem and the Atari game Ms. Pac-Man, where HRA achieves above-human performance."
https://www.youtube.com/watch?v=vGSzqbgDB-8,"With the increasing popularity of machine learning techniques, it has become common to see prediction algorithms operating within some larger process. However, the criteria by which we train these algorithms often differ from the ultimate criteria on which we evaluate them. This paper proposes an end-to-end approach for learning probabilistic machine learning models in a manner that directly captures the ultimate task-based objective for which they will be used, within the context of stochastic programming. We present three experimental evaluations of the proposed approach: a classical inventory stock problem, a real-world electrical grid scheduling task, and a real-world energy storage arbitrage task. We show that the proposed approach can outperform both traditional modeling and purely black-box policy optimization approaches in these applications."
https://youtu.be/bKnr73tIL9Y,"The expressive power of neural networks is important for understanding deep learning. Most existing works consider this problem from the view of the depth of a network. In this paper, we study how width affects the expressiveness of neural networks. Classical results state that depth-bounded (e.g. depth-2) networks with suitable activation functions are universal approximators. We show a universal approximation theorem for width-bounded ReLU networks: width-(n + 4) ReLU networks, where n is the input dimension, are universal approximators. Moreover, except for a measure zero set, all functions cannot be approximated by width-n ReLU networks, which exhibits a phase transition. Several recent works demonstrate the benefits of depth by proving the depth-efficiency of neural networks. That is, there are classes of deep networks which cannot be realized by any shallow network whose size is no more than an exponential bound. Here we pose the dual question on the width-efficiency of ReLU networks: Are there wide networks that cannot be realized by narrow networks whose size is not substantially larger? We show that there exist classes of wide networks which cannot be realized by any narrow network whose depth is no more than a polynomial bound. On the other hand, we demonstrate by extensive experiments that narrow networks whose size exceed the polynomial bound by a constant factor can approximate wide and shallow network with high accuracy. Our results provide more comprehensive evidence that depth may be more effective than width for the expressiveness of ReLU networks."
https://youtu.be/mC8uyU8ziXw,"We present a novel parallelisation scheme that simplifies the adaptation of learning algorithms to growing amounts of data as well as growing needs for accurate and confident predictions in critical applications. In contrast to other parallelisation techniques, it can be applied to a broad class of learning algorithms without further mathematical derivations and without writing dedicated code, while at the same time maintaining theoretical performance guarantees. Moreover, our parallelisation scheme is able to reduce the runtime of many learning algorithms to polylogarithmic time on quasi-polynomially many processing units. This is a significant step towards a general answer to an open question~\citep{long_algorithms_2013} on efficient parallelisation of machine learning algorithms in the sense of Nick's Class ($\mathcal{NC}$). The cost of this parallelisation is in the form of a larger sample complexity. Our empirical study confirms the potential of our parallelisation scheme with fixed numbers of processors and instances in realistic application scenarios."
https://youtu.be/LXoV9s_17no,"We study the problem of interactively learning a binary classifier using noisy labeling and pairwise comparison oracles, where the comparison oracle answers which one in the given two instances is more likely to be positive. Learning from such oracles has multiple applications where obtaining direct labels is harder but pairwise comparisons are easier, and the algorithm can leverage both types of oracles. In this paper, we attempt to characterize how the access to an easier comparison oracle helps in improving the label and total query complexity. We show that the comparison oracle reduces the learning problem to that of learning a threshold function. We then present an algorithm that interactively queries the label and comparison oracles and we characterize its query complexity under Tsybakov and adversarial noise conditions for the comparison and labeling oracles. Our lower bounds show that our label and total query complexity is almost optimal."
https://www.youtube.com/watch?v=zUhY_gQZG7o&t=2s,"We provide new results for noise-tolerant and sample-efficient learning algorithms under $s$-concave distributions. The new class of $s$-concave distributions is a broad and natural generalization of log-concavity, and includes many important additional distributions, e.g., the Pareto distribution and $t$ distribution. This class has been studied in the context of efficient sampling, integration, and optimization, but  much remains unknown about the geometry of this class of distributions and their applications in the context of learning. The challenge is that unlike the commonly used distributions in learning (uniform or more generally log-concave distributions), this broader class is not closed under the marginalization operator and many such distributions are fat-tailed. In this work, we introduce new convex geometry tools to study the properties of s concave distributions and use these properties to provide bounds on quantities of interest to learning including the probability of disagreement between two halfspaces, disagreement outside a band, and disagreement coefficient. We use these results to significantly generalize prior results for margin-based active learning, disagreement-based active learning, and passively learning of intersections of halfspaces. Our analysis of geometric properties of $s$-concave distributions might be of independent interest to optimization more broadly."
https://youtu.be/2mJOsr12cqM,"Learning the directed acyclic graph (DAG) structure of a Bayesian network from observational data is a notoriously difficult problem for which many non-identifiability and hardness results are known. In this paper we propose a provably polynomial-time algorithm for learning sparse Gaussian Bayesian networks with equal noise variance --- a class of Bayesian networks for which the DAG structure can be uniquely identified from observational data --- under high-dimensional settings. We show that $O(k^4 \log p)$ number of samples suffices for our method to recover the true DAG structure with high probability, where $p$ is the number of variables and $k$ is the maximum Markov blanket size. We obtain our theoretical guarantees under a condition called \emph{restricted strong adjacency faithfulness} (RSAF), which is strictly weaker than strong faithfulness --- a condition that other methods based on conditional independence testing need for their success. The sample complexity of our method matches the information-theoretic limits in terms of the dependence on $p$. We validate our theoretical findings through synthetic experiments."
https://youtu.be/j7U1C84hIko,"We show that given an estimate $\widehat{\mat A}$ that is close to a general high-rank positive semi-definite (PSD) matrix $\mat A$ in spectral norm (i.e., $\|\widehat{\mat A}-\mat A\|_2 \leq \delta$), the simple truncated Singular Value Decomposition of $\widehat{\mat A}$ produces a multiplicative approximation of $\mat A$ in Frobenius norm. This observation leads to many interesting results on general high-rank matrix estimation problems: 1.High-rank matrix completion: we show that it is possible to recover a {general high-rank matrix} $\mat A$ up to $(1+\varepsilon)$ relative error in Frobenius norm from partial observations, with sample complexity independent of the spectral gap of $\mat A$. 2.High-rank matrix denoising: we design algorithms that recovers a matrix $\mat A$ with relative error in Frobenius norm from its noise-perturbed observations, without assuming $\mat A$ is exactly low-rank. 3.Low-dimensional estimation of high-dimensional covariance: given $N$ i.i.d.~samples of dimension $n$ from $\mathcal N_n(\mat 0,\mat A)$, we show that it is possible to estimate the covariance matrix $\mat A$ with relative error in Frobenius norm with $N\approx n$,improving over classical covariance estimation results which requires $N\approx n^2$."
https://www.youtube.com/watch?v=5EEaY_cVYkk,"Generative Adversarial Networks (GAN) are an effective method for training generative models of complex data such as natural images. However, they are notoriously hard to train and can suffer from the problem of missing modes where the model is not able to produce examples in certain regions of the space. We propose an iterative procedure, called AdaGAN, where at every step we add a new component into a mixture model by running a GAN algorithm on a re-weighted sample. This is inspired by boosting algorithms, where many potentially weak individual predictors are greedily aggregated to form a strong composite predictor. We prove analytically that such an incremental procedure leads to convergence to the true distribution in a finite number of steps if each step is optimal, and convergence at an exponential rate otherwise. We also illustrate experimentally that this procedure addresses the problem of missing modes."
https://www.youtube.com/watch?v=PXwkTt0Rvd4,"Discovering a correlation from one variable to another variable is of fundamental scientific and practical interest. While existing correlation measures are suitable for discovering average correlation, they fail to discover hidden or potential correlations. To bridge this gap, (i) we postulate a set of natural axioms that we expect a measure of potential correlation to satisfy; (ii) we show that the rate of information bottleneck, i.e., the hypercontractivity coefficient, satisfies all the proposed axioms; (iii) we provide a novel estimator to estimate the hypercontractivity coefficient from samples; and (iv) we provide numerical experiments demonstrating that this proposed estimator discovers potential correlations among various indicators of WHO datasets, is robust in discovering gene interactions from gene expression time series data, and is statistically more powerful than the estimators for other correlation measures in binary hypothesis testing of canonical examples of potential correlations."
https://www.youtube.com/watch?v=j92cqQ9q8ao,"Adversarial machines, where a learner competes against an adversary, have regained much recent interest in machine learning. They are naturally in the form of saddle-point optimization, often with separable structure but sometimes also with unmanageably large dimension. In this work we show that adversarial prediction under multivariate losses can be solved much faster than they used to be. We first reduce the problem size exponentially by using appropriate sufficient statistics, and then we adapt the new stochastic variance-reduced algorithm of Balamurugan & Bach (2016) to allow any Bregman divergence. We prove that the same linear rate of convergence is retained and we show that for adversarial prediction using KL-divergence we can further achieve a speedup of #example times compared with the Euclidean alternative. We verify the theoretical findings through extensive experiments on two example applications: adversarial prediction and LPboosting."
https://youtu.be/VfI-iIdPTbo,"We study the resilience  to Byzantine failures of distributed implementations of Stochastic Gradient Descent (SGD). So far, distributed machine learning frameworks have largely ignored the possibility of failures, especially  arbitrary (i.e., Byzantine) ones. Causes of failures include software bugs, network asynchrony, biases in local datasets, as well as attackers trying to compromise the entire system. Assuming a set of $n$ workers, up to $f$  being Byzantine,  we ask how resilient  can SGD be, without limiting the dimension, nor the size of the parameter space. We first show that no gradient aggregation rule based on a linear combination of the vectors proposed by the workers (i.e, current approaches) tolerates a single Byzantine failure. We then formulate a resilience  property of the aggregation rule capturing the basic requirements to guarantee convergence despite $f$   Byzantine workers. We propose \emph{Krum}, an aggregation rule that satisfies our resilience  property, which we argue is the first provably Byzantine-resilient algorithm for distributed SGD. We also report on experimental evaluations of Krum."
https://youtu.be/1IOEFNGPNJc,"Graph clustering is a fundamental task in many data-mining and machine-learning pipelines. In particular, identifying a good hierarchical structure is at the same time a fundamental and challenging problem for several applications. The amount of data to analyze is increasing at an astonishing rate each day. Hence there is a need for new solutions to efficiently compute effective hierarchical clusterings on such huge data.  The main focus of this paper is on minimum spanning tree (MST) based clusterings. In particular, we propose affinity, a novel hierarchical clustering based on Boruvka's MST algorithm. We prove certain theoretical guarantees for affinity (as well as some other classic algorithms) and show that in practice it is superior to several other state-of-the-art clustering algorithms.   Furthermore, we present two MapReduce implementations for affinity. The first one works for the case where the input graph is dense and takes constant rounds. It is based on a Massively Parallel MST algorithm for dense graphs that improves upon the state-of-the-art algorithm of Lattanzi et al. (SPAA 2011). Our second algorithm has no assumption on the density of the input graph and finds the affinity clustering in $O(\log n)$ rounds using Distributed Hash Tables (DHTs). We show experimentally that our algorithms are scalable for huge data sets, e.g., for graphs with trillions of edges."
https://youtu.be/K4CSFK35mvo,"Hypergraph partitioning is an important problem in machine learning, computer vision and network analytics. A widely used method for hypergraph partitioning relies on minimizing a normalized sum of the costs of partitioning hyperedges across clusters. Algorithmic solutions based on this approach assume that different partitions of a hyperedge incur the same cost. However, this assumption fails to leverage the fact that different subsets of vertices within the same hyperedge may have different structural importance. We hence propose a new hypergraph clustering technique, termed inhomogeneous hypergraph partitioning, which assigns different costs to different hyperedge cuts. We prove that inhomogeneous partitioning produces a quadratic approximation to the optimal solution if the inhomogeneous costs satisfy submodularity constraints. Moreover, we demonstrate that inhomogenous partitioning offers significant performance improvements in applications such as structure learning of rankings, subspace segmentation and motif clustering."
https://www.youtube.com/watch?v=wjd1G5bu_TY,"Understanding why a model makes a certain prediction can be as crucial as the prediction's accuracy in many applications. However, the highest accuracy for large modern datasets is often achieved by complex models that even experts struggle to interpret, such as ensemble or deep learning models, creating a tension between accuracy and interpretability. In response, various methods have recently been proposed to help users interpret the predictions of complex models, but it is often unclear how these methods are related and when one method is preferable over another. To address this problem, we present a unified framework for interpreting predictions, SHAP (SHapley Additive exPlanations). SHAP assigns each feature an importance value for a particular prediction. Its novel components include: (1) the identification of a new class of additive feature importance measures, and (2) theoretical results showing there is a unique solution in this class with a set of desirable properties. The new class unifies six existing methods, notable because several recent methods in the class lack the proposed desirable properties. Based on insights from this unification, we present new methods that show improved computational performance and/or better consistency with human intuition than previous approaches."
https://youtu.be/v5Q8JoA6HnU,"Singular values of a data in a matrix form provide insights on the structure of the data, the effective dimensionality, and the choice of hyper-parameters on higher-level data analysis tools. However, in many practical applications such as collaborative filtering and network analysis,  we only get a partial observation. Under such scenarios, we consider the fundamental problem of recovering various spectral properties of the underlying matrix from a sampling of its entries. We propose a framework of first estimating the Schatten $k$-norms of a matrix for several values of $k$, and using these as surrogates for estimating spectral properties of interest, such as   the spectrum itself or the rank.  This paper focuses on the technical challenges in accurately estimating the Schatten norms from a sampling of a matrix. We introduce  a novel unbiased estimator based on counting small structures in a graph and provide  guarantees that match its empirical performances.  Our theoretical analysis shows that Schatten norms can be recovered accurately from strictly smaller number of samples compared to what is needed to recover the underlying low-rank matrix. Numerical experiments suggest that we significantly improve upon a competing approach of using matrix completion methods."
https://www.youtube.com/watch?v=XDFEaKlJ55U&t=1s,"This paper investigates the theoretical foundations of metric learning, focused on three key questions that are not fully addressed in prior work:  1) we consider learning general low-dimensional (low-rank) metrics as well as sparse metrics;2) we develop upper and lower (minimax) bounds on the generalization error; 3)we quantify the sample complexity of metric learning in terms of the dimension of the feature space and the dimension/rank of the underlying metric; 4) we also bound the accuracy of the learned metric relative to the underlying true generative metric. All the results involve novel mathematical approaches to the metric learning problem, and also shed new light on the special case of ordinal embedding (aka non-metric multidimensional scaling)."
https://youtu.be/OUgfEkfg-Tc,"We present the first efficient and provably consistent estimator for the robust regression problem. The area of robust learning and optimization has generated a significant amount of interest in the learning and statistics communities in recent years owing to its applicability in scenarios with corrupted data, as well as in handling model mis-specifications. In particular, special interest has been devoted to the fundamental problem of robust linear regression where estimators that can tolerate corruption in up to a constant fraction of the response variables are widely studied. Surprisingly however, to this date, we are not aware of a polynomial time estimator that offers a consistent estimate in the presence of dense, unbounded corruptions. In this work we present such an estimator, called CRR. This solves an open problem put forward in the work of (Bhatia et al, 2015). Our consistency analysis requires a novel two-stage proof technique involving a careful analysis of the stability of ordered lists which may be of independent interest. We show that CRR not only offers consistent estimates, but is empirically far superior to several other recently proposed algorithms for the robust regression problem, including extended Lasso and the TORRENT algorithm. In comparison, CRR offers comparable or better model recovery but with runtimes that are faster by an order of magnitude."
