Video_Presentation,Abstracts
http://alan.vision/nips17_website/demo.mp4,"We propose a framework that learns a representation transferable across different domains and tasks in a data efficient manner. Our approach battles domain shift with a domain adversarial loss, and generalizes the embedding to novel task using a metric learning-based approach. Our model is simultaneously optimized on labeled source data and unlabeled or sparsely labeled data in the target domain. Our method shows compelling results on novel classes within a new domain even when only a few labeled examples per class are available, outperforming the prevalent fine-tuning approach. In addition, we demonstrate the effectiveness of our framework on the transfer learning task from image object recognition to video action recognition."
https://youtu.be/58I-oY1kN-w,"Many machine learning tasks require finding per-part correspondences between objects. In this work we focus on low-level correspondences --- a highly ambiguous matching problem. We propose to use a hierarchical semantic representation of the objects, coming from a convolutional neural network, to solve this ambiguity. Training it for low-level correspondence prediction directly might not be an option in some domains where the ground-truth correspondences are hard to obtain. We show how transfer from recognition can be used to avoid such training. Our idea is to mark parts as ``matching'' if their features are close to each other at all the levels of convolutional feature hierarchy (neural paths). Although the overall number of such paths is exponential in the number of layers, we propose a polynomial algorithm for aggregating all of them in a single backward pass. The empirical validation is done on the task of stereo correspondence and demonstrates that we achieve competitive results among the methods which do not use labeled target domain data."
https://www.youtube.com/watch?v=d1JOsKm9Jbc,"We investigate an unsupervised generative approach for network embedding. A multi-task Siamese neural network structure is formulated to connect embedding vectors and our objective to preserve the global node ranking and local proximity of nodes. We provide deeper analysis to connect the proposed proximity objective to link prediction and community detection in the network. We show our model can satisfy the following design properties: scalability, asymmetry, unity and simplicity. Experiment results not only verify the above design properties but also demonstrate the superior performance in learning-to-rank, classification, regression, and link prediction tasks."
https://www.youtube.com/watch?v=F6D1Xo7RHlQ,"For the purpose of learning on graphs, we hunt for a graph feature representation that exhibit certain uniqueness, stability and sparsity properties while also being amenable to fast computation. This leads to the discovery of family of graph spectral distances (denoted as FGSD) and their based graph feature representations, which we prove to possess most of these desired properties. To both evaluate the quality of graph features produced by FGSD and demonstrate their utility, we apply them to the graph classification problem. Through extensive experiments, we show that a simple SVM based classification algorithm, driven with our powerful FGSD based graph features, significantly outperforms all the more sophisticated state-of-art algorithms on the unlabeled node datasets in terms of both accuracy and speed; it also yields very competitive results on the labeled datasets - despite the fact it does not utilize any node label information."
https://youtu.be/sm3hhsNkDAc,"We propose a novel adaptive approximation approach for test-time resource-constrained prediction motivated by Mobile, IoT, health, security and other applications, where constraints in the form of computation, communication, latency and feature acquisition costs arise. We learn an adaptive low-cost system by training a gating and prediction model that limits utilization of a high-cost model to hard input instances and gates easy-to-handle input instances to a low-cost model. Our method is based on adaptively approximating the high-cost model in regions where low-cost models suffice for making highly accurate predictions. We pose an empirical loss minimization problem with cost constraints to jointly train gating and prediction models. On a number of benchmark datasets our method outperforms state-of-the-art achieving higher accuracy for the same cost."
https://www.youtube.com/watch?v=Do1On5AzHE4,"Obtaining enough labeled data to robustly train complex discriminative models is a major bottleneck in the machine learning pipeline. A popular solution is combining multiple sources of weak supervision using generative models. The structure of these models affects the quality of the training labels, but is difficult to learn without any ground truth labels. We instead rely on weak supervision sources having some structure by virtue of being encoded programmatically. We present Coral, a paradigm that infers generative model structure by statically analyzing the code for these heuristics, thus significantly reducing the amount of data required to learn structure. We prove that Coral's sample complexity scales quasilinearly with the number of heuristics and number of relations identified, improving over the standard sample complexity, which is exponential in n for learning n-th degree relations. Empirically, Coral matches or outperforms traditional structure learning approaches by up to 3.81 F1 points. Using Coral to model dependencies instead of assuming independence results in better performance than a fully supervised model by 3.07 accuracy points when heuristics are used to label radiology data without ground truth labels."
https://www.youtube.com/watch?v=sNrMH9z1rb4,"Learning a regression function using censored or interval-valued output data is an important problem in fields such as genomics and medicine. The goal is to learn a real-valued prediction function, and the training output labels indicate an interval of possible values. Whereas most existing algorithms for this task are linear models, in this paper we investigate learning nonlinear tree models. We propose to learn a tree by minimizing a margin-based discriminative objective function, and we provide a dynamic programming algorithm for computing the optimal solution in log-linear time. We show empirically that this algorithm achieves state-of-the-art speed and prediction accuracy in a benchmark of several data sets."
https://youtu.be/Unbl-zwiyMc,"Spectral methods of moments provide a powerful tool for learning the parameters of latent variable models. Despite their theoretical appeal, the applicability of these methods to real data is still limited due to a lack of robustness to model misspecification. In this paper we present a hierarchical approach to methods of moments to circumvent such limitations. Our method is based on replacing the tensor decomposition step used in previous algorithms with approximate joint diagonalization. Experiments on topic modeling show that our method outperforms previous tensor decomposition methods in terms of speed and model quality."
https://www.youtube.com/watch?v=kKpbHXZ1qmU,"Kernel embeddings of distributions and the Maximum Mean Discrepancy (MMD), the resulting distance between distributions, are useful tools for fully nonparametric two-sample testing and learning on distributions. However, it is rarely that all possible differences between samples are of interest -- discovered differences can be due to different types of measurement noise, data collection artefacts or other irrelevant sources of variability. We propose distances between distributions which encode invariance to additive symmetric noise, aimed at testing whether the assumed true underlying processes differ. Moreover, we construct invariant features of distributions, leading to learning algorithms robust to the impairment of the input distributions with symmetric additive noise."
https://www.youtube.com/watch?v=n8y7SD_t9ms,"Inference using deep neural networks is often outsourced to the cloud since it is a computationally demanding task.  However, this raises a fundamental issue of trust. How can a client be sure that the cloud has performed inference correctly? A lazy cloud provider might use a simpler but less accurate model to reduce its own computational load, or worse, maliciously modify the inference results sent to the client. We propose SafetyNets, a framework that enables an untrusted server (the cloud) to provide a client with a short mathematical proof of the correctness of inference tasks that they perform on behalf of the client. Specifically, SafetyNets develops and implements a specialized interactive proof (IP) protocol for verifiable execution of a class of deep neural networks, i.e., those that can be represented as arithmetic circuits. Our empirical results on three- and four-layer deep neural networks demonstrate the run-time costs of SafetyNets for both the client and server are low. SafetyNets detects any incorrect computations of the neural network by the untrusted server with high probability, while achieving state-of-the-art accuracy on the MNIST digit recognition (99.4%) and TIMIT speech recognition tasks (75.22%)."
http://www.cs.jhu.edu/~hmei/papers/mei+eisner.nips17.video.html,"Many events occur in the world. Some event types are stochastically excited or inhibited—in the sense of having their probabilities elevated or decreased—by patterns in the sequence of previous events. Discovering such patterns can help us predict which type of event will happen next and when. We model streams of discrete events in continuous time, by constructing a neurally self-modulating multivariate point process in which the intensities of multiple event types evolve according to a novel continuous-time LSTM. This generative model allows past events to influence the future in complex and realistic ways, by conditioning future event intensities on the hidden state of a recurrent neural network that has consumed the stream of past events. Our model has desirable qualitative properties. It achieves competitive likelihood and predictive accuracy on real and synthetic datasets, including under missing-data conditions."
https://youtu.be/uIHLIm-5dok,"Universal style transfer aims to transfer arbitrary visual styles to content images. Existing feed-forward based methods, while enjoying the inference efficiency, are mainly limited by inability of generalizing to unseen styles or compromised visual quality. In this paper, we present a simple yet effective method that tackles these limitations without training on any pre-defined styles. The key ingredient of our method is a pair of feature transforms, whitening and coloring, that are embedded to an image reconstruction network. The whitening and coloring transforms reflect direct matching of feature covariance of the content image to a given style image, which shares similar spirits with the optimization of Gram matrix based cost in neural style transfer. We demonstrate the effectiveness of our algorithm by generating high-quality stylized images with comparisons to a number of recent methods. We also analyze our method by visualizing the whitened features and synthesizing textures by simple feature coloring."
https://youtu.be/tfgmXvSgsQE,"The past decade has seen a revolution in genomic technologies that enabled a flood of genome-wide profiling of chromatin marks.  Recent literature tried to understand gene regulation by predicting gene expression from large-scale chromatin measurements.  Two fundamental challenges exist for such learning tasks: (1) genome-wide chromatin signals are spatially structured, high-dimensional and highly modular; and (2) the core aim is to understand what are the relevant factors and how they work together.  Previous studies either failed to model complex dependencies among input signals or relied on separate feature analysis to explain the decisions. This paper presents an attention-based deep learning approach; AttentiveChrome, that uses a unified architecture to model and to interpret dependencies among chromatin factors for controlling gene regulation. AttentiveChrome uses a hierarchy of multiple Long Short-Term Memory (LSTM) modules to encode the input signals and to model how various chromatin marks cooperate automatically. AttentiveChrome trains two levels of attention jointly with the target prediction, enabling it to attend differentially to relevant marks and to locate important positions per mark. We evaluate the model across 56 different cell types (tasks) in human. Not only is the proposed architecture more accurate, but its attention scores also provide a better interpretation than state-of-the-art feature visualization methods such as saliency map."
https://youtu.be/KPbgBnK7IbI,"Visual dialog is a task of answering a series of inter-dependent questions given an input image, and often requires to resolve visual references among the questions. This problem is different from visual question answering (VQA), which relies on spatial attention ({\em a.k.a. visual grounding}) estimated from an image and question pair. We propose a novel attention mechanism that exploits visual attentions in the past to resolve the current reference in the visual dialog scenario. The proposed model is equipped with an associative attention memory storing a sequence of previous (attention, key) pairs. From this memory, the model retrieves previous attention, taking into account recency, that is most relevant for the current question, in order to resolve potentially ambiguous reference(s). The model then merges the retrieved attention with the tentative one to obtain the final attention for the current question; specifically, we use dynamic parameter prediction to combine the two attentions conditioned on the question. Through extensive experiments on a new synthetic visual dialog dataset, we show that our model significantly outperforms the state-of-the-art (by ~16 % points) in the situation where the visual reference resolution plays an important role. Moreover, the proposed model presents superior performance (~2 % points improvement) in the Visual Dialog dataset, despite having significantly fewer parameters than the baselines."
https://youtu.be/FBW6drMpK3U,"This paper proposes the novel Pose Guided Person Generation Network (PG$^2$) that allows to synthesize person images in arbitrary poses, based on an image of that person and a novel pose. Our generation framework PG$^2$ utilizes the pose information explicitly and consists of two key stages: pose integration and image refinement. In the first stage the condition image and the target pose are fed into a U-Net-like network to generate an initial but coarse image of the person with the target pose. The second stage then refines the initial and blurry result by training a U-Net-like generator in an adversarial way. Extensive experimental results on both 128$\times$64 re-identification images and 256$\times$256 fashion photos show that our model generates high-quality person images with convincing details."
http://www.eecs.berkeley.edu/~junyanz/projects/BicycleGAN/video.mp4,"Many image-to-image translation problems are ambiguous, as a single input image may correspond to multiple possible outputs. In this work, we aim to model a distribution of possible outputs in a conditional generative modeling setting. The ambiguity of the mapping is distilled in a low-dimensional latent vector, which can be randomly sampled at test time. A generator learns to map the given input, combined with this latent code, to the output. We explicitly encourage the connection between output and the latent code to be invertible. This helps prevent a many-to-one mapping from the latent code to the output during training, also known as the problem of mode collapse, and produces more diverse results. We explore several variants of this approach by employing different training objectives, network architectures, and methods of injecting the latent code. Our proposed method encourages bijective consistency between the latent encoding and output modes. We present a systematic comparison of our method and other variants on both perceptual realism and diversity."
https://youtu.be/KwKR36yRy24,"We propose ThalNet, a deep learning model inspired by neocortical communication via the thalamus. Our model consists of recurrent neural modules that send features through a routing center, endowing the modules with the flexibility to share features over multiple time steps. We show that our model learns to route information hierarchically, processing input data by a chain of modules. We observe common architectures, such as feed forward neural networks and skip connections, emerging as special cases of our architecture, while novel connectivity patterns are learned for the text8 compression task. Our model outperforms standard recurrent neural networks on several sequential benchmarks."
https://www.youtube.com/watch?v=CfRAgYDlCKs,"Deep learning requires data. A useful approach to obtain data is to  be creative and mine data from various sources, that were created for different purposes. Unfortunately, this approach often leads to noisy labels. In this paper, we propose a meta algorithm for tackling the noisy labels problem. The key idea is to decouple  ``when to update'' from ``how to update''. We demonstrate the effectiveness of our algorithm by mining data for gender classification by combining the Labeled Faces in the Wild (LFW) face recognition dataset with a textual genderizing service, which leads to a noisy dataset. While our approach is very simple to implement, it leads to state-of-the-art results. We analyze some convergence properties of the proposed algorithm."
https://www.youtube.com/watch?v=3zEYjw-cB4Y,"Dropout-based regularization methods can be regarded as injecting random noise with pre-defined magnitude to different parts of the neural network during training. It was recently shown that Bayesian dropout procedure not only improves gener- alization but also leads to extremely sparse neural architectures by automatically setting the individual noise magnitude per weight. However, this sparsity can hardly be used for acceleration since it is unstructured. In the paper, we propose a new Bayesian model that takes into account the computational structure of neural net- works and provides structured sparsity, e.g. removes neurons and/or convolutional channels in CNNs. To do this we inject noise to the neurons outputs while keeping the weights unregularized. We establish the probabilistic model with a proper truncated log-uniform prior over the noise and truncated log-normal variational approximation that ensures that the KL-term in the evidence lower bound is com- puted in closed-form. The model leads to structured sparsity by removing elements with a low SNR from the computation graph and provides significant acceleration on a number of deep neural architectures. The model is easy to implement as it can be formulated as a separate dropout-like layer."
https://youtu.be/gOJ-HrTI8Gk,"We develop a class of algorithms, as variants of the stochastically controlled stochastic gradient (SCSG) methods , for the smooth nonconvex finite-sum optimization problem. Only assuming the smoothness of each component, the complexity of SCSG to reach a stationary point with $E \|\nabla f(x)\|^{2}\le \epsilon$ is $O(\min\{\epsilon^{-5/3}, \epsilon^{-1}n^{2/3}\})$, which strictly outperforms the stochastic gradient descent. Moreover, SCSG is never worse than the state-of-the-art methods based on variance reduction and it significantly outperforms them when the target accuracy is low. A similar acceleration is also achieved when the functions satisfy the Polyak-Lojasiewicz condition. Empirical experiments demonstrate that SCSG outperforms stochastic gradient methods on training multi-layers neural networks in terms of both training and validation loss."
https://youtu.be/zOgCWEvf4IE,"DR-submodular continuous functions are important objectives with wide real-world applications spanning MAP inference in  determinantal point processes (DPPs), and mean-field inference for probabilistic submodular models, amongst others. DR-submodularity captures a subclass of non-convex functions that enables both exact minimization and approximate maximization in polynomial time.  In this work we study the  problem of maximizing  non-monotone DR-submodular continuous functions under general down-closed convex constraints. We start by investigating geometric properties that underlie such objectives, e.g., a strong relation between  (approximately) stationary points and global optimum is proved. These properties are then used to devise two optimization algorithms with provable guarantees. Concretely, we first devise a ""two-phase'' algorithm with 1/4 approximation guarantee. This algorithm allows the use of existing methods for finding (approximately) stationary points as a subroutine, thus, harnessing recent progress in non-convex optimization. Then we present a non-monotone Frank-Wolfe variant with 1/e approximation guarantee and sublinear convergence rate. Finally, we extend our approach to a broader class of generalized DR-submodular continuous functions, which captures a wider spectrum of applications. Our theoretical findings are validated on synthetic and real-world problem instances."
https://www.youtube.com/watch?v=gUgs_AbV80k,"We consider the problem of solving a large-scale Quadratically Constrained Quadratic Program. Such problems occur naturally in many scientific and web applications. Although there are efficient methods which tackle this problem, they are mostly not scalable. In this paper, we develop a method that transforms the quadratic constraint into a linear form by a sampling a set of low-discrepancy points. The transformed problem can then be solved by applying any state-of-the-art large-scale solvers. We show the convergence of our approximate solution to the true solution as well as some finite sample error bounds. Experimental results are also shown to prove scalability in practice."
https://www.youtube.com/watch?v=10HRdZg48sA&feature=youtu.be,"We propose a generic algorithmic building block to accelerate training of  machine learning models on heterogeneous compute systems. Our scheme allows to efficiently employ compute accelerators such as GPUs and FPGAs for the training of large-scale machine learning models, when the training data exceeds their memory capacity. Also, it provides adaptivity to any system's memory hierarchy in terms of size and processing speed. Our technique is built upon novel theoretical insights regarding primal-dual coordinate methods, and uses duality gap information to dynamically decide which part of the data should be made available for fast processing. To illustrate the power of our approach we demonstrate its performance for training of generalized linear models on a large-scale dataset exceeding the memory size of a modern GPU, showing an order-of-magnitude speedup over existing approaches."
https://youtu.be/W06wMKXXPB0,"We discover a screening rule for l1-regularized Ising model estimation. The simple closed-form screening rule is a necessary and sufficient condition for exactly recovering the blockwise structure of a solution under any given regularization parameters. With enough sparsity, the screening rule can be combined with various optimization procedures to deliver solutions efficiently in practice. The screening rule is especially suitable for large-scale exploratory data analysis, where the number of variables in the dataset can be thousands while we are only interested in the relationship among a handful of variables within moderate-size clusters for interpretability. Experimental results on various datasets demonstrate the efficiency and insights gained from the introduction of the screening rule."
https://www.youtube.com/watch?v=HKsv2kT6wBM,"We prove near-tight concentration of measure for polynomial functions of the Ising model, under high temperature, improving the radius of concentration guaranteed by known results by polynomial factors in the dimension (i.e.~the number of nodes in the Ising model). We show that our results are optimal up to logarithmic factors in the dimension. We obtain our results by extending and strengthening the exchangeable-pairs approach used to prove concentration of measure in this setting by Chatterjee. We demonstrate the efficacy of such functions as statistics for testing the strength  of interactions in social networks in both synthetic and real world data."
https://youtu.be/q62wGDF02nU,"Many applications of machine learning, for example in health care, would benefit from methods that can guarantee privacy of data subjects. Differential privacy (DP) has become established as a standard for protecting learning results. The standard DP algorithms require a single trusted party to have access to the entire data, which is a clear weakness, or add prohibitive amounts of noise. We consider DP Bayesian learning in a distributed setting, where each party only holds a single sample or a few samples of the data. We propose a learning strategy based on a secure multi-party sum function for aggregating summaries from data holders and the Gaussian mechanism for DP. Our method builds on an asymptotically optimal and practically efficient DP Bayesian inference with rapidly diminishing extra cost."
