Video_Presentation,Abstracts
https://youtu.be/9MgDu4v99Fg,"Kernel methods have recently attracted resurgent interest, showing performance competitive with deep neural networks in tasks such as speech recognition. The random Fourier features map is a technique commonly used to scale up kernel machines, but employing the randomized feature map means that $O(\epsilon^{-2})$ samples are required to achieve an approximation error of at most $\epsilon$. We investigate some alternative schemes for constructing feature maps that are deterministic, rather than random, by approximating the kernel in the frequency domain using Gaussian quadrature. We show that deterministic feature maps can be constructed, for any $\gamma > 0$, to achieve error $\epsilon$ with $O(e^{\gamma} + \epsilon^{-1/\gamma})$ samples as $\epsilon$ goes to 0. Our method works particularly well with sparse ANOVA kernels, which are inspired by the convolutional layer of CNNs. We validate our methods on datasets in different domains, such as MNIST and TIMIT, showing that deterministic features are faster to generate and achieve accuracy comparable to the state-of-the-art kernel methods based on random Fourier features."
https://www.youtube.com/watch?v=L82ij8ei8B4&feature=youtu.be,"Consider the following estimation problem: there are $n$ entities, each with an unknown parameter $p_i \in [0,1]$, and we observe $n$ independent random variables, $X_1,\ldots,X_n$, with $X_i \sim $ Binomial$(t, p_i)$.  How accurately can one recover the ``histogram'' (i.e. cumulative density function) of the $p_i$'s?   While the empirical estimates would recover the histogram to earth mover distance $\Theta(\frac{1}{\sqrt{t}})$ (equivalently, $\ell_1$ distance between the CDFs), we show that, provided $n$ is sufficiently large, we can achieve error $O(\frac{1}{t})$ which is information theoretically optimal. We also extend our results to the multi-dimensional parameter case, capturing settings where each member of the population has multiple associated parameters.  Beyond the theoretical results, we demonstrate that the recovery algorithm performs well in practice on a variety of datasets, providing illuminating insights into several domains, including politics, sports analytics, and variation in the gender ratio of offspring."
https://youtu.be/5ik3aHAU2k8,"MicroRNAs (miRNAs) are small non-coding ribonucleic acids (RNAs) which play key roles in post-transcriptional gene regulation. Direct identification of mature miRNAs is infeasible due to their short lengths, and researchers instead aim at identifying precursor miRNAs (pre-miRNAs). Many of the known pre-miRNAs have distinctive stem-loop secondary structure, and structure-based filtering is usually the first step to predict the possibility of a given sequence being a pre-miRNA. To identify new pre-miRNAs that often have non-canonical structure, however, we need to consider additional features other than structure. To obtain such additional characteristics, existing computational methods rely on manual feature extraction, which inevitably limits the efficiency, robustness, and generalization of computational identification. To address the limitations of existing approaches, we propose a pre-miRNA identification method that incorporates (1) a deep recurrent neural network (RNN) for automated feature learning and classification, (2) multimodal architecture for seamless integration of prior knowledge (secondary structure), (3) an attention mechanism for improving long-term dependence modeling, and (4) an RNN-based class activation mapping for highlighting the learned representations that can contrast pre-miRNAs and non-pre-miRNAs. In our experiments with recent benchmarks, the proposed approach outperformed the compared state-of-the-art alternatives in terms of various performance metrics."
https://youtu.be/I-K_DKXXD8Q,"While 360° cameras offer tremendous new possibilities in vision, graphics, and augmented reality, the spherical images they produce make core feature extraction non-trivial. Convolutional neural networks (CNNs) trained on images from perspective cameras yield “flat"" filters, yet 360° images cannot be projected to a single plane without significant distortion. A naive solution that repeatedly projects the viewing sphere to all tangent planes is accurate, but much too computationally intensive for real problems. We propose to learn a spherical convolutional network that translates a planar CNN to process 360° imagery directly in its equirectangular projection. Our approach learns to reproduce the flat filter outputs on 360° data, sensitive to the varying distortion effects across the viewing sphere. The key benefits are 1) efficient feature extraction for 360° images and video, and 2) the ability to leverage powerful pre-trained networks researchers have carefully honed (together with massive labeled image training sets) for perspective images. We validate our approach compared to several alternative methods in terms of both raw CNN output accuracy as well as applying a state-of-the-art “flat"" object detector to 360° data. Our method yields the most accurate results while saving orders of magnitude in computation versus the existing exact reprojection solution."
https://www.youtube.com/watch?v=laO2kDk9sGI,"In this paper we introduce a natural image prior that directly represents a Gaussian-smoothed version of the natural image distribution. We include our prior in a formulation of image restoration as a Bayes estimator that also allows us to solve noise-blind image restoration problems. We show that the gradient of our prior corresponds to the mean-shift vector on the natural image distribution. In addition, we learn the mean-shift vector field using denoising autoencoders, and use it in a gradient descent approach to perform Bayes risk minimization. We demonstrate competitive results for noise-blind deblurring, super-resolution, and demosaicing."
http://marrnet.csail.mit.edu,"3D object reconstruction from a single image is a highly under-determined problem, requiring strong prior knowledge of plausible 3D shapes. This introduces challenge for learning-based approaches, as 3D object annotations in real images are scarce. Previous work chose to train on synthetic data with ground truth 3D information, but suffered from the domain adaptation issue when tested on real data.  In this work, we propose an end-to-end trainable framework, sequentially estimating 2.5D sketches and 3D object shapes. Our disentangled, two-step formulation has three advantages. First, compared to full 3D shape, 2.5D sketches are much easier to be recovered from a 2D image, and to transfer from synthetic to real data. Second, for 3D reconstruction from the 2.5D sketches, we can easily transfer the learned model on synthetic data to real images, as rendered 2.5D sketches are invariant to object appearance variations in real images, including lighting, texture, etc. This further relieves the domain adaptation problem. Third, we derive differentiable projective functions from 3D shape to 2.5D sketches, making the framework end-to-end trainable on real images, requiring no real-image annotations. Our framework achieves state-of-the-art performance on 3D shape reconstruction."
http://people.csail.mit.edu/janner/videos/intrinsic_nips.html,"Intrinsic decomposition from a single image is a highly challenging task, due to its inherent ambiguity and the scarcity of training data. In contrast to traditional fully supervised learning approaches, in this paper we propose learning intrinsic image decomposition by explaining the input image. Our model, the Rendered Intrinsics Network (RIN), joins together an image decomposition pipeline, which predicts reflectance, shape, and lighting conditions given a single image, with a recombination function, a learned shading model used to recompose the original input based off of intrinsic image predictions. Our network can then use unsupervised reconstruction error as an additional signal to improve its intermediate representations. This allows large-scale unlabeled data to be useful during training, and also enables transferring learned knowledge to images of unseen object categories, lighting conditions, and shapes. Extensive experiments demonstrate that our method performs well on both intrinsic image decomposition and knowledge transfer."
https://youtu.be/gq-7HgzfDBM,"A capsule is a group of neurons whose activity vector represents the instantiation parameters of a specific type of entity such as an object or object part. We use the length of the activity vector to represent the probability that the entity exists and its orientation to represent the instantiation parameters. Active capsules at one level make predictions, via transformation matrices, for the instantiation parameters of higher-level capsules.  When multiple predictions agree, a higher level capsule becomes active. We show that a discrimininatively trained, multi-layer capsule system achieves state-of-the-art performance on MNIST and is considerably better than a convolutional net at recognizing highly overlapping digits. To achieve these results we use an iterative routing-by-agreement mechanism: A lower-level capsule prefers to send its output to higher level capsules whose activity vectors have a big scalar product with the prediction coming from the lower-level capsule."
https://youtu.be/wsN4P0E1ZP8,"We propose a new method that uses deep learning techniques to accelerate the popular alternating direction method of multipliers (ADMM) solution for inverse problems. The ADMM updates consist of a proximity operator, a least squares regression that includes a big matrix inversion, and an explicit solution for updating the dual variables. Typically, inner loops are required to solve the first two sub-minimization problems due to the intractability of the prior and the matrix inversion.  To avoid such drawbacks or limitations, we propose an inner-loop free update rule with two pre-trained deep convolutional architectures. More specifically, we learn a conditional denoising auto-encoder which imposes an implicit data-dependent prior/regularization on ground-truth in the first sub-minimization problem. This design follows an empirical Bayesian strategy, leading to so-called amortized inference. For matrix inversion in the second sub-problem, we learn a convolutional neural network to approximate the matrix inversion, i.e., the inverse mapping is learned by feeding the input through the learned forward network. Note that training this neural network does not require ground-truth or measurements, i.e., data-independent. Extensive experiments on both synthetic data and real datasets demonstrate the efficiency and accuracy of the proposed method compared with the conventional ADMM solution using inner loops for solving inverse problems."
https://www.youtube.com/watch?v=p1yeMFwkp1c,"Word embeddings are a powerful approach for analyzing language, and exponential family embeddings (EFE) extend them to other types of data. Here we develop structured exponential family embeddings (S-EFE), a method for discovering embeddings that vary across related groups of data. We study how the word usage of U.S. Congressional speeches varies across states and party affiliation, how words are used differently across sections of the ArXiv, and how the co-purchase patterns of groceries can vary across seasons. Key to the success of our method is that the groups share statistical information. We develop two sharing strategies: hierarchical modeling and amortization. We demonstrate the benefits of this approach in empirical studies of speeches, abstracts, and shopping baskets. We show how SEFE enables group-specific interpretation of word usage, and outperforms EFE in predicting held-out data."
https://youtu.be/Vvkjm0FRGSs,"Class-agnostic object tracking is particularly difficult in cluttered environments as target specific discriminative models cannot be learned a priori. Inspired by how the human visual cortex employs spatial attention and separate ``where'' and ``what'' processing pathways to actively suppress irrelevant visual features, this work develops a hierarchical attentive recurrent model for single object tracking in videos. The first layer of attention discards the majority of background by selecting a region containing the object of interest, while the subsequent layers tune in on visual features particular to the tracked object.    This framework is fully differentiable and can be trained in a purely data driven fashion by gradient methods. To improve training convergence, we augment the loss function with terms for auxiliary tasks relevant for tracking. Evaluation of the proposed model is performed on two datasets: pedestrian tracking on the KTH activity recognition dataset and the more difficult KITTI object tracking dataset."
https://youtu.be/FpfZ8Srp-Yg,"As datasets grow richer, an important challenge is to leverage the full features in the data to maximize the number of useful discoveries while controlling for false positives. We address this problem in the context of multiple hypotheses testing, where for each hypothesis, we observe a p-value along with a set of features specific to that hypothesis. For example, in genetic association studies, each hypothesis tests the correlation between a variant and the trait. We have a rich set of features for each variant (e.g. its location, conservation, epigenetics etc.) which could inform how likely the variant is to have a true association. However popular testing approaches, such as Benjamini-Hochberg's procedure (BH) and independent hypothesis weighting (IHW), either ignore these features or assume that the features are categorical. We propose a new algorithm, NeuralFDR, which automatically learns a discovery threshold as a function of all the hypothesis features. We parametrize the discovery threshold as a neural network, which enables flexible handling of multi-dimensional discrete and continuous features as well as efficient end-to-end optimization. We prove that NeuralFDR has strong false discovery rate (FDR) guarantees, and show that it makes substantially more discoveries in synthetic and real datasets. Moreover, we demonstrate that the learned discovery threshold is directly interpretable."
https://www.youtube.com/watch?v=gWWTunj6pJg&feature=youtu.be,"We develop a method for comparing hierarchical image representations in terms of their ability to explain perceptual sensitivity in humans. Specifically, we utilize Fisher information to establish a model-derived prediction of sensitivity to local perturbations of an image. For a given image, we compute the eigenvectors of the Fisher information matrix with largest and smallest eigenvalues, corresponding to the model-predicted most- and least-noticeable image distortions, respectively. For human subjects, we then measure the amount of each distortion that can be reliably detected when added to the image, and compare these thresholds to the predictions of the corresponding model. We use this method to test the ability of a variety of representations to mimic human perceptual sensitivity. We find that the early layers of VGG16, a deep neural network optimized for object recognition, provide a better match to human perception than later layers, and a better match than a 4-stage convolutional neural network (CNN) trained on a database of human ratings of distorted image quality. On the other hand, we find that simple models of early visual processing, incorporating one or more stages of local gain control, trained on the same database of distortion ratings, provide substantially better predictions of human sensitivity than both the CNN and all layers of VGG16."
https://youtu.be/6_GIq9MgkUY,"In this paper, we propose a spatial propagation networks for learning affinity matrix. We show that by constructing a row/column linear propagation model, the spatially variant transformation matrix constitutes an affinity matrix that models dense, global pairwise similarities of an image. Specifically, we develop a three-way connection for the linear propagation model, which (a) formulates a sparse transformation matrix where all elements can be the output from a deep CNN, but (b) results in a dense affinity matrix that is effective to model any task-specific pairwise similarity. Instead of designing the similarity kernels according to image features of two points, we can directly output all similarities in a pure data-driven manner. The spatial propagation network is a generic framework that can be applied to numerous tasks, which traditionally benefit from designed affinity, e.g., image matting, colorization, and guided filtering, to name a few. Furthermore, the model can also learn semantic-aware affinity for high-level vision tasks due to the learning capability of the deep model. We validate the proposed framework by refinement of object segmentation. Experiments on the HELEN face parsing and PASCAL VOC-2012 semantic segmentation tasks show that the spatial propagation network provides general, effective and efficient solutions for generating high-quality segmentation results."
https://youtu.be/4WGw3SlOUnE,"Convolution as inner product has been the founding basis of convolutional neural networks (CNNs) and the key to end-to-end visual representation learning. Benefiting from deeper architectures, recent CNNs have demonstrated increasingly strong representation abilities. Despite such improvement, the increased depth and larger parameter space have also led to challenges in properly training a network. In light of such challenges, we propose hyperspherical convolution (SphereConv), a novel learning framework that gives angular representations on hyperspheres. We introduce SphereNet, deep hyperspherical convolution networks that are distinct from conventional inner product based convolutional networks. In particular, SphereNet adopts SphereConv as its basic convolution operator and is supervised by generalized angular softmax loss - a natural loss formulation under SphereConv. We show that SphereNet can effectively encode discriminative representation and alleviate training difficulty, leading to easier optimization, faster convergence and comparable (even better) classification accuracy over convolutional counterparts. We also provide some theoretical insights for the advantages of learning on hyperspheres. In addition, we introduce the learnable SphereConv, i.e., a natural improvement over prefixed SphereConv, and SphereNorm, i.e., hyperspherical learning as a normalization method. Experiments have verified our conclusions."
https://youtu.be/a1OUkVBjTmw,"There is significant recent interest to parallelize deep learning algorithms in order to handle the enormous growth in data and model sizes. While most advances focus on model parallelization and engaging multiple computing agents via using a central parameter server, aspect of data parallelization along with decentralized computation has not been explored sufficiently. In this context, this paper presents a new consensus-based distributed SGD (CDSGD) (and its momentum variant, CDMSGD) algorithm for collaborative deep learning over fixed topology networks that enables data parallelization as well as decentralized computation. Such a framework can be extremely useful for learning agents with access to only local/private data in a communication constrained environment. We analyze the convergence properties of the proposed algorithm with strongly convex and nonconvex objective functions with fixed and diminishing step sizes using concepts of Lyapunov function construction. We demonstrate the efficacy of our algorithms in comparison with the baseline centralized SGD and the recently proposed federated averaging algorithm (that also enables data parallelism) based on benchmark datasets such as MNIST, CIFAR-10 and CIFAR-100."
http://cvlab.postech.ac.kr/~hyeonwoonoh/papers/noh2017regularizing/noh2017regularizing_poster.pdf,"Overfitting is one of the most critical challenges in deep neural networks, and there are various types of regularization methods to improve generalization performance. Injecting noises to hidden units during training, e.g., dropout, is known as a successful regularizer, but it is still not clear enough why such training techniques work well in practice and how we can maximize their benefit in the presence of two conflicting objectives---optimizing to true data distribution and preventing overfitting by regularization. This paper addresses the above issues by 1) interpreting that the conventional training methods with regularization by noise injection optimize the lower bound of the true objective and 2) proposing a technique to achieve a tighter lower bound using multiple noise samples per training example  in a stochastic gradient descent iteration. We demonstrate the effectiveness of our idea in several computer vision applications."
https://youtu.be/0oUKu9DX3d0,"In many machine learning applications, it is important to explain the predictions of a black-box classifier. For example, why does a deep neural network assign an image to a particular class? We cast interpretability of black-box classifiers as a combinatorial maximization problem and propose an efficient streaming algorithm to solve it subject to cardinality constraints. By extending ideas from Badanidiyuru et al. [2014], we provide a constant factor approximation guarantee for our algorithm in the case of random stream order and a weakly submodular objective function. This is the first such theoretical guarantee for this general class of functions, and we also show that no such algorithm exists for a worst case stream order. Our algorithm obtains similar explanations of Inception V3 predictions 10 times faster than the state-of-the-art LIME framework of Ribeiro et al. [2016]."
https://youtu.be/5ohEulhjM8Y,"Although gradient descent (GD) almost always escapes saddle points asymptotically [Lee et al., 2016], this paper shows that even with fairly natural random initialization schemes and non-pathological functions, GD can be significantly slowed down by saddle points, taking exponential time to escape. On the other hand, gradient descent with perturbations [Ge et al., 2015, Jin et al., 2017] is not slowed down by saddle points—it can find an approximate local minimizer in polynomial time. This result implies that GD is inherently slower than perturbed GD, and justifies the importance of adding perturbations for efficient non-convex optimization. While our focus is theoretical, we also present experiments that illustrate our theoretical findings."
https://www.youtube.com/watch?v=_NaRjmbUPqQ,"Computing optimal transport distances such as the earth mover's distance is a fundamental problem in machine learning, statistics, and computer vision. Despite the recent introduction of several algorithms with good empirical performance, it is unknown whether general optimal transport distances can be approximated in near-linear time. This paper demonstrates that this ambitious goal is in fact achieved by Cuturi's Sinkhorn Distances. This result relies on a new analysis of Sinkhorn iterations, which also directly suggests a new greedy coordinate descent algorithm Greenkhorn with the same theoretical guarantees. Numerical simulations  illustrate that Greenkhorn significantly outperforms the classical Sinkhorn algorithm in practice."
https://youtu.be/A-JxWgq76kE,"We propose a rank-k variant of the classical Frank-Wolfe algorithm to solve convex optimization over a trace-norm ball. Our algorithm replaces the top singular-vector computation (1-SVD) in Frank-Wolfe with a top-k singular-vector computation (k-SVD), which can be done by repeatedly applying 1-SVD k times. Alternatively, our algorithm can be viewed as a rank-k restricted version of projected gradient descent. We show that our algorithm has a linear convergence rate when the objective function is smooth and strongly convex, and the optimal solution has rank at most k. This improves the convergence rate and the total time complexity of the Frank-Wolfe method and its variants."
https://www.youtube.com/watch?v=9euBmF3SZsM,"Error bound, an inherent property of an optimization problem, has recently revived in the development of algorithms with improved global convergence without strong convexity. The most studied error bound  is the quadratic error bound, which generalizes strong convexity and is satisfied by a large family of machine learning problems. Quadratic error bound have been leveraged to achieve linear convergence in many first-order methods including the stochastic variance reduced gradient (SVRG) method, which is one of the most important stochastic optimization methods in machine learning. However, the studies along this direction face the critical issue that the algorithms must depend on an unknown growth parameter (a generalization of strong convexity modulus) in the error bound. This parameter is difficult to estimate exactly and the algorithms choosing this parameter heuristically do not have theoretical convergence guarantee. To address this issue, we propose novel SVRG methods that automatically search for this unknown parameter on the fly of optimization while still obtain almost the same convergence rate as when this parameter is known. We also analyze the convergence property of SVRG methods under H\""{o}lderian error bound, which generalizes the quadratic error bound."
