Video_Presentation,Abstracts
https://www.dropbox.com/s/mg4ukza6psw02j4/Balancing%20information%20exposure%20on%20social%20networks.mp4?dl=0,"Social media has brought a revolution on how people are consuming news. Beyond the undoubtedly large number of advantages brought by social-media platforms, a point of criticism has been the creation of echo chambers and filter bubbles, caused by social homophily and algorithmic personalization.  In this paper we address the problem of balancing the information exposure} in a social network. We assume that two opposing campaigns (or viewpoints) are present in the network, and that network nodes have different preferences towards these campaigns. Our goal is to find two sets of nodes to employ in the respective campaigns, so that the overall information exposure for the two campaigns is balanced. We formally define the problem, characterize its hardness, develop approximation algorithms, and present experimental evaluation results.  Our model is inspired by the literature on influence maximization, but we offer significant novelties. First, balance of information exposure is modeled by a symmetric difference function, which is neither monotone nor submodular, and thus, not amenable to existing approaches. Second, while previous papers consider a setting with selfish agents and provide bounds on best response strategies (i.e., move of the last player), we consider a setting with a centralized agent and provide bounds for a global objective function."
https://www.youtube.com/watch?v=B32-J8kJXi8,"Recommendation for e-commerce with a mix of durable and nondurable goods has characteristics that distinguish it from the well-studied media recommendation problem. The demand for items is a combined effect of form utility and time utility, i.e., a product must both be intrinsically appealing to a consumer and the time must be right for purchase. In particular for durable goods, time utility is a function of inter-purchase duration within product category because consumers are unlikely to purchase two items in the same category in close temporal succession. Moreover, purchase data, in contrast to ratings data, is implicit with non-purchases not necessarily indicating dislike. Together, these issues give rise to the positive-unlabeled demand-aware recommendation problem that we pose via joint low-rank tensor completion and product category inter-purchase duration vector estimation. We further relax this problem and propose a highly scalable alternating minimization approach with which we can solve problems with millions of users and millions of items in a single thread. We also show superior prediction accuracies on multiple real-world data sets."
https://youtu.be/OyjXG44j-gs,"This paper focuses on style transfer on the basis of non-parallel text. This is an instance of a broad family of problems including machine translation, decipherment, and sentiment modification. The key challenge is to separate the content from other aspects such as style. We assume a shared latent content distribution across different text corpora, and propose a method that leverages refined alignment of latent representations to perform style transfer. The transferred sentences from one style should match example sentences from the other style as a population. We demonstrate the effectiveness of this cross-alignment method on three tasks: sentiment modification, decipherment of word substitution ciphers, and recovery of word order."
https://www.youtube.com/watch?v=9gQt6Vqb854,"Despite the growing prominence of generative adversarial   networks (GANs), optimization in GANs is still a poorly understood topic.  In this paper, we analyze   the ``gradient descent'' form of GAN optimization i.e., the natural   setting where we simultaneously take small gradient steps in both generator   and discriminator parameters.  We show that even though GAN optimization   does \emph{not}    correspond to a convex-concave game (even for simple parameterizations), under   proper conditions, equilibrium points of this  optimization    procedure are still \emph{locally asymptotically stable} for the traditional   GAN formulation. On the other hand, we show that the recently proposed   Wasserstein GAN can have non-convergent limit cycles near equilibrium.   Motivated by this stability analysis, we    propose an additional regularization term for gradient descent GAN updates,   which \emph{is} able to guarantee local stability for both the WGAN and the   traditional GAN, and also shows practical promise in speeding up   convergence and addressing mode collapse."
http://users.cecs.anu.edu.au/~rnock/docs/nips17-ncmqw-video/index.html,"Nowozin \textit{et al} showed last year how to extend the GAN \textit{principle} to all $f$-divergences. The approach is elegant but falls short of a full description of the supervised game, and says little about the key player, the generator: for example, what does the generator actually converge to if solving the GAN game means convergence in some space of parameters? How does that provide hints on the generator's design and compare to the flourishing but almost exclusively experimental literature on the subject? In this paper, we unveil a broad class of distributions for which such convergence happens --- namely, deformed exponential families, a wide superset of exponential families ---. We show that current deep architectures are able to factorize a very large number of such densities using an especially compact design, hence displaying the power of deep architectures and their concinnity in the $f$-GAN game. This result holds given a sufficient condition on \textit{activation functions} ---  which turns out to be satisfied by popular choices. The key to our results is a variational generalization of an old theorem that relates the KL divergence between regular exponential families and divergences between their natural parameters. We complete this picture with additional results and experimental insights on how these results may be used to ground further improvements of GAN architectures, via (i) a principled design of the activation functions in the generator and (ii) an explicit integration of proper composite losses' link function in the discriminator."
https://youtu.be/a_eC16bL0mE,"Recently, a new class of machine learning algorithms has emerged, where models and discriminators are generated in a competitive setting. The most prominent example is Generative Adversarial Networks (GANs). In this paper we examine how these algorithms relate to the famous Turing test, and derive what - from a Turing perspective - can be considered their defining features. Based on these features, we outline directions for generalizing GANs - resulting in the family of algorithms referred to as Turing Learning. One such direction is to allow the discriminators to interact with the processes from which the data samples are obtained, making them ""interrogators"", as in the Turing test. We validate this idea using two case studies. In the first case study, a computer infers the behavior of an agent while controlling its environment. In the second case study, a robot infers its own sensor configuration while controlling its movements. The results confirm that by allowing discriminators to interrogate, the accuracy of models is improved."
https://youtu.be/24A8tWs6aug,"Generative adversarial networks (GANs) can implicitly learn rich distributions over images, audio, and data which are hard to model with an explicit likelihood.  We present a practical Bayesian formulation for unsupervised and semi-supervised learning with GANs.  Within this framework, we use stochastic gradient Hamiltonian Monte Carlo to marginalize the weights of the generator and discriminator networks.  The resulting approach is straightforward and obtains good performance without any standard interventions such as feature matching or mini-batch discrimination. By exploring an expressive posterior over the parameters of the generator, the Bayesian GAN avoids mode-collapse, produces interpretable and diverse candidate samples, and provides state-of-the-art quantitative results for semi-supervised learning on benchmarks including SVHN, CelebA, and CIFAR-10, outperforming DCGAN, Wasserstein GANs, and DCGAN ensembles."
https://youtu.be/PaOaV2zDl_Y,"Generative Adversarial Nets (GANs) have shown promise in image generation and semi-supervised learning (SSL). However, existing GANs in SSL have two problems: (1) the generator and the discriminator (i.e. the classifier) may not be optimal at the same time; and (2) the generator cannot control the semantics of the generated samples. The problems essentially arise from the two-player formulation, where a single discriminator shares incompatible roles of identifying fake samples and predicting labels and it only estimates the data without considering the labels. To address the problems, we present triple generative adversarial net (Triple-GAN), which consists of three players---a generator, a discriminator and a classifier. The generator and the classifier characterize the conditional distributions between images and labels, and the discriminator solely focuses on identifying fake image-label pairs. We design compatible utilities to ensure that the distributions characterized by the classifier and the generator both converge to the data distribution. Our results on various datasets demonstrate that Triple-GAN as a unified model can simultaneously (1) achieve the state-of-the-art classification results among deep generative models, and (2) disentangle the classes and styles of the input and transfer smoothly in the data space via interpolation in the latent space class-conditionally."
http://videolectures.net/deeplearning2017_makhzani_pixel_gan/,"In this paper, we describe the ""PixelGAN autoencoder"", a generative autoencoder in which the generative path is a convolutional autoregressive neural network on pixels (PixelCNN) that is conditioned on a latent code, and the recognition path uses a generative adversarial network (GAN) to impose a prior distribution on the latent code. We show that different priors result in different decompositions of information between the latent code and the autoregressive decoder. For example, by imposing a Gaussian distribution as the prior, we can achieve a global vs. local decomposition, or by imposing a categorical distribution as the prior, we can disentangle the style and content information of images in an unsupervised fashion. We further show how the PixelGAN autoencoder with a categorical prior can be directly used in semi-supervised settings and achieve competitive semi-supervised classification results on the MNIST, SVHN and NORB datasets."
https://youtu.be/eh2LAOjW78A,"Data augmentation is a ubiquitous technique for increasing the size of labeled training sets by leveraging task-specific data transformations that preserve class labels. While it is often easy for domain experts to specify individual transformations, constructing and tuning the more sophisticated compositions typically needed to achieve state-of-the-art results is a time-consuming manual task in practice. We propose a method for automating this process by learning a generative sequence model over user-specified transformation functions using a generative adversarial approach. Our method can make use of arbitrary, non-deterministic transformation functions, is robust to misspecified user input, and is trained on unlabeled data. The learned transformation model can then be used to perform data augmentation for any end discriminative model. In our experiments, we show the efficacy of our approach on both image and text datasets, achieving improvements of 4.0 accuracy points on CIFAR-10, 1.4 F1 points on the ACE relation extraction task, and 3.4 accuracy points when using domain-specific transformation operations on a medical imaging dataset as compared to standard heuristic augmentation approaches."
https://youtu.be/nlyXoX2aIek,"Unsupervised image-to-image translation aims at learning a joint distribution of images in different domains by using images from the marginal distributions in individual domains. Since there exists an infinite set of joint distributions that can arrive the given marginal distributions, one could infer nothing about the joint distribution from the marginal distributions without additional assumptions. To address the problem, we make a shared-latent space assumption and propose an unsupervised image-to-image translation framework based on Coupled GANs. We compare the proposed framework with competing approaches and present high quality image translation results on various challenging unsupervised image translation tasks, including street scene image translation, animal image translation, and face image translation. We also apply the proposed framework to domain adaptation and achieve state-of-the-art performance on benchmark datasets. Code and additional results are available in https://github.com/mingyuliutw/unit."
https://youtu.be/BrAu1gZVCP4,"Background: Deep learning models are typically trained using stochastic gradient descent or one of its variants. These methods update the weights using their gradient, estimated from a small fraction of the training data. It has been observed that when using large batch sizes there is a persistent degradation in generalization performance -  known as the ""generalization gap"" phenomenon. Identifying the origin of this gap and closing it had remained an open problem.  Contributions: We examine the initial high learning rate training phase. We find that the weight distance from its initialization grows logarithmically with the number of weight updates. We therefore propose a ""random walk on a random landscape"" statistical model which is known to exhibit similar ""ultra-slow"" diffusion behavior. Following this hypothesis we conducted experiments to show empirically that the ""generalization gap"" stems from the relatively small number of updates rather than the batch size, and can be completely eliminated by adapting the training regime used. We further investigate different techniques to train models in the large-batch regime and present a novel algorithm named ""Ghost Batch Normalization"" which enables significant decrease in the generalization gap without increasing the number of updates. To validate our findings we conduct several additional experiments on MNIST, CIFAR-10, CIFAR-100 and ImageNet. Finally, we reassess common practices and beliefs concerning training of deep models and suggest they may not be optimal to achieve good generalization."
https://www.youtube.com/watch?v=14R3kkO1jSY,"The design of good heuristics or approximation algorithms for NP-hard combinatorial optimization problems often requires significant specialized knowledge and trial-and-error. Can we automate this challenging, tedious process, and learn the algorithms instead? In many real-world applications, it is typically the case that the same optimization problem is solved again and again on a regular basis, maintaining the same problem structure but differing in the data. This provides an opportunity for learning heuristic algorithms that exploit the structure of such recurring problems.  In this paper, we propose a unique combination of reinforcement learning and graph embedding to address this challenge. The learned greedy policy behaves like a meta-algorithm that incrementally constructs a solution, and the action is determined by the output of a graph embedding network capturing the current state of the solution. We show that our framework can be applied to a diverse range of optimization problems over graphs, and learns effective algorithms for the Minimum Vertex Cover, Maximum Cut and Traveling Salesman problems."
https://youtu.be/kqi0ubma-L0,"In large part, rodents “see” the world through their whiskers, a powerful tactile sense enabled by a series of brain areas that form the whisker-trigeminal system. Raw sensory data arrives in the form of mechanical input to the exquisitely sensitive, actively-controllable whisker array, and is processed through a sequence of neural circuits, eventually arriving in cortical regions that communicate with decision making and memory areas. Although a long history of experimental studies has characterized many aspects of these processing stages, the computational operations of the whisker-trigeminal system remain largely unknown. In the present work, we take a goal-driven deep neural network (DNN) approach to modeling these computations. First, we construct a biophysically-realistic model of the rat whisker array. We then generate a large dataset of whisker sweeps across a wide variety of 3D objects in highly-varying poses, angles, and speeds. Next, we train DNNs from several distinct architectural families to solve a shape recognition task in this dataset. Each architectural family represents a structurally-distinct hypothesis for processing in the whisker-trigeminal system, corresponding to different ways in which spatial and temporal information can be integrated. We find that most networks perform poorly on the challenging shape recognition task, but that specific architectures from several families can achieve reasonable performance levels. Finally, we show that Representational Dissimilarity Matrices (RDMs), a tool for comparing population codes between neural systems, can separate these higher performing networks with data of a type that could plausibly be collected in a neurophysiological or imaging experiment. Our results are a proof-of-concept that DNN models of the whisker-trigeminal system are potentially within reach."
http://vda.csail.mit.edu,"We introduce a paradigm for understanding physical scenes without human annotations. At the core of our system is a physical world representation that is first recovered by a perception module and then utilized by physics and graphics engines. During training, the perception module and the generative models learn by visual de-animation --- interpreting and reconstructing the visual information stream. During testing, the system first recovers the physical world state, and then uses the generative models for reasoning and future prediction.  Even more so than forward simulation, inverting a physics or graphics engine is a computationally hard problem; we overcome this challenge by using a convolutional inversion network. Our system quickly recognizes the physical world state from appearance and motion cues, and has the flexibility to incorporate both differentiable and non-differentiable physics and graphics engines. We evaluate our system on both synthetic and real datasets involving multiple physical scenes, and demonstrate that our system performs well on both physical state estimation and reasoning problems. We further show that the knowledge learned on the synthetic dataset generalizes to constrained real images."
http://sound.csail.mit.edu/,"What can we infer from hearing an object falling onto the ground? Based on knowledge of the physical world, humans are able to infer rich information from such limited data: rough shape of the object, its material, the height of falling, etc. In this paper, we aim to approximate such competency. We first mimic the human knowledge about the physical world using a fast physics-based generative model. Then, we present an analysis-by-synthesis approach to infer properties of the falling object. We further approximate human past experience by directly mapping audio to object properties using deep learning with self-supervision. We evaluate our method through behavioral studies, where we compare human predictions with ours on inferring object shape, material, and initial height of falling. Results show that our method achieves near-human performance, without any annotations."
https://youtu.be/RHSNDxUh2C8,"This paper proposes Deep Hyperalignment (DHA) as a regularized, deep extension, scalable Hyperalignment (HA) method, which is well-suited for applying functional alignment to fMRI datasets with nonlinearity, high-dimensionality (broad ROI), and a large number of subjects. Unlink previous methods, DHA is not limited by a restricted fixed kernel function. Further, it uses a parametric approach, rank-m Singular Value Decomposition (SVD), and stochastic gradient descent for optimization. Therefore, DHA has a suitable time complexity for large datasets, and DHA does not require the training data when it computes the functional alignment for a new subject. Experimental studies on multi-subject fMRI analysis confirm that the DHA method achieves superior performance to other state-of-the-art HA algorithms."
https://youtu.be/JnqhV0KO-1I,"Due to their simplicity and excellent performance, parallel asynchronous variants of stochastic gradient descent have become popular methods to solve a wide range of large-scale optimization problems on multi-core architectures. Yet, despite their practical success, support for nonsmooth objectives is still lacking, making them unsuitable for many problems of interest in machine learning, such as the Lasso, group Lasso or empirical risk minimization with convex constraints.   In this work, we propose and analyze ProxASAGA, a fully asynchronous sparse method inspired by SAGA, a variance reduced incremental gradient algorithm. The proposed method is easy to implement and significantly outperforms the state of the art on several nonsmooth, large-scale problems. We prove that our method achieves a theoretical linear speedup with respect to the sequential version under assumptions on the sparsity of gradients and block-separability of the proximal term. Empirical benchmarks on a multi-core architecture illustrate practical speedups of up to 12x on a 20-core machine."
https://www.youtube.com/watch?v=HSRmofSZfHc&feature=youtu.be,"Affine policies (or control) are widely used as a solution approach in dynamic optimization where computing an optimal adjustable solution is usually intractable. While the worst case performance of affine policies can be significantly bad, the empirical performance is observed to be near-optimal for a large class of problem instances. For instance, in the two-stage dynamic robust optimization problem with linear covering constraints and uncertain right hand side, the worst-case approximation bound for affine policies is $O(\sqrt m)$ that is also tight (see Bertsimas and Goyal (2012)), whereas observed empirical performance is near-optimal. In this paper, we aim to address this stark-contrast between the worst-case and the empirical performance of affine policies. In particular, we  show that affine policies give a good approximation for the two-stage adjustable robust optimization problem with high probability on random instances where the constraint coefficients are generated i.i.d. from a large class of distributions; thereby, providing a theoretical justification of the observed empirical performance. On the other hand, we also present a distribution such that the performance bound for affine policies on instances generated according to that distribution is $\Omega(\sqrt m)$ with high probability; however, the constraint coefficients are not i.i.d.. This demonstrates that the empirical performance of affine policies can depend on the generative model for instances."
https://youtu.be/6zN_5FQEz7A,"In this paper, we provide a rigorous theoretical study of clustering with noisy queries. Given a set of $n$ elements, our goal is to recover the true clustering by asking minimum number of pairwise queries to an oracle. Oracle can answer queries of the form ``do elements $u$ and $v$ belong to the same cluster?''-the queries can be asked interactively (adaptive queries), or non-adaptively up-front, but its answer can be erroneous with probability $p$. In this paper, we provide the first information theoretic lower bound on the number of queries for clustering with noisy oracle in both situations.  We design novel algorithms that closely match this query complexity lower bound, even when the number of clusters is unknown.  Moreover, we design computationally efficient algorithms both for the adaptive and non-adaptive settings. The problem captures/generalizes multiple application scenarios. It is directly motivated by the growing body of work that use crowdsourcing for {\em entity resolution}, a fundamental and challenging data mining task aimed to identify all records in a database referring to the same entity. Here crowd represents the noisy oracle, and the number of queries directly relates to the cost of crowdsourcing. Another application comes from the problem of sign edge prediction in social network, where social interactions can be both positive and negative, and one must identify the sign of all pair-wise interactions by  querying a few pairs. Furthermore, clustering with noisy oracle is intimately connected to correlation clustering, leading to improvement therein. Finally, it introduces a new direction of study in the popular stochastic block model where one has an incomplete stochastic block model matrix to recover the clusters."
